B1: Input Frequency | C1: Tone Frequncy | D1: Sampling Rate | E1: k | F1: a1
A2: Decimal Representation | B2: 770 | C2: 770.00 | D2: 8000.00 | E2: =C2/D2 -> 9.6250000000000002E-2 | F2: =2*COS(2*PI()*E2) -> 1.6452810360417196
A3: Hex Representation | F3: =DEC2HEX(F2*2^8) -> 1A5
A5: Sample # | B5: Input Amplitude | C5: InputFrequency/ SamplingRat4e | D5: Input Sample | E5: a1 | F5: D0 | G5: D2 | H5: D1 | I5: D1(hex) | J5: P (Dec) | K5: P(Hex) | L5: Program Result | M5: Program Result
A6: 0 | B6: 100 | C6: =B2/D2 -> 9.6250000000000002E-2 | D6: =B6*SIN(2*PI()*A6*C6) -> 0.00 | E6: =F2 -> 1.6452810360417196 | F6: 0.00 | G6: 0.00 | H6: 0.00 | I6: =DEC2HEX(H6) -> 0 | J6: =F6^2+G6^2-E6*F6*G6 -> 0 | K6: =DEC2HEX(J6) -> 0 | L6: 0000000000 | M6: =HEX2DEC(L6) -> 0
A7: =A6+1 -> 1 | B7: =B6 -> 100 | C7: =C6 -> 9.6250000000000002E-2 | D7: =B7*SIN(2*PI()*A7*C7) -> 56.856185073426403 | E7: =E6 -> 1.6452810360417196 | F7: =D7+E7*H6-G6 -> 56.856185073426403 | G7: =H6 -> 0.00 | H7: =F7 -> 56.856185073426403 | I7: =DEC2HEX(H7) -> 38 | J7: =G7^2+H7^2-E7*G7*H7 -> 3232.6257811037153 | K7: =DEC2HEX(J7) -> CA0 | L7: 0000000CB1 | M7: =HEX2DEC(L7) -> 3249
A8: =A7+1 -> 2 | B8: =B7 -> 100 | C8: =C7 -> 9.6250000000000002E-2 | D8: =B8*SIN(2*PI()*A8*C8) -> 93.544403082986733 | E8: =E7 -> 1.6452810360417196 | F8: =D8+E8*H7-G7 -> 187.08880616597349 | G8: =H7 -> 56.856185073426403 | H8: =F8 -> 187.08880616597349 | I8: =DEC2HEX(H8) -> BB | J8: =G8^2+H8^2-E8*G8*H8 -> 20733.736477408314 | K8: =DEC2HEX(J8) -> 50FD | L8: 00000050EF | M8: =HEX2DEC(L8) -> 20719
A9: =A8+1 -> 3 | B9: =B8 -> 100 | C9: =C8 -> 9.6250000000000002E-2 | D9: =B9*SIN(2*PI()*A9*C9) -> 97.050647346854248 | E9: =E8 -> 1.6452810360417196 | F9: =D9+E9*H8-G8 -> 348.00812711398919 | G9: =H8 -> 187.08880616597349 | H9: =F9 -> 348.00812711398919 | I9: =DEC2HEX(H9) -> 15C | J9: =G9^2+H9^2-E9*G9*H9 -> 48990.220928738723 | K9: =DEC2HEX(J9) -> BF5E | L9: 000000BE94 | M9: =HEX2DEC(L9) -> 48788
A10: =A9+1 -> 4 | B10: =B9 -> 100 | C10: =C9 -> 9.6250000000000002E-2 | D10: =B10*SIN(2*PI()*A10*C10) -> 66.131186532365177 | E10: =E9 -> 1.6452810360417196 | F10: =D10+E10*H9-G9 -> 451.61355229543432 | G10: =H9 -> 348.00812711398919 | H10: =F10 -> 451.61355229543432 | I10: =DEC2HEX(H10) -> 1C3 | J10: =G10^2+H10^2-E10*G10*H10 -> 66483.556257452612 | K10: =DEC2HEX(J10) -> 103B3 | L10: 0000010184 | M10: =HEX2DEC(L10) -> 65924
A11: =A10+1 -> 5 | B11: =B10 -> 100 | C11: =C10 -> 9.6250000000000002E-2 | D11: =B11*SIN(2*PI()*A11*C11) -> 11.753739745783754 | E11: =E10 -> 1.6452810360417196 | F11: =D11+E11*H10-G10 -> 406.77682584290801 | G11: =H10 -> 451.61355229543432 | H11: =F11 -> 406.77682584290801 | I11: =DEC2HEX(H11) -> 196 | J11: =G11^2+H11^2-E11*G11*H11 -> 67174.308247510751 | K11: =DEC2HEX(J11) -> 10666 | L11: 00000104D4 | M11: =HEX2DEC(L11) -> 66772
A12: =A11+1 -> 6 | B12: =B11 -> 100 | C12: =C11 -> 9.6250000000000002E-2 | D12: =B12*SIN(2*PI()*A12*C12) -> -46.792981426057317 | E12: =E11 -> 1.6452810360417196 | F12: =D12+E12*H11-G11 -> 170.85566373909029 | G12: =H11 -> 406.77682584290801 | H12: =F12 -> 170.85566373909029 | I12: =DEC2HEX(H12) -> AA | J12: =G12^2+H12^2-E12*G12*H12 -> 80311.806911946784 | K12: =DEC2HEX(J12) -> 139B7 | L12: 00000139DD | M12: =HEX2DEC(L12) -> 80349
A13: =A12+1 -> 7 | B13: =B12 -> 100 | C13: =C12 -> 9.6250000000000002E-2 | D13: =B13*SIN(2*PI()*A13*C13) -> -88.741344705928341 | E13: =E12 -> 1.6452810360417196 | F13: =D13+E13*H12-G12 -> -214.41258709859022 | G13: =H12 -> 170.85566373909029 | H13: =F13 -> -214.41258709859022 | I13: =DEC2HEX(H13) -> FFFFFFFF2A | J13: =G13^2+H13^2-E13*G13*H13 -> 135436.99073346154 | K13: =DEC2HEX(J13) -> 2110C | L13: 0000021370 | M13: =HEX2DEC(L13) -> 136048
A14: =A13+1 -> 8 | B14: =B13 -> 100 | C14: =C13 -> 9.6250000000000002E-2 | D14: =B14*SIN(2*PI()*A14*C14) -> -99.211470131447783 | E14: =E13 -> 1.6452810360417196 | F14: =D14+E14*H13-G13 -> -622.83609731249203 | G14: =H13 -> -214.41258709859022 | H14: =F14 -> -622.83609731249203 | I14: =DEC2HEX(H14) -> FFFFFFFD92 | J14: =G14^2+H14^2-E14*G14*H14 -> 214180.31717860681 | K14: =DEC2HEX(J14) -> 344A4 | L14: 00000345D9 | M14: =HEX2DEC(L14) -> 214489
A15: =A14+1 -> 9 | B15: =B14 -> 100 | C15: =C14 -> 9.6250000000000002E-2 | D15: =B15*SIN(2*PI()*A15*C15) -> -74.48940565916223 | E15: =E14 -> 1.6452810360417196 | F15: =D15+E15*H14-G14 -> -884.81723803105024 | G15: =H14 -> -622.83609731249203 | H15: =F15 -> -884.81723803105024 | I15: =DEC2HEX(H15) -> FFFFFFFC8C | J15: =G15^2+H15^2-E15*G15*H15 -> 264118.36117770395 | K15: =DEC2HEX(J15) -> 407B6 | L15: 0000040717 | M15: =HEX2DEC(L15) -> 263959
A16: =A15+1 -> 10 | B16: =B15 -> 100 | C16: =C15 -> 9.6250000000000002E-2 | D16: =B16*SIN(2*PI()*A16*C16) -> -23.344536385590519 | E16: =E15 -> 1.6452810360417196 | F16: =D16+E16*H15-G15 -> -856.28146116839775 | G16: =H15 -> -884.81723803105024 | H16: =F16 -> -856.28146116839775 | I16: =DEC2HEX(H16) -> FFFFFFFCA8 | J16: =G16^2+H16^2-E16*G16*H16 -> 269568.03496828536 | K16: =DEC2HEX(J16) -> 41D00 | L16: 0000041CAA | M16: =HEX2DEC(L16) -> 269482
A17: =A16+1 -> 11 | B17: =B16 -> 100 | C17: =C16 -> 9.6250000000000002E-2 | D17: =B17*SIN(2*PI()*A17*C17) -> 36.081082648764081 | E17: =E16 -> 1.6452810360417196 | F17: =D17+E17*H16-G16 -> -487.92532889464451 | G17: =H16 -> -856.28146116839775 | H17: =F17 -> -487.92532889464451 | I17: =DEC2HEX(H17) -> FFFFFFFE19 | J17: =G17^2+H17^2-E17*G17*H17 -> 283888.32474446204 | K17: =DEC2HEX(J17) -> 454F0 | L17: 000004541B | M17: =HEX2DEC(L17) -> 283675
A18: =A17+1 -> 12 | B18: =B17 -> 100 | C18: =C17 -> 9.6250000000000002E-2 | D18: =B18*SIN(2*PI()*A18*C18) -> 82.708057427456154 | E18: =E17 -> 1.6452810360417196 | F18: =D18+E18*H17-G17 -> 136.21522796107649 | G18: =H17 -> -487.92532889464451 | H18: =F18 -> 136.21522796107649 | I18: =DEC2HEX(H18) -> 88 | J18: =G18^2+H18^2-E18*G18*H18 -> 365975.79790554271 | K18: =DEC2HEX(J18) -> 59597 | L18: 00000595A8 | M18: =HEX2DEC(L18) -> 365992
A19: =A18+1 -> 13 | B19: =B18 -> 100 | C19: =C18 -> 9.6250000000000002E-2 | D19: =B19*SIN(2*PI()*A19*C19) -> 99.996915764478985 | E19: =E18 -> 1.6452810360417196 | F19: =D19+E19*H18-G18 -> 812.03457604358243 | G19: =H18 -> 136.21522796107649 | H19: =F19 -> 812.03457604358243 | I19: =DEC2HEX(H19) -> 32C | J19: =G19^2+H19^2-E19*G19*H19 -> 495967.77901685075 | K19: =DEC2HEX(J19) -> 7915F | L19: 0000078FEE | M19: =HEX2DEC(L19) -> 495598
A20: =A19+1 -> 14 | B20: =B19 -> 100 | C20: =C19 -> 9.6250000000000002E-2 | D20: =B20*SIN(2*PI()*A20*C20) -> 81.814971742502308 | E20: =E19 -> 1.6452810360417196 | F20: =D20+E20*H19-G19 -> 1281.6248323561099 | G20: =H19 -> 812.03457604358243 | H20: =F20 -> 1281.6248323561099 | I20: =DEC2HEX(H20) -> 501 | J20: =G20^2+H20^2-E20*G20*H20 -> 589679.43343402119 | K20: =DEC2HEX(J20) -> 8FF6F | L20: 000008FA21 | M20: =HEX2DEC(L20) -> 588321
A21: =A20+1 -> 15 | B21: =B20 -> 100 | C21: =C20 -> 9.6250000000000002E-2 | D21: =B21*SIN(2*PI()*A21*C21) -> 34.611705707749351 | E21: =E20 -> 1.6452810360417196 | F21: =D21+E21*H20-G20 -> 1331.2101616598225 | G21: =H20 -> 1281.6248323561099 | H21: =F21 -> 1331.2101616598225 | I21: =DEC2HEX(H21) -> 533 | J21: =G21^2+H21^2-E21*G21*H21 -> 607648.98601401923 | K21: =DEC2HEX(J21) -> 945A0 | L21: 0000093C67 | M21: =HEX2DEC(L21) -> 605287
A22: =A21+1 -> 16 | B22: =B21 -> 100 | C22: =C21 -> 9.6250000000000002E-2 | D22: =B22*SIN(2*PI()*A22*C22) -> -24.868988716485475 | E22: =E21 -> 1.6452810360417196 | F22: =D22+E22*H21-G21 -> 883.72101289234251 | G22: =H21 -> 1331.2101616598225 | H22: =F22 -> 883.72101289234251 | I22: =DEC2HEX(H22) -> 373 | J22: =G22^2+H22^2-E22*G22*H22 -> 617544.45161050954 | K22: =DEC2HEX(J22) -> 96C48 | L22: 00000967BB | M22: =HEX2DEC(L22) -> 616379
A23: =A22+1 -> 17 | B23: =B22 -> 100 | C23: =C22 -> 9.6250000000000002E-2 | D23: =B23*SIN(2*PI()*A23*C23) -> -75.528181228518392 | E23: =E22 -> 1.6452810360417196 | F23: =D23+E23*H22-G22 -> 47.231080775010241 | G23: =H22 -> 883.72101289234251 | H23: =F23 -> 47.231080775010241 | I23: =DEC2HEX(H23) -> 2F | J23: =G23^2+H23^2-E23*G23*H23 -> 714521.05632520455 | K23: =DEC2HEX(J23) -> AE719 | L23: 00000AEA06 | M23: =HEX2DEC(L23) -> 715270
A24: =A23+1 -> 18 | B24: =B23 -> 100 | C24: =C23 -> 9.6250000000000002E-2 | D24: =B24*SIN(2*PI()*A24*C24) -> -99.396095545517966 | E24: =E23 -> 1.6452810360417196 | F24: =D24+E24*H23-G23 -> -905.40870692698149 | G24: =H23 -> 47.231080775010241 | H24: =F24 -> -905.40870692698149 | I24: =DEC2HEX(H24) -> FFFFFFFC77 | J24: =G24^2+H24^2-E24*G24*H24 -> 892353.56489969185 | K24: =DEC2HEX(J24) -> D9DC1 | L24: 00000DA1A7 | M24: =HEX2DEC(L24) -> 893351
A25: =A24+1 -> 19 | B25: =B24 -> 100 | C25: =C24 -> 9.6250000000000002E-2 | D25: =B25*SIN(2*PI()*A25*C25) -> -88.006329829113199 | E25: =E24 -> 1.6452810360417196 | F25: =D25+E25*H24-G24 -> -1624.8891859781411 | G25: =H24 -> -905.40870692698149 | H25: =F25 -> -1624.8891859781411 | I25: =DEC2HEX(H25) -> FFFFFFF9A8 | J25: =G25^2+H25^2-E25*G25*H25 -> 1039510.7326095146 | K25: =DEC2HEX(J25) -> FDC96 | L25: 00000FE163 | M25: =HEX2DEC(L25) -> 1040739
A26: =A25+1 -> 20 | B26: =B25 -> 100 | C26: =C25 -> 9.6250000000000002E-2 | D26: =B26*SIN(2*PI()*A26*C26) -> -45.399049973954639 | E26: =E25 -> 1.6452810360417196 | F26: =D26+E26*H25-G25 -> -1813.3897064060754 | G26: =H25 -> -1624.8891859781411 | H26: =F26 -> -1813.3897064060754 | I26: =DEC2HEX(H26) -> FFFFFFF8EB | J26: =G26^2+H26^2-E26*G26*H26 -> 1080732.2073802669 | K26: =DEC2HEX(J26) -> 107D9C | L26: 0000107F2D | M26: =HEX2DEC(L26) -> 1081133
A27: =A26+1 -> 21 | B27: =B26 -> 100 | C27: =C26 -> 9.6250000000000002E-2 | D27: =B27*SIN(2*PI()*A27*C27) -> 13.312133852655331 | E27: =E26 -> 1.6452810360417196 | F27: =D27+E27*H26-G26 -> -1345.3343750723811 | G27: =H26 -> -1813.3897064060754 | H27: =F27 -> -1345.3343750723811 | I27: =DEC2HEX(H27) -> FFFFFFFABF | J27: =G27^2+H27^2-E27*G27*H27 -> 1084453.6784421974 | K27: =DEC2HEX(J27) -> 108C25 | L27: 0000108E3E | M27: =HEX2DEC(L27) -> 1084990
A28: =A27+1 -> 22 | B28: =B27 -> 100 | C28: =C27 -> 9.6250000000000002E-2 | D28: =B28*SIN(2*PI()*A28*C28) -> 67.301251350977182 | E28: =E27 -> 1.6452810360417196 | F28: =D28+E28*H27-G27 -> -332.76217668457434 | G28: =H27 -> -1345.3343750723811 | H28: =F28 -> -332.76217668457434 | I28: =DEC2HEX(H28) -> FFFFFFFEB4 | J28: =G28^2+H28^2-E28*G28*H28 -> 1184101.7639771607 | K28: =DEC2HEX(J28) -> 121165 | L28: 0000121578 | M28: =HEX2DEC(L28) -> 1185144
A29: =A28+1 -> 23 | B29: =B28 -> 100 | C29: =C28 -> 9.6250000000000002E-2 | D29: =B29*SIN(2*PI()*A29*C29) -> 97.417338696984899 | E29: =E28 -> 1.6452810360417196 | F29: =D29+E29*H28-G28 -> 895.2644149582718 | G29: =H28 -> -332.76217668457434 | H29: =F29 -> 895.2644149582718 | I29: =DEC2HEX(H29) -> 37F | J29: =G29^2+H29^2-E29*G29*H29 -> 1402374.9351896313 | K29: =DEC2HEX(J29) -> 156606 | L29: 0000156681 | M29: =HEX2DEC(L29) -> 1402497
A30: =A29+1 -> 24 | B30: =B29 -> 100 | C30: =C29 -> 9.6250000000000002E-2 | D30: =B30*SIN(2*PI()*A30*C30) -> 92.977648588825176 | E30: =E29 -> 1.6452810360417196 | F30: =D30+E30*H29-G29 -> 1898.7013894472288 | G30: =H29 -> 895.2644149582718 | H30: =F30 -> 1898.7013894472288 | I30: =DEC2HEX(H30) -> 76A | J30: =G30^2+H30^2-E30*G30*H30 -> 1609851.170480201 | K30: =DEC2HEX(J30) -> 18907B | L30: 0000188A7E | M30: =HEX2DEC(L30) -> 1608318
A31: =A30+1 -> 25 | B31: =B30 -> 100 | C31: =C30 -> 9.6250000000000002E-2 | D31: =B31*SIN(2*PI()*A31*C31) -> 55.557023301960264 | E31: =E30 -> 1.6452810360417196 | F31: =D31+E31*H30-G30 -> 2284.1899975072774 | G31: =H30 -> 1898.7013894472288 | H31: =F31 -> 2284.1899975072774 | I31: =DEC2HEX(H31) -> 8EC | J31: =G31^2+H31^2-E31*G31*H31 -> 1687015.7414345657 | K31: =DEC2HEX(J31) -> 19BDE7 | L31: 000019B55F | M31: =HEX2DEC(L31) -> 1684831
A32: =A31+1 -> 26 | B32: =B31 -> 100 | C32: =C31 -> 9.6250000000000002E-2 | D32: =B32*SIN(2*PI()*A32*C32) -> -1.5707317311822639 | E32: =E31 -> 1.6452810360417196 | F32: =D32+E32*H31-G31 -> 1857.8623644364952 | G32: =H31 -> 2284.1899975072774 | H32: =F32 -> 1857.8623644364952 | I32: =DEC2HEX(H32) -> 741 | J32: =G32^2+H32^2-E32*G32*H32 -> 1687079.8885870194 | K32: =DEC2HEX(J32) -> 19BE27 | L32: 000019B7DA | M32: =HEX2DEC(L32) -> 1685466
A33: =A32+1 -> 27 | B33: =B32 -> 100 | C33: =C32 -> 9.6250000000000002E-2 | D33: =B33*SIN(2*PI()*A33*C33) -> -58.141318431982981 | E33: =E32 -> 1.6452810360417196 | F33: =D33+E33*H32-G32 -> 714.37439984373532 | G33: =H32 -> 1857.8623644364952 | H33: =F33 -> 714.37439984373532 | I33: =DEC2HEX(H33) -> 2CA | J33: =G33^2+H33^2-E33*G33*H33 -> 1778351.0371302683 | K33: =DEC2HEX(J33) -> 1B22AF | L33: 00001B20F0 | M33: =HEX2DEC(L33) -> 1777904
A34: =A33+1 -> 28 | B34: =B33 -> 100 | C34: =C33 -> 9.6250000000000002E-2 | D34: =B34*SIN(2*PI()*A34*C34) -> -94.088076895422589 | E34: =E33 -> 1.6452810360417196 | F34: =D34+E34*H33-G33 -> -776.60378863533538 | G34: =H33 -> 714.37439984373532 | H34: =F34 -> -776.60378863533538 | I34: =DEC2HEX(H34) -> FFFFFFFCF8 | J34: =G34^2+H34^2-E34*G34*H34 -> 2026222.891118879 | K34: =DEC2HEX(J34) -> 1EEAEE | L34: 00001EEDF9 | M34: =HEX2DEC(L34) -> 2027001
A35: =A34+1 -> 29 | B35: =B34 -> 100 | C35: =C34 -> 9.6250000000000002E-2 | D35: =B35*SIN(2*PI()*A35*C35) -> -96.660010201690724 | E35: =E34 -> 1.6452810360417196 | F35: =D35+E35*H34-G34 -> -2088.765896005295 | G35: =H34 -> -776.60378863533538 | H35: =F35 -> -2088.765896005295 | I35: =DEC2HEX(H35) -> FFFFFFF7D8 | J35: =G35^2+H35^2-E35*G35*H35 -> 2297174.4607124166 | K35: =DEC2HEX(J35) -> 230D56 | L35: 0000231255 | M35: =HEX2DEC(L35) -> 2298453
A36: =A35+1 -> 30 | B36: =B35 -> 100 | C36: =C35 -> 9.6250000000000002E-2 | D36: =B36*SIN(2*PI()*A36*C36) -> -64.944804833018452 | E36: =E35 -> 1.6452810360417196 | F36: =D36+E36*H35-G35 -> -2724.9479336258855 | G36: =H35 -> -2088.765896005295 | H36: =F36 -> -2724.9479336258855 | I36: =DEC2HEX(H36) -> FFFFFFF55C | J36: =G36^2+H36^2-E36*G36*H36 -> 2423709.2909563817 | K36: =DEC2HEX(J36) -> 24FB9D | L36: 000025011A | M36: =HEX2DEC(L36) -> 2425114
A37: =A36+1 -> 31 | B37: =B36 -> 100 | C37: =C36 -> 9.6250000000000002E-2 | D37: =B37*SIN(2*PI()*A37*C37) -> -10.19244557950524 | E37: =E36 -> 1.6452810360417196 | F37: =D37+E37*H36-G36 -> -2404.73170896995 | G37: =H36 -> -2724.9479336258855 | H37: =F37 -> -2404.73170896995 | I37: =DEC2HEX(H37) -> FFFFFFF69C | J37: =G37^2+H37^2-E37*G37*H37 -> 2426929.7553100083 | K37: =DEC2HEX(J37) -> 250831 | L37: 00002506C9 | M37: =HEX2DEC(L37) -> 2426569
A38: =A37+1 -> 32 | B38: =B37 -> 100 | C38: =C37 -> 9.6250000000000002E-2 | D38: =B38*SIN(2*PI()*A38*C38) -> 48.175367410171518 | E38: =E37 -> 1.6452810360417196 | F38: =D38+E38*H37-G37 -> -1183.3361765003974 | G38: =H37 -> -2404.73170896995 | H38: =F38 -> -1183.3361765003974 | I38: =DEC2HEX(H38) -> FFFFFFFB61 | J38: =G38^2+H38^2-E38*G38*H38 -> 2501197.4681133674 | K38: =DEC2HEX(J38) -> 262A4D | L38: 0000262B84 | M38: =HEX2DEC(L38) -> 2501508
A39: =A38+1 -> 33 | B39: =B38 -> 100 | C39: =C38 -> 9.6250000000000002E-2 | D39: =B39*SIN(2*PI()*A39*C39) -> 89.454463983802441 | E39: =E38 -> 1.6452810360417196 | F39: =D39+E39*H38-G38 -> 547.26560249553154 | G39: =H38 -> -1183.3361765003974 | H39: =F39 -> 547.26560249553154 | I39: =DEC2HEX(H39) -> 223 | J39: =G39^2+H39^2-E39*G39*H39 -> 2765266.8052921388 | K39: =DEC2HEX(J39) -> 2A31D2 | L39: 00002A3019 | M39: =HEX2DEC(L39) -> 2764825
A40: =A39+1 -> 34 | B40: =B39 -> 100 | C40: =C39 -> 9.6250000000000002E-2 | D40: =B40*SIN(2*PI()*A40*C40) -> 99.002365771655747 | E40: =E39 -> 1.6452810360417196 | F40: =D40+E40*H39-G39 -> 2182.7442597358972 | G40: =H39 -> 547.26560249553154 | H40: =F40 -> 2182.7442597358972 | I40: =DEC2HEX(H40) -> 886 | J40: =G40^2+H40^2-E40*G40*H40 -> 3098516.7318572188 | K40: =DEC2HEX(J40) -> 2F4794 | L40: 00002F4086 | M40: =HEX2DEC(L40) -> 3096710
A41: =A40+1 -> 35 | B41: =B40 -> 100 | C41: =C40 -> 9.6250000000000002E-2 | D41: =B41*SIN(2*PI()*A41*C41) -> 73.432250943568562 | E41: =E40 -> 1.6452810360417196 | F41: =D41+E41*H40-G40 -> 3117.3943855204307 | G41: =H40 -> 2182.7442597358972 | H41: =F41 -> 3117.3943855204307 | I41: =DEC2HEX(H41) -> C2D | J41: =G41^2+H41^2-E41*G41*H41 -> 3287247.0736095943 | K41: =DEC2HEX(J41) -> 3228CF | L41: 0000320C97 | M41: =HEX2DEC(L41) -> 3280023
A42: =A41+1 -> 36 | B42: =B41 -> 100 | C42: =C41 -> 9.6250000000000002E-2 | D42: =B42*SIN(2*PI()*A42*C42) -> 21.814324139654392 | E42: =E41 -> 1.6452810360417196 | F42: =D42+E42*H41-G41 -> 2968.0599287634518 | G42: =H41 -> 3117.3943855204307 | H42: =F42 -> 2968.0599287634518 | I42: =DEC2HEX(H42) -> B98 | J42: =G42^2+H42^2-E42*G42*H42 -> 3304378.2041657101 | K42: =DEC2HEX(J42) -> 326BBA | L42: 0000324A7D | M42: =HEX2DEC(L42) -> 3295869
A43: =A42+1 -> 37 | B43: =B42 -> 100 | C43: =C42 -> 9.6250000000000002E-2 | D43: =B43*SIN(2*PI()*A43*C43) -> -37.541557122528388 | E43: =E42 -> 1.6452810360417196 | F43: =D43+E43*H42-G42 -> 1728.3567719868852 | G43: =H42 -> 2968.0599287634518 | H43: =F43 -> 1728.3567719868852 | I43: =DEC2HEX(H43) -> 6C0 | J43: =G43^2+H43^2-E43*G43*H43 -> 3356524.8390795216 | K43: =DEC2HEX(J43) -> 33376C | L43: 0000332611 | M43: =HEX2DEC(L43) -> 3352081
A44: =A43+1 -> 38 | B44: =B43 -> 100 | C44: =C43 -> 9.6250000000000002E-2 | D44: =B44*SIN(2*PI()*A44*C44) -> -83.580736136826999 | E44: =E43 -> 1.6452810360417196 | F44: =D44+E44*H43-G43 -> -208.00804443597417 | G44: =H43 -> 1728.3567719868852 | H44: =F44 -> -208.00804443597417 | I44: =DEC2HEX(H44) -> FFFFFFFF30 | J44: =G44^2+H44^2-E44*G44*H44 -> 3621982.938300129 | K44: =DEC2HEX(J44) -> 37445E | L44: 00003743BF | M44: =HEX2DEC(L44) -> 3621823
A45: =A44+1 -> 39 | B45: =B44 -> 100 | C45: =C44 -> 9.6250000000000002E-2 | D45: =B45*SIN(2*PI()*A45*C45) -> -99.972243021800054 | E45: =E44 -> 1.6452810360417196 | F45: =D45+E45*H44-G44 -> -2170.5607058633168 | G45: =H44 -> -208.00804443597417 | H45: =F45 -> -2170.5607058633168 | I45: =DEC2HEX(H45) -> FFFFFFF786 | J45: =G45^2+H45^2-E45*G45*H45 -> 4011766.4639177127 | K45: =DEC2HEX(J45) -> 3D36F6 | L45: 00003D3811 | M45: =HEX2DEC(L45) -> 4012049
A46: =A45+1 -> 40 | B46: =B45 -> 100 | C46: =C45 -> 9.6250000000000002E-2 | D46: =B46*SIN(2*PI()*A46*C46) -> -80.901699437494685 | E46: =E45 -> 1.6452810360417196 | F46: =D46+E46*H45-G45 -> -3444.0760219357644 | G46: =H45 -> -2170.5607058633168 | H46: =F46 -> -3444.0760219357644 | I46: =DEC2HEX(H46) -> FFFFFFF28C | J46: =G46^2+H46^2-E46*G46*H46 -> 4273569.8627927005 | K46: =DEC2HEX(J46) -> 4135A1 | L46: 000041284C | M46: =HEX2DEC(L46) -> 4270156
A47: =A46+1 -> 41 | B47: =B46 -> 100 | C47: =C46 -> 9.6250000000000002E-2 | D47: =B47*SIN(2*PI()*A47*C47) -> -33.133788846257474 | E47: =E46 -> 1.6452810360417196 | F47: =D47+E47*H46-G46 -> -3529.0460485598596 | G47: =H46 -> -3444.0760219357644 | H47: =F47 -> -3529.0460485598596 | I47: =DEC2HEX(H47) -> FFFFFFF237 | J47: =G47^2+H47^2-E47*G47*H47 -> 4318581.6292883419 | K47: =DEC2HEX(J47) -> 41E575 | L47: 000041D258 | M47: =HEX2DEC(L47) -> 4313688
A48: =A47+1 -> 42 | B48: =B47 -> 100 | C48: =C47 -> 9.6250000000000002E-2 | D48: =B48*SIN(2*PI()*A48*C48) -> 26.38730499653748 | E48: =E47 -> 1.6452810360417196 | F48: =D48+E48*H47-G47 -> -2335.8092120812007 | G48: =H47 -> -3529.0460485598596 | H48: =F48 -> -2335.8092120812007 | I48: =DEC2HEX(H48) -> FFFFFFF6E1 | J48: =G48^2+H48^2-E48*G48*H48 -> 4347825.8036175147 | K48: =DEC2HEX(J48) -> 4257B1 | L48: 0000424EC4 | M48: =HEX2DEC(L48) -> 4345540
A49: =A48+1 -> 43 | B49: =B48 -> 100 | C49: =C48 -> 9.6250000000000002E-2 | D49: =B49*SIN(2*PI()*A49*C49) -> 76.548321349308637 | E49: =E48 -> 1.6452810360417196 | F49: =D49+E49*H48-G48 -> -237.46823053958269 | G49: =H48 -> -2335.8092120812007 | H49: =F49 -> -237.46823053958269 | I49: =DEC2HEX(H49) -> FFFFFFFF13 | J49: =G49^2+H49^2-E49*G49*H49 -> 4599790.5601775888 | K49: =DEC2HEX(J49) -> 462FEE | L49: 000046330F | M49: =HEX2DEC(L49) -> 4600591
A50: =A49+1 -> 44 | B50: =B49 -> 100 | C50: =C49 -> 9.6250000000000002E-2 | D50: =B50*SIN(2*PI()*A50*C50) -> 99.556196460307973 | E50: =E49 -> 1.6452810360417196 | F50: =D50+E50*H49-G49 -> 2044.66343217235 | G50: =H49 -> -237.46823053958269 | H50: =F50 -> 2044.66343217235 | I50: =DEC2HEX(H50) -> 7FC | J50: =G50^2+H50^2-E50*G50*H50 -> 5035893.7553378986 | K50: =DEC2HEX(J50) -> 4CD775 | L50: 00004CDE99 | M50: =HEX2DEC(L50) -> 5037721
A51: =A50+1 -> 45 | B51: =B50 -> 100 | C51: =C50 -> 9.6250000000000002E-2 | D51: =B51*SIN(2*PI()*A51*C51) -> 87.249600707279612 | E51: =E50 -> 1.6452810360417196 | F51: =D51+E51*H50-G50 -> 3688.7638012880047 | G51: =H50 -> 2044.66343217235 | H51: =F51 -> 3688.7638012880047 | I51: =DEC2HEX(H51) -> E68 | J51: =G51^2+H51^2-E51*G51*H51 -> 5378455.9323989879 | K51: =DEC2HEX(J51) -> 521197 | L51: 0000520B58 | M51: =HEX2DEC(L51) -> 5376856
A52: =A51+1 -> 46 | B52: =B51 -> 100 | C52: =C51 -> 9.6250000000000002E-2 | D52: =B52*SIN(2*PI()*A52*C52) -> 43.993916985591781 | E52: =E51 -> 1.6452810360417196 | F52: =D52+E52*H51-G51 -> 4068.3836135095621 | G52: =H51 -> 3688.7638012880047 | H52: =F52 -> 4068.3836135095621 | I52: =DEC2HEX(H52) -> FE4 | J52: =G52^2+H52^2-E52*G52*H52 -> 5467487.3100588024 | K52: =DEC2HEX(J52) -> 536D5F | L52: 0000535C6F | M52: =HEX2DEC(L52) -> 5463151
A53: =A52+1 -> 47 | B53: =B52 -> 100 | C53: =C52 -> 9.6250000000000002E-2 | D53: =B53*SIN(2*PI()*A53*C53) -> -14.86724338969259 | E53: =E52 -> 1.6452810360417196 | F53: =D53+E53*H52-G52 -> 2990.0033619724695 | G53: =H52 -> 4068.3836135095621 | H53: =F53 -> 2990.0033619724695 | I53: =DEC2HEX(H53) -> BAE | J53: =G53^2+H53^2-E53*G53*H53 -> 5477875.951581195 | K53: =DEC2HEX(J53) -> 5395F3 | L53: 000053898C | M53: =HEX2DEC(L53) -> 5474700
A54: =A53+1 -> 48 | B54: =B53 -> 100 | C54: =C53 -> 9.6250000000000002E-2 | D54: =B54*SIN(2*PI()*A54*C54) -> -68.454710592868722 | E54: =E53 -> 1.6452810360417196 | F54: =D54+E54*H53-G53 -> 782.5575050518587 | G54: =H53 -> 2990.0033619724695 | H54: =F54 -> 782.5575050518587 | I54: =DEC2HEX(H54) -> 30E | J54: =G54^2+H54^2-E54*G54*H54 -> 5702806.2268941607 | K54: =DEC2HEX(J54) -> 570496 | L54: 00005707B4 | M54: =HEX2DEC(L54) -> 5703604
A55: =A54+1 -> 49 | B55: =B54 -> 100 | C55: =C54 -> 9.6250000000000002E-2 | D55: =B55*SIN(2*PI()*A55*C55) -> -97.759993776479007 | E55: =E54 -> 1.6452810360417196 | F55: =D55+E55*H54-G54 -> -1800.2363330750031 | G55: =H54 -> 782.5575050518587 | H55: =F55 -> -1800.2363330750031 | I55: =DEC2HEX(H55) -> FFFFFFF8F8 | J55: =G55^2+H55^2-E55*G55*H55 -> 6171100.0296698436 | K55: =DEC2HEX(J55) -> 5E29DC | L55: 00005E3CB9 | M55: =HEX2DEC(L55) -> 6175929
A56: =A55+1 -> 50 | B56: =B55 -> 100 | C56: =C55 -> 9.6250000000000002E-2 | D56: =B56*SIN(2*PI()*A56*C56) -> -92.387953251128693 | E56: =E55 -> 1.6452810360417196 | F56: =D56+E56*H55-G55 -> -3836.8401575045746 | G56: =H55 -> -1800.2363330750031 | H56: =F56 -> -3836.8401575045746 | I56: =DEC2HEX(H56) -> FFFFFFF104 | J56: =G56^2+H56^2-E56*G56*H56 -> 6597876.7249664795 | K56: =DEC2HEX(J56) -> 64ACF4 | L56: 000064A728 | M56: =HEX2DEC(L56) -> 6596392
A57: =A56+1 -> 51 | B57: =B56 -> 100 | C57: =C56 -> 9.6250000000000002E-2 | D57: =B57*SIN(2*PI()*A57*C57) -> -54.244153666312044 | E57: =E56 -> 1.6452810360417196 | F57: =D57+E57*H56-G56 -> -4566.6881700569102 | G57: =H56 -> -3836.8401575045746 | H57: =F57 -> -4566.6881700569102 | I57: =DEC2HEX(H57) -> FFFFFFEE2A | J57: =G57^2+H57^2-E57*G57*H57 -> 6747940.5635221787 | K57: =DEC2HEX(J57) -> 66F724 | L57: 000066E8B4 | M57: =HEX2DEC(L57) -> 6744244
A58: =A57+1 -> 52 | B58: =B57 -> 100 | C58: =C57 -> 9.6250000000000002E-2 | D58: =B58*SIN(2*PI()*A58*C58) -> 3.1410759078132218 | E58: =E57 -> 1.6452810360417196 | F58: =D58+E58*H57-G57 -> -3673.5042102983098 | G58: =H57 -> -4566.6881700569102 | H58: =F58 -> -3673.5042102983098 | I58: =DEC2HEX(H58) -> FFFFFFF1A7 | J58: =G58^2+H58^2-E58*G58*H58 -> 6748453.6141308248 | K58: =DEC2HEX(J58) -> 66F925 | L58: 000066E1EF | M58: =HEX2DEC(L58) -> 6742511
A59: =A58+1 -> 53 | B59: =B58 -> 100 | C59: =C58 -> 9.6250000000000002E-2 | D59: =B59*SIN(2*PI()*A59*C59) -> 59.412106290203795 | E59: =E58 -> 1.6452810360417196 | F59: =D59+E59*H58-G58 -> -1417.8465366761075 | G59: =H58 -> -3673.5042102983098 | H59: =F59 -> -1417.8465366761075 | I59: =DEC2HEX(H59) -> FFFFFFFA77 | J59: =G59^2+H59^2-E59*G59*H59 -> 6935532.927944269 | K59: =DEC2HEX(J59) -> 69D3EC | L59: 000069C662 | M59: =HEX2DEC(L59) -> 6932066
A60: =A59+1 -> 54 | B60: =B59 -> 100 | C60: =C59 -> 9.6250000000000002E-2 | D60: =B60*SIN(2*PI()*A60*C60) -> 94.608535882754467 | E60: =E59 -> 1.6452810360417196 | F60: =D60+E60*H59-G59 -> 1435.3567273704343 | G60: =H59 -> -1417.8465366761075 | H60: =F60 -> 1435.3567273704343 | I60: =DEC2HEX(H60) -> 59B | J60: =G60^2+H60^2-E60*G60*H60 -> 7418874.781285705 | K60: =DEC2HEX(J60) -> 7133FA | L60: 0000713475 | M60: =HEX2DEC(L60) -> 7418997
A61: =A60+1 -> 55 | B61: =B60 -> 100 | C61: =C60 -> 9.6250000000000002E-2 | D61: =B61*SIN(2*PI()*A61*C61) -> 96.245523645364628 | E61: =E60 -> 1.6452810360417196 | F61: =D61+E61*H60-G60 -> 3875.6572638189523 | G61: =H60 -> 1435.3567273704343 | H61: =F61 -> 3875.6572638189523 | I61: =DEC2HEX(H61) -> F23 | J61: =G61^2+H61^2-E61*G61*H61 -> 7928350.826483082 | K61: =DEC2HEX(J61) -> 78FA1E | L61: 000078E665 | M61: =HEX2DEC(L61) -> 7923301
A62: =A61+1 -> 56 | B62: =B61 -> 100 | C62: =C61 -> 9.6250000000000002E-2 | D62: =B62*SIN(2*PI()*A62*C62) -> 63.742398974868777 | E62: =E61 -> 1.6452810360417196 | F62: =D62+E62*H61-G61 -> 5004.9310699630969 | G62: =H61 -> 3875.6572638189523 | H62: =F62 -> 5004.9310699630969 | I62: =DEC2HEX(H62) -> 138C | J62: =G62^2+H62^2-E62*G62*H62 -> 8155884.0583990775 | K62: =DEC2HEX(J62) -> 7C72EC | L62: 00007C49A4 | M62: =HEX2DEC(L62) -> 8145316
A63: =A62+1 -> 57 | B63: =B62 -> 100 | C63: =C62 -> 9.6250000000000002E-2 | D63: =B63*SIN(2*PI()*A63*C63) -> 8.6286365797929108 | E63: =E62 -> 1.6452810360417196 | F63: =D63+E63*H62-G62 -> 4367.4895488671173 | G63: =H62 -> 5004.9310699630969 | H63: =F63 -> 4367.4895488671173 | I63: =DEC2HEX(H63) -> 110F | J63: =G63^2+H63^2-E63*G63*H63 -> 8160127.9004449695 | K63: =DEC2HEX(J63) -> 7C837F | L63: 00007C58A1 | M63: =HEX2DEC(L63) -> 8149153
A64: =A63+1 -> 58 | B64: =B63 -> 100 | C64: =C63 -> 9.6250000000000002E-2 | D64: =B64*SIN(2*PI()*A64*C64) -> -49.545866843240766 | E64: =E63 -> 1.6452810360417196 | F64: =D64+E64*H63-G63 -> 2131.2707930551351 | G64: =H63 -> 4367.4895488671173 | H64: =F64 -> 2131.2707930551351 | I64: =DEC2HEX(H64) -> 853 | J64: =G64^2+H64^2-E64*G64*H64 -> 8302505.8898773603 | K64: =DEC2HEX(J64) -> 7EAFA9 | L64: 00007EA668 | M64: =HEX2DEC(L64) -> 8300136
A65: =A64+1 -> 59 | B65: =B64 -> 100 | C65: =C64 -> 9.6250000000000002E-2 | D65: =B65*SIN(2*PI()*A65*C65) -> -90.145511711224529 | E65: =E64 -> 1.6452810360417196 | F65: =D65+E65*H64-G64 -> -951.09564209513201 | G65: =H64 -> 2131.2707930551351 | H65: =F65 -> -951.09564209513201 | I65: =DEC2HEX(H65) -> FFFFFFFC49 | J65: =G65^2+H65^2-E65*G65*H65 -> 8781952.4734963942 | K65: =DEC2HEX(J65) -> 860080 | L65: 00008608C4 | M65: =HEX2DEC(L65) -> 8784068
A66: =A65+1 -> 60 | B66: =B65 -> 100 | C66: =C65 -> 9.6250000000000002E-2 | D66: =B66*SIN(2*PI()*A66*C66) -> -98.768834059513807 | E66: =E65 -> 1.6452810360417196 | F66: =D66+E66*H65-G65 -> -3794.8592505156921 | G66: =H65 -> -951.09564209513201 | H66: =F66 -> -3794.8592505156921 | I66: =DEC2HEX(H66) -> FFFFFFF12E | J66: =G66^2+H66^2-E66*G66*H66 -> 9367269.4283849411 | K66: =DEC2HEX(J66) -> 8EEEE5 | L66: 00008EF4C9 | M66: =HEX2DEC(L66) -> 9368777
A67: =A66+1 -> 61 | B67: =B66 -> 100 | C67: =C66 -> 9.6250000000000002E-2 | D67: =B67*SIN(2*PI()*A67*C67) -> -72.356977918844692 | E67: =E66 -> 1.6452810360417196 | F67: =D67+E67*H66-G66 -> -5364.8712951446741 | G67: =H66 -> -3794.8592505156921 | H67: =F67 -> -5364.8712951446741 | I67: =DEC2HEX(H67) -> FFFFFFEB0C | J67: =G67^2+H67^2-E67*G67*H67 -> 9686636.8958513811 | K67: =DEC2HEX(J67) -> 93CE6C | L67: 000093AE61 | M67: =HEX2DEC(L67) -> 9678433
A68: =A67+1 -> 62 | B68: =B67 -> 100 | C68: =C67 -> 9.6250000000000002E-2 | D68: =B68*SIN(2*PI()*A68*C68) -> -20.278729535651713 | E68: =E67 -> 1.6452810360417196 | F68: =D68+E68*H67-G67 -> -5052.1404817260718 | G68: =H67 -> -5364.8712951446741 | H68: =F68 -> -5052.1404817260718 | I68: =DEC2HEX(H68) -> FFFFFFEC44 | J68: =G68^2+H68^2-E68*G68*H68 -> 9712132.9618893489 | K68: =DEC2HEX(J68) -> 943204 | L68: 00009408C1 | M68: =HEX2DEC(L68) -> 9701569
A69: =A68+1 -> 63 | B69: =B68 -> 100 | C69: =C68 -> 9.6250000000000002E-2 | D69: =B69*SIN(2*PI()*A69*C69) -> 38.992768778818935 | E69: =E68 -> 1.6452810360417196 | F69: =D69+E69*H68-G68 -> -2908.3268620790914 | G69: =H68 -> -5052.1404817260718 | H69: =F69 -> -2908.3268620790914 | I69: =DEC2HEX(H69) -> FFFFFFF4A4 | J69: =G69^2+H69^2-E69*G69*H69 -> 9807920.4309627675 | K69: =DEC2HEX(J69) -> 95A830 | L69: 000095824E | M69: =HEX2DEC(L69) -> 9798222
A70: =A69+1 -> 64 | B70: =B69 -> 100 | C70: =C69 -> 9.6250000000000002E-2 | D70: =B70*SIN(2*PI()*A70*C70) -> 84.432792550201498 | E70: =E69 -> 1.6452810360417196 | F70: =D70+E70*H69-G69 -> 351.55824148682223 | G70: =H69 -> -2908.3268620790914 | H70: =F70 -> 351.55824148682223 | I70: =DEC2HEX(H70) -> 15F | J70: =G70^2+H70^2-E70*G70*H70 -> 10264169.804263588 | K70: =DEC2HEX(J70) -> 9C9E69 | L70: 00009C7FDA | M70: =HEX2DEC(L70) -> 10256346
A71: =A70+1 -> 65 | B71: =B70 -> 100 | C71: =C70 -> 9.6250000000000002E-2 | D71: =B71*SIN(2*PI()*A71*C71) -> 99.922903624072305 | E71: =E70 -> 1.6452810360417196 | F71: =D71+E71*H70-G70 -> 3586.6618734856074 | G71: =H70 -> 351.55824148682223 | H71: =F71 -> 3586.6618734856074 | I71: =DEC2HEX(H71) -> E02 | J71: =G71^2+H71^2-E71*G71*H71 -> 10913167.937726853 | K71: =DEC2HEX(J71) -> A6858F | L71: 0000A65F0A | M71: =HEX2DEC(L71) -> 10903306
A72: =A71+1 -> 66 | B72: =B71 -> 100 | C72: =C71 -> 9.6250000000000002E-2 | D72: =B72*SIN(2*PI()*A72*C72) -> 79.968465848709201 | E72: =E71 -> 1.6452810360417196 | F72: =D72+E72*H71-G71 -> 5629.4769875016227 | G72: =H71 -> 3586.6618734856074 | H72: =F72 -> 5629.4769875016227 | I72: =DEC2HEX(H72) -> 15FD | J72: =G72^2+H72^2-E72*G72*H72 -> 11335235.002719801 | K72: =DEC2HEX(J72) -> ACF643 | L72: 0000ACA654 | M72: =HEX2DEC(L72) -> 11314772
A73: =A72+1 -> 67 | B73: =B72 -> 100 | C73: =C72 -> 9.6250000000000002E-2 | D73: =B73*SIN(2*PI()*A73*C73) -> 31.647696718158969 | E73: =E72 -> 1.6452810360417196 | F73: =D73+E73*H72-G72 -> 5707.0575536022407 | G73: =H72 -> 5629.4769875016227 | H73: =F73 -> 5707.0575536022407 | I73: =DEC2HEX(H73) -> 164B | J73: =G73^2+H73^2-E73*G73*H73 -> 11402340.642126627 | K73: =DEC2HEX(J73) -> ADFC64 | L73: 0000ADA629 | M73: =HEX2DEC(L73) -> 11380265
A74: =A73+1 -> 68 | B74: =B73 -> 100 | C74: =C73 -> 9.6250000000000002E-2 | D74: =B74*SIN(2*PI()*A74*C74) -> -27.899110603923127 | E74: =E73 -> 1.6452810360417196 | F74: =D74+E74*H73-G73 -> 3732.3374664348703 | G74: =H73 -> 5707.0575536022407 | H74: =F74 -> 3732.3374664348703 | I74: =DEC2HEX(H74) -> E94 | J74: =G74^2+H74^2-E74*G74*H74 -> 11455269.147455946 | K74: =DEC2HEX(J74) -> AECB25 | L74: 0000AE7B75 | M74: =HEX2DEC(L74) -> 11434869
A75: =A74+1 -> 69 | B75: =B74 -> 100 | C75: =C74 -> 9.6250000000000002E-2 | D75: =B75*SIN(2*PI()*A75*C75) -> -77.549574317223502 | E75: =E74 -> 1.6452810360417196 | F75: =D75+E75*H74-G74 -> 356.13692571382671 | G75: =H74 -> 3732.3374664348703 | H75: =F75 -> 356.13692571382671 | I75: =DEC2HEX(H75) -> 164 | J75: =G75^2+H75^2-E75*G75*H75 -> 11870230.76435394 | K75: =DEC2HEX(J75) -> B52016 | L75: 0000B4FD41 | M75: =HEX2DEC(L75) -> 11861313
A76: =A75+1 -> 70 | B76: =B75 -> 100 | C76: =C75 -> 9.6250000000000002E-2 | D76: =B76*SIN(2*PI()*A76*C76) -> -99.6917333733128 | E76: =E75 -> 1.6452810360417196 | F76: =D76+E76*H75-G75 -> -3246.0838696970254 | G76: =H75 -> 356.13692571382671 | H76: =F76 -> -3246.0838696970254 | I76: =DEC2HEX(H76) -> FFFFFFF352 | J76: =G76^2+H76^2-E76*G76*H76 -> 12565921.68356224 | K76: =DEC2HEX(J76) -> BFBDA1 | L76: 0000BFAB67 | M76: =HEX2DEC(L76) -> 12561255
A77: =A76+1 -> 71 | B77: =B76 -> 100 | C77: =C76 -> 9.6250000000000002E-2 | D77: =B77*SIN(2*PI()*A77*C77) -> -86.471344052015581 | E77: =E76 -> 1.6452810360417196 | F77: =D77+E77*H76-G76 -> -5783.3285019792784 | G77: =H76 -> -3246.0838696970254 | H77: =F77 -> -5783.3285019792784 | I77: =DEC2HEX(H77) -> FFFFFFE969 | J77: =G77^2+H77^2-E77*G77*H77 -> 13096809.510855746 | K77: =DEC2HEX(J77) -> C7D769 | L77: 0000C7A16D | M77: =HEX2DEC(L77) -> 13082989
A78: =A77+1 -> 72 | B78: =B77 -> 100 | C78: =C77 -> 9.6250000000000002E-2 | D78: =B78*SIN(2*PI()*A78*C78) -> -42.577929156507516 | E78: =E77 -> 1.6452810360417196 | F78: =D78+E78*H77-G77 -> -6311.6947689655535 | G78: =H77 -> -5783.3285019792784 | H78: =F78 -> -6311.6947689655535 | I78: =DEC2HEX(H78) -> FFFFFFE759 | J78: =G78^2+H78^2-E78*G78*H78 -> 13227336.874546215 | K78: =DEC2HEX(J78) -> C9D548 | L78: 0000C99253 | M78: =HEX2DEC(L78) -> 13210195
A79: =A78+1 -> 73 | B79: =B78 -> 100 | C79: =C78 -> 9.6250000000000002E-2 | D79: =B79*SIN(2*PI()*A79*C79) -> 16.418684656885901 | E79: =E78 -> 1.6452810360417196 | F79: =D79+E79*H78-G78 -> -4584.764522026584 | G79: =H78 -> -6311.6947689655535 | H79: =F79 -> -4584.764522026584 | I79: =DEC2HEX(H79) -> FFFFFFEE18 | J79: =G79^2+H79^2-E79*G79*H79 -> 13247015.718574151 | K79: =DEC2HEX(J79) -> CA2227 | L79: 0000C9E0CD | M79: =HEX2DEC(L79) -> 13230285
A80: =A79+1 -> 74 | B80: =B79 -> 100 | C80: =C79 -> 9.6250000000000002E-2 | D80: =B80*SIN(2*PI()*A80*C80) -> 69.59127965923156 | E80: =E79 -> 1.6452810360417196 | F80: =D80+E80*H79-G79 -> -1161.940074182432 | G80: =H79 -> -4584.764522026584 | H80: =F80 -> -1161.940074182432 | I80: =DEC2HEX(H80) -> FFFFFFFB77 | J80: =G80^2+H80^2-E80*G80*H80 -> 13605393.737715252 | K80: =DEC2HEX(J80) -> CF9A11 | L80: 0000CF84F7 | M80: =HEX2DEC(L80) -> 13599991
A81: =A80+1 -> 75 | B81: =B80 -> 100 | C81: =C80 -> 9.6250000000000002E-2 | D81: =B81*SIN(2*PI()*A81*C81) -> 98.078528040323064 | E81: =E80 -> 1.6452810360417196 | F81: =D81+E81*H80-G80 -> 2771.1250809976427 | G81: =H80 -> -1161.940074182432 | H81: =F81 -> 2771.1250809976427 | I81: =DEC2HEX(H81) -> AD3 | J81: =G81^2+H81^2-E81*G81*H81 -> 14326848.562406983 | K81: =DEC2HEX(J81) -> DA9C40 | L81: 0000DA8C21 | M81: =HEX2DEC(L81) -> 14322721
A82: =A81+1 -> 76 | B82: =B81 -> 100 | C82: =C81 -> 9.6250000000000002E-2 | D82: =B82*SIN(2*PI()*A82*C82) -> 91.77546256839814 | E82: =E81 -> 1.6452810360417196 | F82: =D82+E82*H81-G81 -> 5812.9950810158261 | G82: =H81 -> 2771.1250809976427 | H82: =F82 -> 5812.9950810158261 | I82: =DEC2HEX(H82) -> 16B4 | J82: =G82^2+H82^2-E82*G82*H82 -> 14966976.462659884 | K82: =DEC2HEX(J82) -> E460C0 | L82: 0000E42BE9 | M82: =HEX2DEC(L82) -> 14953449
A83: =A82+1 -> 77 | B83: =B82 -> 100 | C83: =C82 -> 9.6250000000000002E-2 | D83: =B83*SIN(2*PI()*A83*C83) -> 52.917900097419214 | E83: =E82 -> 1.6452810360417196 | F83: =D83+E83*H82-G82 -> 6845.8033884989163 | G83: =H82 -> 5812.9950810158261 | H83: =F83 -> 6845.8033884989163 | I83: =DEC2HEX(H83) -> 1ABD | J83: =G83^2+H83^2-E83*G83*H83 -> 15182599.882265359 | K83: =DEC2HEX(J83) -> E7AB07 | L83: 0000E752DC | M83: =HEX2DEC(L83) -> 15160028
A84: =A83+1 -> 78 | B84: =B83 -> 100 | C84: =C83 -> 9.6250000000000002E-2 | D84: =B84*SIN(2*PI()*A84*C84) -> -4.7106450709639667 | E84: =E83 -> 1.6452810360417196 | F84: =D84+E84*H83-G83 -> 5445.5647654806216 | G84: =H83 -> 6845.8033884989163 | H84: =F84 -> 5445.5647654806216 | I84: =DEC2HEX(H84) -> 1545 | J84: =G84^2+H84^2-E84*G84*H84 -> 15184330.71607016 | K84: =DEC2HEX(J84) -> E7B1CA | L84: 0000E75073 | M84: =HEX2DEC(L84) -> 15159411
A85: =A84+1 -> 79 | B85: =B84 -> 100 | C85: =C84 -> 9.6250000000000002E-2 | D85: =B85*SIN(2*PI()*A85*C85) -> -60.668235100200199 | E85: =E84 -> 1.6452810360417196 | F85: =D85+E85*H84-G84 -> 2053.0128155831244 | G85: =H84 -> 5445.5647654806216 | H85: =F85 -> 2053.0128155831244 | I85: =DEC2HEX(H85) -> 805 | J85: =G85^2+H85^2-E85*G85*H85 -> 15475100.861333843 | K85: =DEC2HEX(J85) -> EC219C | L85: 0000EBF462 | M85: =HEX2DEC(L85) -> 15463522
A86: =A85+1 -> 80 | B86: =B85 -> 100 | C86: =C85 -> 9.6250000000000002E-2 | D86: =B86*SIN(2*PI()*A86*C86) -> -95.105651629515407 | E86: =E85 -> 1.6452810360417196 | F86: =D86+E86*H85-G85 -> -2162.8873648806061 | G86: =H85 -> 2053.0128155831244 | H86: =F86 -> -2162.8873648806061 | I86: =DEC2HEX(H86) -> FFFFFFF78E | J86: =G86^2+H86^2-E86*G86*H86 -> 16198707.659083821 | K86: =DEC2HEX(J86) -> F72C33 | L86: 0000F71CE9 | M86: =HEX2DEC(L86) -> 16194793
A87: =A86+1 -> 81 | B87: =B86 -> 100 | C87: =C86 -> 9.6250000000000002E-2 | D87: =B87*SIN(2*PI()*A87*C87) -> -95.807289946231904 | E87: =E86 -> 1.6452810360417196 | F87: =D87+E87*H86-G86 -> -5707.3776700616645 | G87: =H86 -> -2162.8873648806061 | H87: =F87 -> -5707.3776700616645 | I87: =DEC2HEX(H87) -> FFFFFFE9B5 | J87: =G87^2+H87^2-E87*G87*H87 -> 16942209.640437968 | K87: =DEC2HEX(J87) -> 1028481 | L87: 0001027447 | M87: =HEX2DEC(L87) -> 16938055
A88: =A87+1 -> 82 | B88: =B87 -> 100 | C88: =C87 -> 9.6250000000000002E-2 | D88: =B88*SIN(2*PI()*A88*C88) -> -62.52426563357114 | E88: =E87 -> 1.6452810360417196 | F88: =D88+E88*H87-G87 -> -7289.8771468333962 | G88: =H87 -> -5707.3776700616645 | H88: =F88 -> -7289.8771468333962 | I88: =DEC2HEX(H88) -> FFFFFFE387 | J88: =G88^2+H88^2-E88*G88*H88 -> 17262770.911465392 | K88: =DEC2HEX(J88) -> 10768B2 | L88: 0001073A10 | M88: =HEX2DEC(L88) -> 17250832
A89: =A88+1 -> 83 | B89: =B88 -> 100 | C89: =C88 -> 9.6250000000000002E-2 | D89: =B89*SIN(2*PI()*A89*C89) -> -7.0626985931161581 | E89: =E88 -> 1.6452810360417196 | F89: =D89+E89*H88-G88 -> -6293.5816532903564 | G89: =H88 -> -7289.8771468333962 | H89: =F89 -> -6293.5816532903564 | I89: =DEC2HEX(H89) -> FFFFFFE76B | J89: =G89^2+H89^2-E89*G89*H89 -> 17266911.093513012 | K89: =DEC2HEX(J89) -> 10778DF | L89: 00010744FD | M89: =HEX2DEC(L89) -> 17253629
A90: =A89+1 -> 84 | B90: =B89 -> 100 | C90: =C89 -> 9.6250000000000002E-2 | D90: =B90*SIN(2*PI()*A90*C90) -> 50.904141575037464 | E90: =E89 -> 1.6452810360417196 | F90: =D90+E90*H89-G89 -> -3013.9292545302815 | G90: =H89 -> -6293.5816532903564 | H90: =F90 -> -3013.9292545302815 | I90: =DEC2HEX(H90) -> FFFFFFF43B | J90: =G90^2+H90^2-E90*G90*H90 -> 17484574.550390303 | K90: =DEC2HEX(J90) -> 10ACB1E | L90: 00010AB3C2 | M90: =HEX2DEC(L90) -> 17478594
A91: =A90+1 -> 85 | B91: =B90 -> 100 | C91: =C90 -> 9.6250000000000002E-2 | D91: =B91*SIN(2*PI()*A91*C91) -> 90.814317382508236 | E91: =E90 -> 1.6452810360417196 | F91: =D91+E91*H90-G90 -> 1425.6353242228352 | G91: =H90 -> -3013.9292545302815 | H91: =F91 -> 1425.6353242228352 | I91: =DEC2HEX(H91) -> 591 | J91: =G91^2+H91^2-E91*G91*H91 -> 18185589.970930628 | K91: =DEC2HEX(J91) -> 1157D75 | L91: 00011582F9 | M91: =HEX2DEC(L91) -> 18187001
A92: =A91+1 -> 86 | B92: =B91 -> 100 | C92: =C91 -> 9.6250000000000002E-2 | D92: =B92*SIN(2*PI()*A92*C92) -> 98.510932615477486 | E92: =E91 -> 1.6452810360417196 | F92: =D92+E92*H91-G91 -> 5458.0109504007778 | G92: =H91 -> 1425.6353242228352 | H92: =F92 -> 5458.0109504007778 | I92: =DEC2HEX(H92) -> 1552 | J92: =G92^2+H92^2-E92*G92*H92 -> 19020168.701580949 | K92: =DEC2HEX(J92) -> 1223988 | L92: 0001222DDA | M92: =HEX2DEC(L92) -> 19017178
A93: =A92+1 -> 87 | B93: =B92 -> 100 | C93: =C92 -> 9.6250000000000002E-2 | D93: =B93*SIN(2*PI()*A93*C93) -> 71.263851892521018 | E93: =E92 -> 1.6452810360417196 | F93: =D93+E93*H92-G92 -> 7625.5904388721292 | G93: =H92 -> 5458.0109504007778 | H93: =F93 -> 7625.5904388721292 | I93: =DEC2HEX(H93) -> 1DC9 | J93: =G93^2+H93^2-E93*G93*H93 -> 19462001.384611592 | K93: =DEC2HEX(J93) -> 128F771 | L93: 000128B192 | M93: =HEX2DEC(L93) -> 19444114
A94: =A93+1 -> 88 | B94: =B93 -> 100 | C94: =C93 -> 9.6250000000000002E-2 | D94: =B94*SIN(2*PI()*A94*C94) -> 18.73813145857326 | E94: =E93 -> 1.6452810360417196 | F94: =D94+E94*H93-G93 -> 7106.9665187551636 | G94: =H93 -> 7625.5904388721292 | H94: =F94 -> 7106.9665187551636 | I94: =DEC2HEX(H94) -> 1BC2 | J94: =G94^2+H94^2-E94*G94*H94 -> 19492899.73082076 | K94: =DEC2HEX(J94) -> 1297023 | L94: 0001292971 | M94: =HEX2DEC(L94) -> 19474801
A95: =A94+1 -> 89 | B95: =B94 -> 100 | C95: =C94 -> 9.6250000000000002E-2 | D95: =B95*SIN(2*PI()*A95*C95) -> -40.434359552874945 | E95: =E94 -> 1.6452810360417196 | F95: =D95+E95*H94-G94 -> 4026.9324386663038 | G95: =H94 -> 7106.9665187551636 | H95: =F95 -> 4026.9324386663038 | I95: =DEC2HEX(H95) -> FBA | J95: =G95^2+H95^2-E95*G95*H95 -> 19638409.162308924 | K95: =DEC2HEX(J95) -> 12BA889 | L95: 00012B901D | M95: =HEX2DEC(L95) -> 19632157
A96: =A95+1 -> 90 | B96: =B95 -> 100 | C96: =C95 -> 9.6250000000000002E-2 | D96: =B96*SIN(2*PI()*A96*C96) -> -85.264016435409417 | E96: =E95 -> 1.6452810360417196 | F96: =D96+E96*H95-G95 -> -566.79496043166819 | G96: =H95 -> 4026.9324386663038 | H96: =F96 -> -566.79496043166819 | I96: =DEC2HEX(H96) -> FFFFFFFDCA | J96: =G96^2+H96^2-E96*G96*H96 -> 20292704.88719172 | K96: =DEC2HEX(J96) -> 135A460 | L96: 000135B9E0 | M96: =HEX2DEC(L96) -> 20298208
A97: =A96+1 -> 91 | B97: =B96 -> 100 | C97: =C96 -> 9.6250000000000002E-2 | D97: =B97*SIN(2*PI()*A97*C97) -> -99.848909745053831 | E97: =E96 -> 1.6452810360417196 | F97: =D97+E97*H96-G96 -> -5059.3183481335982 | G97: =H96 -> -566.79496043166819 | H97: =F97 -> -5059.3183481335982 | I97: =DEC2HEX(H97) -> FFFFFFEC3D | J97: =G97^2+H97^2-E97*G97*H97 -> 21199957.12192383 | K97: =DEC2HEX(J97) -> 1437C55 | L97: 0001439385 | M97: =HEX2DEC(L97) -> 21205893
A98: =A97+1 -> 92 | B98: =B97 -> 100 | C98: =C97 -> 9.6250000000000002E-2 | D98: =B98*SIN(2*PI()*A98*C98) -> -79.015501237569396 | E98: =E97 -> 1.6452810360417196 | F98: =D98+E98*H97-G97 -> -7836.2210742880279 | G98: =H97 -> -5059.3183481335982 | H98: =F98 -> -7836.2210742880279 | I98: =DEC2HEX(H98) -> FFFFFFE164 | J98: =G98^2+H98^2-E98*G98*H98 -> 21774354.470019661 | K98: =DEC2HEX(J98) -> 14C4012 | L98: 00014C248C | M98: =HEX2DEC(L98) -> 21767308
A99: =A98+1 -> 93 | B99: =B98 -> 100 | C99: =C98 -> 9.6250000000000002E-2 | D99: =B99*SIN(2*PI()*A99*C99) -> -30.153795994450249 | E99: =E98 -> 1.6452810360417196 | F99: =D99+E99*H98-G98 -> -7863.6213756174166 | G99: =H98 -> -7836.2210742880279 | H99: =F99 -> -7863.6213756174166 | I99: =DEC2HEX(H99) -> FFFFFFE149 | J99: =G99^2+H99^2-E99*G99*H99 -> 21858914.85141702 | K99: =DEC2HEX(J99) -> 14D8A62 | L99: 00014D5B3F | M99: =HEX2DEC(L99) -> 21846847
A100: =A99+1 -> 94 | B100: =B99 -> 100 | C100: =C99 -> 9.6250000000000002E-2 | D100: =B100*SIN(2*PI()*A100*C100) -> 29.404032523230956 | E100: =E99 -> 1.6452810360417196 | F100: =D100+E100*H99-G99 -> -5072.2420171043768 | G100: =H99 -> -7863.6213756174166 | H100: =F100 -> -5072.2420171043768 | I100: =DEC2HEX(H100) -> FFFFFFEC30 | J100: =G100^2+H100^2-E100*G100*H100 -> 21940186.981507979 | K100: =DEC2HEX(J100) -> 14EC7DA | L100: 00014EB2E9 | M100: =HEX2DEC(L100) -> 21934825
A101: =A100+1 -> 95 | B101: =B100 -> 100 | C101: =C100 -> 9.6250000000000002E-2 | D101: =B101*SIN(2*PI()*A101*C101) -> 78.531693088074789 | E101: =E100 -> 1.6452810360417196 | F101: =D101+E101*H100-G100 -> -403.11053225033902 | G101: =H100 -> -5072.2420171043768 | H101: =F101 -> -403.11053225033902 | I101: =DEC2HEX(H101) -> FFFFFFFE6D | J101: =G101^2+H101^2-E101*G101*H101 -> 22526073.529339544 | K101: =DEC2HEX(J101) -> 157B879 | L101: 000157D9A1 | M101: =HEX2DEC(L101) -> 22534561
A102: =A101+1 -> 96 | B102: =B101 -> 100 | C102: =C101 -> 9.6250000000000002E-2 | D102: =B102*SIN(2*PI()*A102*C102) -> 99.802672842827135 | E102: =E101 -> 1.6452810360417196 | F102: =D102+E102*H101-G101 -> 4508.8145758070368 | G102: =H101 -> -403.11053225033902 | H102: =F102 -> 4508.8145758070368 | I102: =DEC2HEX(H102) -> 119C | J102: =G102^2+H102^2-E102*G102*H102 -> 23482288.585970491 | K102: =DEC2HEX(J102) -> 1664FB0 | L102: 0001666D04 | M102: =HEX2DEC(L102) -> 23489796
A103: =A102+1 -> 97 | B103: =B102 -> 100 | C103: =C102 -> 9.6250000000000002E-2 | D103: =B103*SIN(2*PI()*A103*C103) -> 85.67175188650522 | E103: =E102 -> 1.6452810360417196 | F103: =D103+E103*H102-G102 -> 7907.0494007406523 | G103: =H102 -> 4508.8145758070368 | H103: =F103 -> 7907.0494007406523 | I103: =DEC2HEX(H103) -> 1EE3 | J103: =G103^2+H103^2-E103*G103*H103 -> 24194234.545886867 | K103: =DEC2HEX(J103) -> 1712CBA | L103: 00017125A4 | M103: =HEX2DEC(L103) -> 24192420
A104: =A103+1 -> 98 | B104: =B103 -> 100 | C104: =C103 -> 9.6250000000000002E-2 | D104: =B104*SIN(2*PI()*A104*C104) -> 41.151435860511434 | E104: =E103 -> 1.6452810360417196 | F104: =D104+E104*H103-G103 -> 8541.6552901371124 | G104: =H103 -> 7907.0494007406523 | H104: =F104 -> 8541.6552901371124 | I104: =DEC2HEX(H104) -> 215D | J104: =G104^2+H104^2-E104*G104*H104 -> 24360191.731878281 | K104: =DEC2HEX(J104) -> 173B4FF | L104: 0001736809 | M104: =HEX2DEC(L104) -> 24340489
A105: =A104+1 -> 99 | B105: =B104 -> 100 | C105: =C104 -> 9.6250000000000002E-2 | D105: =B105*SIN(2*PI()*A105*C105) -> -17.966074859319932 | E105: =E104 -> 1.6452810360417196 | F105: =D105+E105*H104-G104 -> 6128.4079896680505 | G105: =H104 -> 8541.6552901371124 | H105: =F105 -> 6128.4079896680505 | I105: =DEC2HEX(H105) -> 17F0 | J105: =G105^2+H105^2-E105*G105*H105 -> 24392146.936617509 | K105: =DEC2HEX(J105) -> 17431D2 | L105: 0001740D45 | M105: =HEX2DEC(L105) -> 24382789
A106: =A105+1 -> 100 | B106: =B105 -> 100 | C106: =C105 -> 9.6250000000000002E-2 | D106: =B106*SIN(2*PI()*A106*C106) -> -70.710678118654641 | E106: =E105 -> 1.6452810360417196 | F106: =D106+E106*H105-G105 -> 1470.5874782716364 | G106: =H105 -> 6128.4079896680505 | H106: =F106 -> 1470.5874782716364 | I106: =DEC2HEX(H106) -> 5BE | J106: =G106^2+H106^2-E106*G106*H106 -> 24892146.936617486 | K106: =DEC2HEX(J106) -> 17BD2F2 | L106: 00017C0744 | M106: =HEX2DEC(L106) -> 24905540
A107: =A106+1 -> 101 | B107: =B106 -> 100 | C107: =C106 -> 9.6250000000000002E-2 | D107: =B107*SIN(2*PI()*A107*C107) -> -98.372862894953542 | E107: =E106 -> 1.6452810360417196 | F107: =D107+E107*H106-G106 -> -3807.2511627222661 | G107: =H106 -> 1470.5874782716364 | H107: =F107 -> -3807.2511627222661 | I107: =DEC2HEX(H107) -> FFFFFFF121 | J107: =G107^2+H107^2-E107*G107*H107 -> 25869546.172186568 | K107: =DEC2HEX(J107) -> 18ABCEA | L107: 00018B07E0 | M107: =HEX2DEC(L107) -> 25888736
A108: =A107+1 -> 102 | B108: =B107 -> 100 | C108: =C107 -> 9.6250000000000002E-2 | D108: =B108*SIN(2*PI()*A108*C108) -> -91.140327663544682 | E108: =E107 -> 1.6452810360417196 | F108: =D108+E108*H107-G107 -> -7825.7259434099124 | G108: =H107 -> -3807.2511627222661 | H108: =F108 -> -7825.7259434099124 | I108: =DEC2HEX(H108) -> FFFFFFE16F | J108: =G108^2+H108^2-E108*G108*H108 -> 26716815.223501638 | K108: =DEC2HEX(J108) -> 197AA8F | L108: 000197CDAC | M108: =HEX2DEC(L108) -> 26725804
A109: =A108+1 -> 103 | B109: =B108 -> 100 | C109: =C108 -> 9.6250000000000002E-2 | D109: =B109*SIN(2*PI()*A109*C109) -> -51.578589828505187 | E109: =E108 -> 1.6452810360417196 | F109: =D109+E109*H108-G108 -> -9119.8459150582621 | G109: =H108 -> -7825.7259434099124 | H109: =F109 -> -9119.8459150582621 | I109: =DEC2HEX(H109) -> FFFFFFDC61 | J109: =G109^2+H109^2-E109*G109*H109 -> 26990831.369157448 | K109: =DEC2HEX(J109) -> 19BD8EF | L109: 00019BBFC1 | M109: =HEX2DEC(L109) -> 26984385
A110: =A109+1 -> 104 | B110: =B109 -> 100 | C110: =C109 -> 9.6250000000000002E-2 | D110: =B110*SIN(2*PI()*A110*C110) -> 6.2790519529321198 | E110: =E109 -> 1.6452810360417196 | F110: =D110+E110*H109-G109 -> -7172.7045403050579 | G110: =H109 -> -9119.8459150582621 | H110: =F110 -> -7172.7045403050579 | I110: =DEC2HEX(H110) -> FFFFFFE3FC | J110: =G110^2+H110^2-E110*G110*H110 -> 26994931.724473909 | K110: =DEC2HEX(J110) -> 19BE8F3 | L110: 00019BCA49 | M110: =HEX2DEC(L110) -> 26987081
A111: =A110+1 -> 105 | B111: =B110 -> 100 | C111: =C110 -> 9.6250000000000002E-2 | D111: =B111*SIN(2*PI()*A111*C111) -> 61.90939493098336 | E111: =E110 -> 1.6452810360417196 | F111: =D111+E111*H110-G110 -> -2619.3594473050071 | G111: =H110 -> -7172.7045403050579 | H111: =F111 -> -2619.3594473050071 | I111: =DEC2HEX(H111) -> FFFFFFF5C5 | J111: =G111^2+H111^2-E111*G111*H111 -> 27397372.908449553 | K111: =DEC2HEX(J111) -> 1A20CFC | L111: 0001A224C9 | M111: =HEX2DEC(L111) -> 27403465
A112: =A111+1 -> 106 | B112: =B111 -> 100 | C112: =C111 -> 9.6250000000000002E-2 | D112: =B112*SIN(2*PI()*A112*C112) -> 95.579301479832964 | E112: =E111 -> 1.6452810360417196 | F112: =D112+E112*H111-G111 -> 2958.7014165572427 | G112: =H111 -> -2619.3594473050071 | H112: =F112 -> 2958.7014165572427 | I112: =DEC2HEX(H112) -> B8E | J112: =G112^2+H112^2-E112*G112*H112 -> 28365725.612815067 | K112: =DEC2HEX(J112) -> 1B0D39D | L112: 0001B10FE7 | M112: =HEX2DEC(L112) -> 28381159
A113: =A112+1 -> 107 | B113: =B112 -> 100 | C113: =C112 -> 9.6250000000000002E-2 | D113: =B113*SIN(2*PI()*A113*C113) -> 95.345417231900214 | E113: =E112 -> 1.6452810360417196 | F113: =D113+E113*H112-G112 -> 7582.6001965083105 | G113: =H112 -> 2958.7014165572427 | H113: =F113 -> 7582.6001965083105 | I113: =DEC2HEX(H113) -> 1D9E | J113: =G113^2+H113^2-E113*G113*H113 -> 29338435.711637452 | K113: =DEC2HEX(J113) -> 1BFAB43 | L113: 0001BF93A0 | M113: =HEX2DEC(L113) -> 29332384
A114: =A113+1 -> 108 | B114: =B113 -> 100 | C114: =C113 -> 9.6250000000000002E-2 | D114: =B114*SIN(2*PI()*A114*C114) -> 61.290705365297981 | E114: =E113 -> 1.6452810360417196 | F114: =D114+E114*H113-G113 -> 9578.0975960093965 | G114: =H113 -> 7582.6001965083105 | H114: =F114 -> 9578.0975960093965 | I114: =DEC2HEX(H114) -> 256A | J114: =G114^2+H114^2-E114*G114*H114 -> 29744143.17256844 | K114: =DEC2HEX(J114) -> 1C5DC0F | L114: 0001C57FAB | M114: =HEX2DEC(L114) -> 29720491
A115: =A114+1 -> 109 | B115: =B114 -> 100 | C115: =C114 -> 9.6250000000000002E-2 | D115: =B115*SIN(2*PI()*A115*C115) -> 5.4950179912451107 | E115: =E114 -> 1.6452810360417196 | F115: =D115+E115*H114-G114 -> 8181.557157553978 | G115: =H114 -> 9578.0975960093965 | H115: =F115 -> 8181.557157553978 | I115: =DEC2HEX(H115) -> 1FF5 | J115: =G115^2+H115^2-E115*G115*H115 -> 29747434.451845393 | K115: =DEC2HEX(J115) -> 1C5E8EA | L115: 0001C58BB5 | M115: =HEX2DEC(L115) -> 29723573
A116: =A115+1 -> 110 | B116: =B115 -> 100 | C116: =C115 -> 9.6250000000000002E-2 | D116: =B116*SIN(2*PI()*A116*C116) -> -52.249856471595535 | E116: =E115 -> 1.6452810360417196 | F116: =D116+E116*H115-G115 -> 3830.6133841339633 | G116: =H115 -> 8181.557157553978 | H116: =F116 -> 3830.6133841339633 | I116: =DEC2HEX(H116) -> EF6 | J116: =G116^2+H116^2-E116*G116*H116 -> 30047739.676988624 | K116: =DEC2HEX(J116) -> 1CA7DFB | L116: 0001CA6511 | M116: =HEX2DEC(L116) -> 30041361
A117: =A116+1 -> 111 | B117: =B116 -> 100 | C117: =C116 -> 9.6250000000000002E-2 | D117: =B117*SIN(2*PI()*A117*C117) -> -91.460715979861604 | E117: =E116 -> 1.6452810360417196 | F117: =D117+E117*H116-G116 -> -1970.5823162106344 | G117: =H116 -> 3830.6133841339633 | H117: =F117 -> -1970.5823162106344 | I117: =DEC2HEX(H117) -> FFFFFFF84E | J117: =G117^2+H117^2-E117*G117*H117 -> 30976261.621986546 | K117: =DEC2HEX(J117) -> 1D8A905 | L117: 0001D8BE2D | M117: =HEX2DEC(L117) -> 30981677
A118: =A117+1 -> 112 | B118: =B117 -> 100 | C118: =C117 -> 9.6250000000000002E-2 | D118: =B118*SIN(2*PI()*A118*C118) -> -98.228725072868755 | E118: =E117 -> 1.6452810360417196 | F118: =D118+E118*H117-G117 -> -7171.0038240273561 | G118: =H117 -> -1970.5823162106344 | H118: =F118 -> -7171.0038240273561 | I118: =DEC2HEX(H118) -> FFFFFFE3FD | J118: =G118^2+H118^2-E118*G118*H118 -> 32056936.454083968 | K118: =DEC2HEX(J118) -> 1E92668 | L118: 0001E91497 | M118: =HEX2DEC(L118) -> 32052375
A119: =A118+1 -> 113 | B119: =B118 -> 100 | C119: =C118 -> 9.6250000000000002E-2 | D119: =B119*SIN(2*PI()*A119*C119) -> -70.153142577085291 | E119: =E118 -> 1.6452810360417196 | F119: =D119+E119*H118-G118 -> -9897.8874274213122 | G119: =H118 -> -7171.0038240273561 | H119: =F119 -> -9897.8874274213122 | I119: =DEC2HEX(H119) -> FFFFFFD957 | J119: =G119^2+H119^2-E119*G119*H119 -> 32613061.819802776 | K119: =DEC2HEX(J119) -> 1F1A2C5 | L119: 0001F13455 | M119: =HEX2DEC(L119) -> 32584789
A120: =A119+1 -> 114 | B120: =B119 -> 100 | C120: =C119 -> 9.6250000000000002E-2 | D120: =B120*SIN(2*PI()*A120*C120) -> -17.192910027942084 | E120: =E119 -> 1.6452810360417196 | F120: =D120+E120*H119-G119 -> -9130.9955672126307 | G120: =H119 -> -9897.8874274213122 | H120: =F120 -> -9130.9955672126307 | I120: =DEC2HEX(H120) -> FFFFFFDC56 | J120: =G120^2+H120^2-E120*G120*H120 -> 32646759.781498879 | K120: =DEC2HEX(J120) -> 1F22667 | L120: 0001F199C4 | M120: =HEX2DEC(L120) -> 32610756
A121: =A120+1 -> 115 | B121: =B120 -> 100 | C121: =C120 -> 9.6250000000000002E-2 | D121: =B121*SIN(2*PI()*A121*C121) -> 41.865973753742949 | E121: =E120 -> 1.6452810360417196 | F121: =D121+E121*H120-G120 -> -5083.3004457408897 | G121: =H120 -> -9130.9955672126307 | H121: =F121 -> -5083.3004457408897 | I121: =DEC2HEX(H121) -> FFFFFFEC25 | J121: =G121^2+H121^2-E121*G121*H121 -> 32848327.153709024 | K121: =DEC2HEX(J121) -> 1F539C7 | L121: 0001F4F7C7 | M121: =HEX2DEC(L121) -> 32831431
A122: =A121+1 -> 116 | B122: =B121 -> 100 | C122: =C121 -> 9.6250000000000002E-2 | D122: =B122*SIN(2*PI()*A122*C122) -> 86.07420270039438 | E122: =E121 -> 1.6452810360417196 | F122: =D122+E122*H121-G121 -> 853.61194603311924 | G122: =H121 -> -5083.3004457408897 | H122: =F122 -> 853.61194603311924 | I122: =DEC2HEX(H122) -> 355 | J122: =G122^2+H122^2-E122*G122*H122 -> 33707744.284688018 | K122: =DEC2HEX(J122) -> 20256E0 | L122: 000202517A | M122: =HEX2DEC(L122) -> 33706362
A123: =A122+1 -> 117 | B123: =B122 -> 100 | C123: =C122 -> 9.6250000000000002E-2 | D123: =B123*SIN(2*PI()*A123*C123) -> 99.750279641627017 | E123: =E122 -> 1.6452810360417196 | F123: =D123+E123*H122-G122 -> 6587.4822723294756 | G123: =H122 -> 853.61194603311924 | H123: =F123 -> 6587.4822723294756 | I123: =DEC2HEX(H123) -> 19BB | J123: =G123^2+H123^2-E123*G123*H123 -> 34871908.124452204 | K123: =DEC2HEX(J123) -> 2141A64 | L123: 000214015C | M123: =HEX2DEC(L123) -> 34865500
A124: =A123+1 -> 118 | B124: =B123 -> 100 | C124: =C123 -> 9.6250000000000002E-2 | D124: =B124*SIN(2*PI()*A124*C124) -> 78.043040733833095 | E124: =E123 -> 1.6452810360417196 | F124: =D124+E124*H123-G123 -> 10062.690752625414 | G124: =H123 -> 6587.4822723294756 | H124: =F124 -> 10062.690752625414 | I124: =DEC2HEX(H124) -> 274E | J124: =G124^2+H124^2-E124*G124*H124 -> 35590612.636876166 | K124: =DEC2HEX(J124) -> 21F11D4 | L124: 00021E9F89 | M124: =HEX2DEC(L124) -> 35561353
A125: =A124+1 -> 119 | B125: =B124 -> 100 | C125: =C124 -> 9.6250000000000002E-2 | D125: =B125*SIN(2*PI()*A125*C125) -> 28.652455272780159 | E125: =E124 -> 1.6452810360417196 | F125: =D125+E125*H124-G124 -> 9997.1244497902771 | G125: =H124 -> 10062.690752625414 | H125: =F125 -> 9997.1244497902771 | I125: =DEC2HEX(H125) -> 270D | J125: =G125^2+H125^2-E125*G125*H125 -> 35688307.256862044 | K125: =DEC2HEX(J125) -> 2208F73 | L125: 00021FEFE9 | M125: =HEX2DEC(L125) -> 35647465
A126: =A125+1 -> 120 | B126: =B125 -> 100 | C126: =C125 -> 9.6250000000000002E-2 | D126: =B126*SIN(2*PI()*A126*C126) -> -30.901699437494308 | E126: =E125 -> 1.6452810360417196 | F126: =D126+E126*H125-G125 -> 6354.4868201260433 | G126: =H125 -> 9997.1244497902771 | H126: =F126 -> 6354.4868201260433 | I126: =DEC2HEX(H126) -> 18D2 | J126: =G126^2+H126^2-E126*G126*H126 -> 35802897.06023711 | K126: =DEC2HEX(J126) -> 2224F11 | L126: 000221EEE3 | M126: =HEX2DEC(L126) -> 35778275
A127: =A126+1 -> 121 | B127: =B126 -> 100 | C127: =C126 -> 9.6250000000000002E-2 | D127: =B127*SIN(2*PI()*A127*C127) -> -79.494435338751515 | E127: =E126 -> 1.6452810360417196 | F127: =D127+E127*H126-G126 -> 378.29777380140149 | G127: =H126 -> 6354.4868201260433 | H127: =F127 -> 378.29777380140149 | I127: =DEC2HEX(H127) -> 17A | J127: =G127^2+H127^2-E127*G127*H127 -> 36567540.255466126 | K127: =DEC2HEX(J127) -> 22DF9F4 | L127: 00022DE275 | M127: =HEX2DEC(L127) -> 36561525
A128: =A127+1 -> 122 | B128: =B127 -> 100 | C128: =C127 -> 9.6250000000000002E-2 | D128: =B128*SIN(2*PI()*A128*C128) -> -99.888987496197032 | E128: =E127 -> 1.6452810360417196 | F128: =D128+E128*H127-G127 -> -5831.9696544099943 | G128: =H127 -> 378.29777380140149 | H128: =F128 -> -5831.9696544099943 | I128: =DEC2HEX(H128) -> FFFFFFE939 | J128: =G128^2+H128^2-E128*G128*H128 -> 37784833.053874001 | K128: =DEC2HEX(J128) -> 2408D01 | L128: 0002407FAC | M128: =HEX2DEC(L128) -> 37781420
A129: =A128+1 -> 123 | B129: =B128 -> 100 | C129: =C128 -> 9.6250000000000002E-2 | D129: =B129*SIN(2*PI()*A129*C129) -> -84.8510214981508 | E129: =E128 -> 1.6452810360417196 | F129: =D129+E129*H128-G128 -> -10058.377870471097 | G129: =H128 -> -5831.9696544099943 | H129: =F129 -> -10058.377870471097 | I129: =DEC2HEX(H129) -> FFFFFFD8B6 | J129: =G129^2+H129^2-E129*G129*H129 -> 38670395.643335402 | K129: =DEC2HEX(J129) -> 24E103B | L129: 00024DBAA9 | M129: =HEX2DEC(L129) -> 38648489
A130: =A129+1 -> 124 | B130: =B129 -> 100 | C130: =C129 -> 9.6250000000000002E-2 | D130: =B130*SIN(2*PI()*A130*C130) -> -39.714789063478932 | E130: =E129 -> 1.6452810360417196 | F130: =D130+E130*H129-G129 -> -10756.603498281278 | G130: =H129 -> -10058.377870471097 | H130: =F130 -> -10756.603498281278 | I130: =DEC2HEX(H130) -> FFFFFFD5FC | J130: =G130^2+H130^2-E130*G130*H130 -> 38865976.437659621 | K130: =DEC2HEX(J130) -> 2510C38 | L130: 0002508903 | M130: =HEX2DEC(L130) -> 38832387
A131: =A130+1 -> 125 | B131: =B130 -> 100 | C131: =C130 -> 9.6250000000000002E-2 | D131: =B131*SIN(2*PI()*A131*C131) -> 19.509032201611774 | E131: =E130 -> 1.6452810360417196 | F131: =D131+E131*H130-G130 -> -7619.7488452694997 | G131: =H130 -> -10756.603498281278 | H131: =F131 -> -7619.7488452694997 | I131: =DEC2HEX(H131) -> FFFFFFE23D | J131: =G131^2+H131^2-E131*G131*H131 -> 38913551.72984004 | K131: =DEC2HEX(J131) -> 251C60F | L131: 0002515403 | M131: =HEX2DEC(L131) -> 38884355
A132: =A131+1 -> 126 | B132: =B131 -> 100 | C132: =C131 -> 9.6250000000000002E-2 | D132: =B132*SIN(2*PI()*A132*C132) -> 71.812629776319042 | E132: =E131 -> 1.6452810360417196 | F132: =D132+E132*H131-G131 -> -1708.2121464651027 | G132: =H131 -> -7619.7488452694997 | H132: =F132 -> -1708.2121464651027 | I132: =DEC2HEX(H132) -> FFFFFFF954 | J132: =G132^2+H132^2-E132*G132*H132 -> 39563340.508059278 | K132: =DEC2HEX(J132) -> 25BB04C | L132: 00025BADEF | M132: =HEX2DEC(L132) -> 39562735
A133: =A132+1 -> 127 | B133: =B132 -> 100 | C133: =C132 -> 9.6250000000000002E-2 | D133: =B133*SIN(2*PI()*A133*C133) -> 98.642925717649561 | E133: =E132 -> 1.6452810360417196 | F133: =D133+E133*H132-G132 -> 4907.9027208719954 | G133: =H132 -> -1708.2121464651027 | H133: =F133 -> 4907.9027208719954 | I133: =DEC2HEX(H133) -> 132B | J133: =G133^2+H133^2-E133*G133*H133 -> 40799104.710914761 | K133: =DEC2HEX(J133) -> 26E8B80 | L133: 00026EB206 | M133: =HEX2DEC(L133) -> 40808966
A134: =A133+1 -> 128 | B134: =B133 -> 100 | C134: =C133 -> 9.6250000000000002E-2 | D134: =B134*SIN(2*PI()*A134*C134) -> 90.482705246601967 | E134: =E133 -> 1.6452810360417196 | F134: =D134+E134*H133-G133 -> 9873.5741250999563 | G134: =H133 -> 4907.9027208719954 | H134: =F134 -> 9873.5741250999563 | I134: =DEC2HEX(H134) -> 2691 | J134: =G134^2+H134^2-E134*G134*H134 -> 41847056.064353943 | K134: =DEC2HEX(J134) -> 27E8910 | L134: 00027E20D2 | M134: =HEX2DEC(L134) -> 41820370
A135: =A134+1 -> 129 | B135: =B134 -> 100 | C135: =C134 -> 9.6250000000000002E-2 | D135: =B135*SIN(2*PI()*A135*C135) -> 50.226553314337373 | E135: =E134 -> 1.6452810360417196 | F135: =D135+E135*H134-G134 -> 11387.128098421515 | G135: =H134 -> 9873.5741250999563 | H135: =F135 -> 11387.128098421515 | I135: =DEC2HEX(H135) -> 2C7B | J135: =G135^2+H135^2-E135*G135*H135 -> 42172485.223215044 | K135: =DEC2HEX(J135) -> 2838045 | L135: 000282BB31 | M135: =HEX2DEC(L135) -> 42122033
A136: =A135+1 -> 130 | B136: =B135 -> 100 | C136: =C135 -> 9.6250000000000002E-2 | D136: =B136*SIN(2*PI()*A136*C136) -> -7.8459095727842332 | E136: =E135 -> 1.6452810360417196 | F136: =D136+E136*H135-G135 -> 8853.6058806379879 | G136: =H135 -> 11387.128098421515 | H136: =F136 -> 8853.6058806379879 | I136: =DEC2HEX(H136) -> 2295 | J136: =G136^2+H136^2-E136*G136*H136 -> 42180487.801828206 | K136: =DEC2HEX(J136) -> 2839F87 | L136: 000283084F | M136: =HEX2DEC(L136) -> 42141775
A137: =A136+1 -> 131 | B137: =B136 -> 100 | C137: =C136 -> 9.6250000000000002E-2 | D137: =B137*SIN(2*PI()*A137*C137) -> -63.13527954493857 | E137: =E136 -> 1.6452810360417196 | F137: =D137+E137*H136-G136 -> 3116.4064780346762 | G137: =H136 -> 8853.6058806379879 | H137: =F137 -> 3116.4064780346762 | I137: =DEC2HEX(H137) -> C2C | J137: =G137^2+H137^2-E137*G137*H137 -> 42702662.123369686 | K137: =DEC2HEX(J137) -> 28B9746 | L137: 00028B6E62 | M137: =HEX2DEC(L137) -> 42692194
A138: =A137+1 -> 132 | B138: =B137 -> 100 | C138: =C137 -> 9.6250000000000002E-2 | D138: =B138*SIN(2*PI()*A138*C138) -> -96.029368567694164 | E138: =E137 -> 1.6452810360417196 | F138: =D138+E138*H137-G137 -> -3822.2707702976641 | G138: =H137 -> 3116.4064780346762 | H138: =F138 -> -3822.2707702976641 | I138: =DEC2HEX(H138) -> FFFFFFF112 | J138: =G138^2+H138^2-E138*G138*H138 -> 43919918.554201022 | K138: =DEC2HEX(J138) -> 29E2A2E | L138: 00029E4349 | M138: =HEX2DEC(L138) -> 43926345
A139: =A138+1 -> 133 | B139: =B138 -> 100 | C139: =C138 -> 9.6250000000000002E-2 | D139: =B139*SIN(2*PI()*A139*C139) -> -94.860019462550653 | E139: =E138 -> 1.6452810360417196 | F139: =D139+E139*H138-G138 -> -9499.9761104845493 | G139: =H138 -> -3822.2707702976641 | H139: =F139 -> -9499.9761104845493 | I139: =DEC2HEX(H139) -> FFFFFFDAE5 | J139: =G139^2+H139^2-E139*G139*H139 -> 45116708.852094941 | K139: =DEC2HEX(J139) -> 2B06D24 | L139: 0002B0479A | M139: =HEX2DEC(L139) -> 45107098
A140: =A139+1 -> 134 | B140: =B139 -> 100 | C140: =C139 -> 9.6250000000000002E-2 | D140: =B140*SIN(2*PI()*A140*C140) -> -60.042022532589002 | E140: =E139 -> 1.6452810360417196 | F140: =D140+E140*H139-G139 -> -11867.901789664529 | G140: =H139 -> -9499.9761104845493 | H140: =F140 -> -11867.901789664529 | I140: =DEC2HEX(H140) -> FFFFFFD1A5 | J140: =G140^2+H140^2-E140*G140*H140 -> 45599784.811048687 | K140: =DEC2HEX(J140) -> 2B7CC28 | L140: 0002B74158 | M140: =HEX2DEC(L140) -> 45564248
A141: =A140+1 -> 135 | B141: =B140 -> 100 | C141: =C140 -> 9.6250000000000002E-2 | D141: =B141*SIN(2*PI()*A141*C141) -> -3.9259815759077341 | E141: =E140 -> 1.6452810360417196 | F141: =D141+E141*H140-G140 -> -10029.983623231994 | G141: =H140 -> -11867.901789664529 | H141: =F141 -> -10029.983623231994 | I141: =DEC2HEX(H141) -> FFFFFFD8D3 | J141: =G141^2+H141^2-E141*G141*H141 -> 45601865.610778809 | K141: =DEC2HEX(J141) -> 2B7D449 | L141: 0002B7293C | M141: =HEX2DEC(L141) -> 45558076
A142: =A141+1 -> 136 | B142: =B141 -> 100 | C142: =C141 -> 9.6250000000000002E-2 | D142: =B142*SIN(2*PI()*A142*C142) -> 53.582679497900024 | E142: =E141 -> 1.6452810360417196 | F142: =D142+E142*H141-G141 -> -4580.6573779501869 | G142: =H141 -> -10029.983623231994 | H142: =F142 -> -4580.6573779501869 | I142: =DEC2HEX(H142) -> FFFFFFEE1C | J142: =G142^2+H142^2-E142*G142*H142 -> 45992335.692514554 | K142: =DEC2HEX(J142) -> 2BDC98F | L142: 0002BD8166 | M142: =HEX2DEC(L142) -> 45973862
A143: =A142+1 -> 137 | B143: =B142 -> 100 | C143: =C142 -> 9.6250000000000002E-2 | D143: =B143*SIN(2*PI()*A143*C143) -> 92.084548014102737 | E143: =E142 -> 1.6452810360417196 | F143: =D143+E143*H142-G142 -> 2585.5994547000664 | G143: =H142 -> -4580.6573779501869 | H143: =F143 -> 2585.5994547000664 | I143: =DEC2HEX(H143) -> A19 | J143: =G143^2+H143^2-E143*G143*H143 -> 47154035.958180286 | K143: =DEC2HEX(J143) -> 2CF8373 | L143: 0002CF726D | M143: =HEX2DEC(L143) -> 47149677
A144: =A143+1 -> 138 | B144: =B143 -> 100 | C144: =C143 -> 9.6250000000000002E-2 | D144: =B144*SIN(2*PI()*A144*C144) -> 97.922281062176538 | E144: =E143 -> 1.6452810360417196 | F144: =D144+E144*H143-G143 -> 8932.6174086301944 | G144: =H143 -> 2585.5994547000664 | H144: =F144 -> 8932.6174086301944 | I144: =DEC2HEX(H144) -> 22E4 | J144: =G144^2+H144^2-E144*G144*H144 -> 48477286.649902232 | K144: =DEC2HEX(J144) -> 2E3B466 | L144: 0002E3579C | M144: =HEX2DEC(L144) -> 48453532
A145: =A144+1 -> 139 | B145: =B144 -> 100 | C145: =C144 -> 9.6250000000000002E-2 | D145: =B145*SIN(2*PI()*A145*C145) -> 69.025124023443681 | E145: =E144 -> 1.6452810360417196 | F145: =D145+E145*H144-G144 -> 12180.091693958764 | G145: =H144 -> 8932.6174086301944 | H145: =F145 -> 12180.091693958764 | I145: =DEC2HEX(H145) -> 2F94 | J145: =G145^2+H145^2-E145*G145*H145 -> 49139547.666659057 | K145: =DEC2HEX(J145) -> 2EDCF5B | L145: 0002ECDEA5 | M145: =HEX2DEC(L145) -> 49077925
A146: =A145+1 -> 140 | B146: =B145 -> 100 | C146: =C145 -> 9.6250000000000002E-2 | D146: =B146*SIN(2*PI()*A146*C146) -> 15.643446504023148 | E146: =E145 -> 1.6452810360417196 | F146: =D146+E146*H145-G145 -> 11122.699919193448 | G146: =H145 -> 12180.091693958764 | H146: =F146 -> 11122.699919193448 | I146: =DEC2HEX(H146) -> 2B72 | J146: =G146^2+H146^2-E146*G146*H146 -> 49173808.105252415 | K146: =DEC2HEX(J146) -> 2EE5530 | L146: 0002ED4DBA | M146: =HEX2DEC(L146) -> 49106362
A147: =A146+1 -> 141 | B147: =B146 -> 100 | C147: =C146 -> 9.6250000000000002E-2 | D147: =B147*SIN(2*PI()*A147*C147) -> -43.287258152041225 | E147: =E146 -> 1.6452810360417196 | F147: =D147+E147*H146-G146 -> 6076.5882945209396 | G147: =H146 -> 11122.699919193448 | H147: =F147 -> 6076.5882945209396 | I147: =DEC2HEX(H147) -> 17BC | J147: =G147^2+H147^2-E147*G147*H147 -> 49438012.032535791 | K147: =DEC2HEX(J147) -> 2F25D3C | L147: 0002F1C3C3 | M147: =HEX2DEC(L147) -> 49398723
A148: =A147+1 -> 142 | B148: =B147 -> 100 | C148: =C147 -> 9.6250000000000002E-2 | D148: =B148*SIN(2*PI()*A148*C148) -> -86.863151443818978 | E148: =E147 -> 1.6452810360417196 | F148: =D148+E148*H147-G147 -> -1211.8675858288698 | G148: =H147 -> 6076.5882945209396 | H148: =F148 -> -1211.8675858288698 | I148: =DEC2HEX(H148) -> FFFFFFFB45 | J148: =G148^2+H148^2-E148*G148*H148 -> 50509431.43771854 | K148: =DEC2HEX(J148) -> 302B677 | L148: 0003029B3C | M148: =HEX2DEC(L148) -> 50502460
A149: =A148+1 -> 143 | B149: =B148 -> 100 | C149: =C148 -> 9.6250000000000002E-2 | D149: =B149*SIN(2*PI()*A149*C149) -> -99.627037649294166 | E149: =E148 -> 1.6452810360417196 | F149: =D149+E149*H148-G148 -> -8170.0780893281344 | G149: =H148 -> -1211.8675858288698 | H149: =F149 -> -8170.0780893281344 | I149: =DEC2HEX(H149) -> FFFFFFE016 | J149: =G149^2+H149^2-E149*G149*H149 -> 51928784.605919205 | K149: =DEC2HEX(J149) -> 3185ED0 | L149: 0003184414 | M149: =HEX2DEC(L149) -> 51921940
A150: =A149+1 -> 144 | B150: =B149 -> 100 | C150: =C149 -> 9.6250000000000002E-2 | D150: =B150*SIN(2*PI()*A150*C150) -> -77.051324277579283 | E150: =E149 -> 1.6452810360417196 | F150: =D150+E150*H149-G149 -> -12307.258281800256 | G150: =H149 -> -8170.0780893281344 | H150: =F150 -> -12307.258281800256 | I150: =DEC2HEX(H150) -> FFFFFFCFED | J150: =G150^2+H150^2-E150*G150*H150 -> 52783699.152420938 | K150: =DEC2HEX(J150) -> 3256A53 | L150: 000324C5D5 | M150: =HEX2DEC(L150) -> 52741589
A151: =A150+1 -> 145 | B151: =B150 -> 100 | C151: =C150 -> 9.6250000000000002E-2 | D151: =B151*SIN(2*PI()*A151*C151) -> -27.144044986508074 | E151: =E150 -> 1.6452810360417196 | F151: =D151+E151*H150-G150 -> -12105.964612371732 | G151: =H150 -> -12307.258281800256 | H151: =F151 -> -12105.964612371732 | I151: =DEC2HEX(H151) -> FFFFFFD0B7 | J151: =G151^2+H151^2-E151*G151*H151 -> 52890535.03326425 | K151: =DEC2HEX(J151) -> 3270BA7 | L151: 0003260D02 | M151: =HEX2DEC(L151) -> 52825346
A152: =A151+1 -> 146 | B152: =B151 -> 100 | C152: =C151 -> 9.6250000000000002E-2 | D152: =B152*SIN(2*PI()*A152*C152) -> 32.391741819814193 | E152: =E151 -> 1.6452810360417196 | F152: =D152+E152*H151-G151 -> -7578.0639761072889 | G152: =H151 -> -12105.964612371732 | H152: =F152 -> -7578.0639761072889 | I152: =DEC2HEX(H152) -> FFFFFFE266 | J152: =G152^2+H152^2-E152*G152*H152 -> 53043721.874229968 | K152: =DEC2HEX(J152) -> 3296209 | L152: 0003289DB0 | M152: =HEX2DEC(L152) -> 52993456
A153: =A152+1 -> 147 | B153: =B152 -> 100 | C153: =C152 -> 9.6250000000000002E-2 | D153: =B153*SIN(2*PI()*A153*C153) -> 80.437563527008749 | E153: =E152 -> 1.6452810360417196 | F153: =D153+E153*H152-G152 -> -281.64277390149255 | G153: =H152 -> -7578.0639761072889 | H153: =F153 -> -281.64277390149255 | I153: =DEC2HEX(H153) -> FFFFFFFEE7 | J153: =G153^2+H153^2-E153*G153*H153 -> 53994841.513275713 | K153: =DEC2HEX(J153) -> 337E559 | L153: 000337827A | M153: =HEX2DEC(L153) -> 53969530
A154: =A153+1 -> 148 | B154: =B153 -> 100 | C154: =C153 -> 9.6250000000000002E-2 | D154: =B154*SIN(2*PI()*A154*C154) -> 99.950656036573164 | E154: =E153 -> 1.6452810360417196 | F154: =D154+E154*H153-G153 -> 7214.6331173055505 | G154: =H153 -> -281.64277390149255 | H154: =F154 -> 7214.6331173055505 | I154: =DEC2HEX(H154) -> 1C2E | J154: =G154^2+H154^2-E154*G154*H154 -> 55473381.29231263 | K154: =DEC2HEX(J154) -> 34E74E5 | L154: 00034E0969 | M154: =HEX2DEC(L154) -> 55445865
A155: =A154+1 -> 149 | B155: =B154 -> 100 | C155: =C154 -> 9.6250000000000002E-2 | D155: =B155*SIN(2*PI()*A155*C155) -> 84.00935538989404 | E155: =E154 -> 1.6452810360417196 | F155: =D155+E155*H154-G154 -> 12235.751179192763 | G155: =H154 -> 7214.6331173055505 | H155: =F155 -> 12235.751179192763 | I155: =DEC2HEX(H155) -> 2FCB | J155: =G155^2+H155^2-E155*G155*H155 -> 56524959.489473432 | K155: =DEC2HEX(J155) -> 35E809F | L155: 00035D8E50 | M155: =HEX2DEC(L155) -> 56462928
A156: =A155+1 -> 150 | B156: =B155 -> 100 | C156: =C155 -> 9.6250000000000002E-2 | D156: =B156*SIN(2*PI()*A156*C156) -> 38.268343236508855 | E156: =E155 -> 1.6452810360417196 | F156: =D156+E156*H155-G155 -> 12954.884602781916 | G156: =H155 -> 12235.751179192763 | H156: =F156 -> 12954.884602781916 | I156: =DEC2HEX(H156) -> 329A | J156: =G156^2+H156^2-E156*G156*H156 -> 56744629.403583556 | K156: =DEC2HEX(J156) -> 361DAB5 | L156: 0003606218 | M156: =HEX2DEC(L156) -> 56648216
A157: =A156+1 -> 151 | B157: =B156 -> 100 | C157: =C156 -> 9.6250000000000002E-2 | D157: =B157*SIN(2*PI()*A157*C157) -> -21.047175982130579 | E157: =E156 -> 1.6452810360417196 | F157: =D157+E157*H156-G156 -> 9057.6276058910607 | G157: =H156 -> 12954.884602781916 | H157: =F157 -> 9057.6276058910607 | I157: =DEC2HEX(H157) -> 2361 | J157: =G157^2+H157^2-E157*G157*H157 -> 56811519.92972371 | K157: =DEC2HEX(J157) -> 362DFFF | L157: 000361B0DC | M157: =HEX2DEC(L157) -> 56733916
A158: =A157+1 -> 152 | B158: =B157 -> 100 | C158: =C157 -> 9.6250000000000002E-2 | D158: =B158*SIN(2*PI()*A158*C158) -> -72.896862742141067 | E158: =E157 -> 1.6452810360417196 | F158: =D158+E158*H157-G157 -> 1874.5614659764669 | G158: =H157 -> 9057.6276058910607 | H158: =F158 -> 1874.5614659764669 | I158: =DEC2HEX(H158) -> 752 | J158: =G158^2+H158^2-E158*G158*H158 -> 57619240.724565998 | K158: =DEC2HEX(J158) -> 36F3328 | L158: 00036E98ED | M158: =HEX2DEC(L158) -> 57579757
A159: =A158+1 -> 153 | B159: =B158 -> 100 | C159: =C158 -> 9.6250000000000002E-2 | D159: =B159*SIN(2*PI()*A159*C159) -> -98.888649874450422 | E159: =E158 -> 1.6452810360417196 | F159: =D159+E159*H158-G158 -> -6072.3358248998647 | G159: =H158 -> 1874.5614659764669 | H159: =F159 -> -6072.3358248998647 | I159: =DEC2HEX(H159) -> FFFFFFE848 | J159: =G159^2+H159^2-E159*G159*H159 -> 59115422.380886719 | K159: =DEC2HEX(J159) -> 386079E | L159: 0003859A7E | M159: =HEX2DEC(L159) -> 59087486
A160: =A159+1 -> 154 | B160: =B159 -> 100 | C160: =C159 -> 9.6250000000000002E-2 | D160: =B160*SIN(2*PI()*A160*C160) -> -89.802757576061722 | E160: =E159 -> 1.6452810360417196 | F160: =D160+E160*H159-G159 -> -11955.06320073703 | G160: =H159 -> -6072.3358248998647 | H160: =F160 -> -11955.06320073703 | I160: =DEC2HEX(H160) -> FFFFFFD14D | J160: =G160^2+H160^2-E160*G160*H160 -> 60357360.812199533 | K160: =DEC2HEX(J160) -> 398FAF0 | L160: 00039828AF | M160: =HEX2DEC(L160) -> 60303535
A161: =A160+1 -> 155 | B161: =B160 -> 100 | C161: =C160 -> 9.6250000000000002E-2 | D161: =B161*SIN(2*PI()*A161*C161) -> -48.862124149695909 | E161: =E160 -> 1.6452810360417196 | F161: =D161+E161*H160-G160 -> -13645.965068102685 | G161: =H160 -> -11955.06320073703 | H161: =F161 -> -13645.965068102685 | I161: =DEC2HEX(H161) -> FFFFFFCAB3 | J161: =G161^2+H161^2-E161*G161*H161 -> 60727424.424544692 | K161: =DEC2HEX(J161) -> 39EA080 | L161: 00039D53D0 | M161: =HEX2DEC(L161) -> 60642256
A162: =A161+1 -> 156 | B162: =B161 -> 100 | C162: =C161 -> 9.6250000000000002E-2 | D162: =B162*SIN(2*PI()*A162*C162) -> 9.4108313318508348 | E162: =E161 -> 1.6452810360417196 | F162: =D162+E162*H161-G161 -> -10486.973512968219 | G162: =H161 -> -13645.965068102685 | H162: =F162 -> -10486.973512968219 | I162: =DEC2HEX(H162) -> FFFFFFD70A | J162: =G162^2+H162^2-E162*G162*H162 -> 60741240.368976325 | K162: =DEC2HEX(J162) -> 39ED678 | L162: 00039D9216 | M162: =HEX2DEC(L162) -> 60658198
A163: =A162+1 -> 157 | B163: =B162 -> 100 | C163: =C162 -> 9.6250000000000002E-2 | D163: =B163*SIN(2*PI()*A163*C163) -> 64.345586473377352 | E163: =E162 -> 1.6452810360417196 | F163: =D163+E163*H162-G162 -> -3543.707991782363 | G163: =H162 -> -10486.973512968219 | H163: =F163 -> -3543.707991782363 | I163: =DEC2HEX(H163) -> FFFFFFF229 | J163: =G163^2+H163^2-E163*G163*H163 -> 61391276.025256924 | K163: =DEC2HEX(J163) -> 3A8C1AC | L163: 0003A7EA8C | M163: =HEX2DEC(L163) -> 61336204
A164: =A163+1 -> 158 | B164: =B163 -> 100 | C164: =C163 -> 9.6250000000000002E-2 | D164: =B164*SIN(2*PI()*A164*C164) -> 96.455741845779968 | E164: =E163 -> 1.6452810360417196 | F164: =D164+E164*H163-G163 -> 4753.0336986649918 | G164: =H163 -> -3543.707991782363 | H164: =F164 -> 4753.0336986649918 | I164: =DEC2HEX(H164) -> 1291 | J164: =G164^2+H164^2-E164*G164*H164 -> 62861262.226590052 | K164: =DEC2HEX(J164) -> 3BF2FCE | L164: 0003BE6609 | M164: =HEX2DEC(L164) -> 62809609
A165: =A164+1 -> 159 | B165: =B164 -> 100 | C165: =C164 -> 9.6250000000000002E-2 | D165: =B165*SIN(2*PI()*A165*C165) -> 94.351216402819205 | E165: =E164 -> 1.6452810360417196 | F165: =D165+E165*H164-G164 -> 11458.135416265926 | G165: =H164 -> 4753.0336986649918 | H165: =F165 -> 11458.135416265926 | I165: =DEC2HEX(H165) -> 2CC2 | J165: =G165^2+H165^2-E165*G165*H165 -> 64276704.400424004 | K165: =DEC2HEX(J165) -> 3D4C8E0 | L165: 0003D36729 | M165: =HEX2DEC(L165) -> 64186153
A166: =A165+1 -> 160 | B166: =B165 -> 100 | C166: =C165 -> 9.6250000000000002E-2 | D166: =B166*SIN(2*PI()*A166*C166) -> 58.778525229247037 | E166: =E165 -> 1.6452810360417196 | F166: =D166+E166*H165-G165 -> 14157.597735344578 | G166: =H165 -> 11458.135416265926 | H166: =F166 -> 14157.597735344578 | I166: =DEC2HEX(H166) -> 374D | J166: =G166^2+H166^2-E166*G166*H166 -> 64829490.804924071 | K166: =DEC2HEX(J166) -> 3DD3832 | L166: 0003DB29AC | M166: =HEX2DEC(L166) -> 64694700
A167: =A166+1 -> 161 | B167: =B166 -> 100 | C167: =C166 -> 9.6250000000000002E-2 | D167: =B167*SIN(2*PI()*A167*C167) -> 2.3559764833608043 | E167: =E166 -> 1.6452810360417196 | F167: =D167+E167*H166-G166 -> 11837.447630087066 | G167: =H166 -> 14157.597735344578 | H167: =F167 -> 11837.447630087066 | I167: =DEC2HEX(H167) -> 2E3D | J167: =G167^2+H167^2-E167*G167*H167 -> 64830384.455579698 | K167: =DEC2HEX(J167) -> 3DD3BB0 | L167: 0003DB3AA8 | M167: =HEX2DEC(L167) -> 64699048
A168: =A167+1 -> 162 | B168: =B167 -> 100 | C168: =C167 -> 9.6250000000000002E-2 | D168: =B168*SIN(2*PI()*A168*C168) -> -54.902281799813245 | E168: =E167 -> 1.6452810360417196 | F168: =D168+E168*H167-G167 -> 5263.4280837748556 | G168: =H167 -> 11837.447630087066 | H168: =F168 -> 5263.4280837748556 | I168: =DEC2HEX(H168) -> 148F | J168: =G168^2+H168^2-E168*G168*H168 -> 65318694.664165497 | K168: =DEC2HEX(J168) -> 3E4AF26 | L168: 0003E34379 | M168: =HEX2DEC(L168) -> 65225593
A169: =A168+1 -> 163 | B169: =B168 -> 100 | C169: =C168 -> 9.6250000000000002E-2 | D169: =B169*SIN(2*PI()*A169*C169) -> -92.68565956401153 | E169: =E168 -> 1.6452810360417196 | F169: =D169+E169*H168-G168 -> -3270.3148788469007 | G169: =H168 -> 5263.4280837748556 | H169: =F169 -> -3270.3148788469007 | I169: =DEC2HEX(H169) -> FFFFFFF33A | J169: =G169^2+H169^2-E169*G169*H169 -> 66718967.59684249 | K169: =DEC2HEX(J169) -> 3FA0CF7 | L169: 0003F925B8 | M169: =HEX2DEC(L169) -> 66659768
A170: =A169+1 -> 164 | B170: =B169 -> 100 | C170: =C169 -> 9.6250000000000002E-2 | D170: =B170*SIN(2*PI()*A170*C170) -> -97.591676193875088 | E170: =E169 -> 1.6452810360417196 | F170: =D170+E170*H169-G169 -> -10741.606812020611 | G170: =H169 -> -3270.3148788469007 | H170: =F170 -> -10741.606812020611 | I170: =DEC2HEX(H170) -> FFFFFFD60B | J170: =G170^2+H170^2-E170*G170*H170 -> 68280925.779864654 | K170: =DEC2HEX(J170) -> 411E25D | L170: 000410B3AD | M170: =HEX2DEC(L170) -> 68203437
A171: =A170+1 -> 165 | B171: =B170 -> 100 | C171: =C170 -> 9.6250000000000002E-2 | D171: =B171*SIN(2*PI()*A171*C171) -> -67.880074553295415 | E171: =E170 -> 1.6452810360417196 | F171: =D171+E171*H170-G170 -> -14470.52718014046 | G171: =H170 -> -10741.606812020611 | H171: =F171 -> -14470.52718014046 | I171: =DEC2HEX(H171) -> FFFFFFC77A | J171: =G171^2+H171^2-E171*G171*H171 -> 69041197.025889248 | K171: =DEC2HEX(J171) -> 41D7C2D | L171: 00041BCCD2 | M171: =HEX2DEC(L171) -> 68930770
A172: =A171+1 -> 166 | B172: =B171 -> 100 | C172: =C171 -> 9.6250000000000002E-2 | D172: =B172*SIN(2*PI()*A172*C172) -> -14.090123193757256 | E172: =E171 -> 1.6452810360417196 | F172: =D172+E172*H171-G171 -> -13080.567262184504 | G172: =H171 -> -14470.52718014046 | H172: =F172 -> -13080.567262184504 | I172: =DEC2HEX(H172) -> FFFFFFCCE8 | J172: =G172^2+H172^2-E172*G172*H172 -> 69074153.266777337 | K172: =DEC2HEX(J172) -> 41DFCE9 | L172: 00041C0300 | M172: =HEX2DEC(L172) -> 68944640
A173: =A172+1 -> 167 | B173: =B172 -> 100 | C173: =C172 -> 9.6250000000000002E-2 | D173: =B173*SIN(2*PI()*A173*C173) -> 44.697862067112915 | E173: =E172 -> 1.6452810360417196 | F173: =D173+E173*H172-G172 -> -7005.9842149327451 | G173: =H172 -> -13080.567262184504 | H173: =F173 -> -7005.9842149327451 | I173: =DEC2HEX(H173) -> FFFFFFE4A3 | J173: =G173^2+H173^2-E173*G173*H173 -> 69407802.37863028 | K173: =DEC2HEX(J173) -> 423143A | L173: 00042192A9 | M173: =HEX2DEC(L173) -> 69309097
A174: =A173+1 -> 168 | B174: =B173 -> 100 | C174: =C173 -> 9.6250000000000002E-2 | D174: =B174*SIN(2*PI()*A174*C174) -> 87.630668004386735 | E174: =E173 -> 1.6452810360417196 | F174: =D174+E174*H173-G173 -> 1641.3849625524108 | G174: =H173 -> -7005.9842149327451 | H174: =F174 -> 1641.3849625524108 | I174: =DEC2HEX(H174) -> 669 | J174: =G174^2+H174^2-E174*G174*H174 -> 70697896.886412621 | K174: =DEC2HEX(J174) -> 436C3A8 | L174: 000435D3C2 | M174: =HEX2DEC(L174) -> 70636482
A175: =A174+1 -> 169 | B175: =B174 -> 100 | C175: =C174 -> 9.6250000000000002E-2 | D175: =B175*SIN(2*PI()*A175*C175) -> 99.479214176172576 | E175: =E174 -> 1.6452810360417196 | F175: =D175+E175*H174-G174 -> 9806.002980840447 | G175: =H174 -> 1641.3849625524108 | H175: =F175 -> 9806.002980840447 | I175: =DEC2HEX(H175) -> 264E | J175: =G175^2+H175^2-E175*G175*H175 -> 72370340.16138801 | K175: =DEC2HEX(J175) -> 45048A4 | L175: 00044EF725 | M175: =HEX2DEC(L175) -> 72283941
A176: =A175+1 -> 170 | B176: =B175 -> 100 | C176: =C175 -> 9.6250000000000002E-2 | D176: =B176*SIN(2*PI()*A176*C176) -> 76.040596560002754 | E176: =E175 -> 1.6452810360417196 | F176: =D176+E176*H175-G175 -> 14568.286377752953 | G176: =H175 -> 9806.002980840447 | H176: =F176 -> 14568.286377752953 | I176: =DEC2HEX(H176) -> 38E8 | J176: =G176^2+H176^2-E176*G176*H176 -> 73353309.456672192 | K176: =DEC2HEX(J176) -> 45F485D | L176: 00045D297F | M176: =HEX2DEC(L176) -> 73214335
A177: =A176+1 -> 171 | B177: =B176 -> 100 | C177: =C176 -> 9.6250000000000002E-2 | D177: =B177*SIN(2*PI()*A177*C177) -> 25.628937313299264 | E177: =E176 -> 1.6452810360417196 | F177: =D177+E177*H176-G176 -> 14188.551261414701 | G177: =H176 -> 14568.286377752953 | H177: =F177 -> 14188.551261414701 | I177: =DEC2HEX(H177) -> 376C | J177: =G177^2+H177^2-E177*G177*H177 -> 73465629.511827588 | K177: =DEC2HEX(J177) -> 460FF1D | L177: 00045E77B7 | M177: =HEX2DEC(L177) -> 73299895
A178: =A177+1 -> 172 | B178: =B177 -> 100 | C178: =C177 -> 9.6250000000000002E-2 | D178: =B178*SIN(2*PI()*A178*C178) -> -33.873792024528072 | E178: =E177 -> 1.6452810360417196 | F178: =D178+E178*H177-G177 -> 8741.9941495339444 | G178: =H177 -> 14188.551261414701 | H178: =F178 -> 8741.9941495339444 | I178: =DEC2HEX(H178) -> 2225 | J178: =G178^2+H178^2-E178*G178*H178 -> 73662988.123040348 | K178: =DEC2HEX(J178) -> 464020C | L178: 000461FFE5 | M178: =HEX2DEC(L178) -> 73531365
A179: =A178+1 -> 173 | B179: =B178 -> 100 | C179: =C178 -> 9.6250000000000002E-2 | D179: =B179*SIN(2*PI()*A179*C179) -> -81.360844950077976 | E179: =E178 -> 1.6452810360417196 | F179: =D179+E179*H178-G178 -> 113.12508505108235 | G179: =H178 -> 8741.9941495339444 | H179: =F179 -> 113.12508505108235 | I179: =DEC2HEX(H179) -> 71 | J179: =G179^2+H179^2-E179*G179*H179 -> 74808176.689781725 | K179: =DEC2HEX(J179) -> 4757B70 | L179: 00047429BA | M179: =HEX2DEC(L179) -> 74721722
A180: =A179+1 -> 174 | B180: =B179 -> 100 | C180: =C179 -> 9.6250000000000002E-2 | D180: =B180*SIN(2*PI()*A180*C180) -> -99.987663248166029 | E180: =E179 -> 1.6452810360417196 | F180: =D180+E180*H179-G179 -> -8655.8592556469575 | G180: =H179 -> 113.12508505108235 | H180: =F180 -> -8655.8592556469575 | I180: =DEC2HEX(H180) -> FFFFFFDE31 | J180: =G180^2+H180^2-E180*G180*H180 -> 76547747.397299901 | K180: =DEC2HEX(J180) -> 49006A3 | L180: 00048EC49A | M180: =HEX2DEC(L180) -> 76465306
A181: =A180+1 -> 175 | B181: =B180 -> 100 | C181: =C180 -> 9.6250000000000002E-2 | D181: =B181*SIN(2*PI()*A181*C181) -> -83.146961230255357 | E181: =E180 -> 1.6452810360417196 | F181: =D181+E181*H180-G180 -> -14437.593130243471 | G181: =H180 -> -8655.8592556469575 | H181: =F181 -> -14437.593130243471 | I181: =DEC2HEX(H181) -> FFFFFFC79B | J181: =G181^2+H181^2-E181*G181*H181 -> 77757595.400619388 | K181: =DEC2HEX(J181) -> 4A27C9B | L181: 0004A06730 | M181: =HEX2DEC(L181) -> 77621040
A182: =A181+1 -> 176 | B182: =B181 -> 100 | C182: =C181 -> 9.6250000000000002E-2 | D182: =B182*SIN(2*PI()*A182*C182) -> -36.812455268469307 | E182: =E181 -> 1.6452810360417196 | F182: =D182+E182*H181-G181 -> -15134.851382897303 | G182: =H181 -> -14437.593130243471 | H182: =F182 -> -15134.851382897303 | I182: =DEC2HEX(H182) -> FFFFFFC4E2 | J182: =G182^2+H182^2-E182*G182*H182 -> 77996103.008488536 | K182: =DEC2HEX(J182) -> 4A62047 | L182: 0004A37D8D | M182: =HEX2DEC(L182) -> 77823373
A183: =A182+1 -> 177 | B183: =B182 -> 100 | C183: =C182 -> 9.6250000000000002E-2 | D183: =B183*SIN(2*PI()*A183*C183) -> 22.580126686911438 | E183: =E182 -> 1.6452810360417196 | F183: =D183+E183*H182-G182 -> -10440.910706660345 | G183: =H182 -> -15134.851382897303 | H183: =F183 -> -10440.910706660345 | I183: =DEC2HEX(H183) -> FFFFFFD738 | J183: =G183^2+H183^2-E183*G183*H183 -> 78086348.603940368 | K183: =DEC2HEX(J183) -> 4A780CC | L183: 0004A531D2 | M183: =HEX2DEC(L183) -> 77935058
A184: =A183+1 -> 178 | B184: =B183 -> 100 | C184: =C183 -> 9.6250000000000002E-2 | D184: =B184*SIN(2*PI()*A184*C184) -> 73.963109497861623 | E184: =E183 -> 1.6452810360417196 | F184: =D184+E184*H183-G183 -> -1969.4178922780502 | G184: =H183 -> -10440.910706660345 | H184: =F184 -> -1969.4178922780502 | I184: =DEC2HEX(H184) -> FFFFFFF84F | J184: =G184^2+H184^2-E184*G184*H184 -> 79060105.002793878 | K184: =DEC2HEX(J184) -> 4B65C89 | L184: 0004B4BCF4 | M184: =HEX2DEC(L184) -> 78953716
A185: =A184+1 -> 179 | B185: =B184 -> 100 | C185: =C184 -> 9.6250000000000002E-2 | D185: =B185*SIN(2*PI()*A185*C185) -> 99.109974736597593 | E185: =E184 -> 1.6452810360417196 | F185: =D185+E185*H184-G184 -> 7299.7747711906122 | G185: =H184 -> -1969.4178922780502 | H185: =F185 -> 7299.7747711906122 | I185: =DEC2HEX(H185) -> 1C83 | J185: =G185^2+H185^2-E185*G185*H185 -> 80818383.8923136 | K185: =DEC2HEX(J185) -> 4D130CF | L185: 0004CF9715 | M185: =HEX2DEC(L185) -> 80713493
A186: =A185+1 -> 180 | B186: =B185 -> 100 | C186: =C185 -> 9.6250000000000002E-2 | D186: =B186*SIN(2*PI()*A186*C186) -> 89.100652418836461 | E186: =E185 -> 1.6452810360417196 | F186: =D186+E186*H185-G185 -> 14068.699543112583 | G186: =H185 -> 7299.7747711906122 | H186: =F186 -> 14068.699543112583 | I186: =DEC2HEX(H186) -> 36F4 | J186: =G186^2+H186^2-E186*G186*H186 -> 82247390.619376838 | K186: =DEC2HEX(J186) -> 4E6FEDE | L186: 0004E4A514 | M186: =HEX2DEC(L186) -> 82093332
A187: =A186+1 -> 181 | B187: =B186 -> 100 | C187: =C186 -> 9.6250000000000002E-2 | D187: =B187*SIN(2*PI()*A187*C187) -> 47.485638987060177 | E187: =E186 -> 1.6452810360417196 | F187: =D187+E187*H186-G186 -> 15894.67542784839 | G187: =H186 -> 14068.699543112583 | H187: =F187 -> 15894.67542784839 | I187: =DEC2HEX(H187) -> 3E16 | J187: =G187^2+H187^2-E187*G187*H187 -> 82655524.969088554 | K187: =DEC2HEX(J187) -> 4ED3924 | L187: 0004EA0C90 | M187: =HEX2DEC(L187) -> 82447504
A188: =A187+1 -> 182 | B188: =B187 -> 100 | C188: =C187 -> 9.6250000000000002E-2 | D188: =B188*SIN(2*PI()*A188*C188) -> -10.973431109103595 | E188: =E187 -> 1.6452810360417196 | F188: =D188+E188*H187-G187 -> 12071.535081255573 | G188: =H187 -> 15894.67542784839 | H188: =F188 -> 12071.535081255573 | I188: =DEC2HEX(H188) -> 2F27 | J188: =G188^2+H188^2-E188*G188*H188 -> 82677440.71572423 | K188: =DEC2HEX(J188) -> 4ED8EC0 | L188: 0004EA8F39 | M188: =HEX2DEC(L188) -> 82480953
A189: =A188+1 -> 183 | B189: =B188 -> 100 | C189: =C188 -> 9.6250000000000002E-2 | D189: =B189*SIN(2*PI()*A189*C189) -> -65.540017091178598 | E189: =E188 -> 1.6452810360417196 | F189: =D189+E189*H188-G188 -> 3900.8523001625654 | G189: =H188 -> 12071.535081255573 | H189: =F189 -> 3900.8523001625654 | I189: =DEC2HEX(H189) -> F3C | J189: =G189^2+H189^2-E189*G189*H189 -> 83463516.088501379 | K189: =DEC2HEX(J189) -> 4F98D5C | L189: 0004F795F6 | M189: =HEX2DEC(L189) -> 83334646
A190: =A189+1 -> 184 | B190: =B189 -> 100 | C190: =C189 -> 9.6250000000000002E-2 | D190: =B190*SIN(2*PI()*A190*C190) -> -96.858316112862823 | E190: =E189 -> 1.6452810360417196 | F190: =D190+E190*H189-G189 -> -5750.3950835112455 | G190: =H189 -> 3900.8523001625654 | H190: =F190 -> -5750.3950835112455 | I190: =DEC2HEX(H190) -> FFFFFFE98A | J190: =G190^2+H190^2-E190*G190*H190 -> 85189718.234141737 | K190: =DEC2HEX(J190) -> 513E456 | L190: 0005126E43 | M190: =HEX2DEC(L190) -> 85093955
A191: =A190+1 -> 185 | B191: =B190 -> 100 | C191: =C190 -> 9.6250000000000002E-2 | D191: =B191*SIN(2*PI()*A191*C191) -> -93.819133592248875 | E191: =E190 -> 1.6452810360417196 | F191: =D191+E191*H190-G190 -> -13455.687414403408 | G191: =H190 -> -5750.3950835112455 | H191: =F191 -> -13455.687414403408 | I191: =DEC2HEX(H191) -> FFFFFFCB71 | J191: =G191^2+H191^2-E191*G191*H191 -> 86818093.752321795 | K191: =DEC2HEX(J191) -> 52CBD2D | L191: 00052ADB7D | M191: =HEX2DEC(L191) -> 86694781
A192: =A191+1 -> 186 | B192: =B191 -> 100 | C192: =C191 -> 9.6250000000000002E-2 | D192: =B192*SIN(2*PI()*A192*C192) -> -57.500525204329023 | E192: =E191 -> 1.6452810360417196 | F192: =D192+E192*H191-G191 -> -16445.492771516252 | G192: =H191 -> -13455.687414403408 | H192: =F192 -> -16445.492771516252 | I192: =DEC2HEX(H192) -> FFFFFFBFC3 | J192: =G192^2+H192^2-E192*G192*H192 -> 87433067.486493766 | K192: =DEC2HEX(J192) -> 5361F6B | L192: 0005337DDB | M192: =HEX2DEC(L192) -> 87260635
A193: =A192+1 -> 187 | B193: =B192 -> 100 | C193: =C192 -> 9.6250000000000002E-2 | D193: =B193*SIN(2*PI()*A193*C193) -> -0.78539008886983797 | E193: =E192 -> 1.6452810360417196 | F193: =D193+E193*H192-G192 -> -13602.555361022332 | G193: =H192 -> -16445.492771516252 | H193: =F193 -> -13602.555361022332 | I193: =DEC2HEX(H193) -> FFFFFFCADE | J193: =G193^2+H193^2-E193*G193*H193 -> 87433182.835123301 | K193: =DEC2HEX(J193) -> 5361FDE | L193: 000533651C | M193: =HEX2DEC(L193) -> 87254300
A194: =A193+1 -> 188 | B194: =B193 -> 100 | C194: =C193 -> 9.6250000000000002E-2 | D194: =B194*SIN(2*PI()*A194*C194) -> 56.208337785214027 | E194: =E193 -> 1.6452810360417196 | F194: =D194+E194*H193-G193 -> -5878.3252678962053 | G194: =H193 -> -13602.555361022332 | H194: =F194 -> -5878.3252678962053 | I194: =DEC2HEX(H194) -> FFFFFFE90A | J194: =G194^2+H194^2-E194*G194*H194 -> 88027145.755599737 | K194: =DEC2HEX(J194) -> 53F3009 | L194: 00053D3CB4 | M194: =HEX2DEC(L194) -> 87899316
A195: =A194+1 -> 189 | B195: =B194 -> 100 | C195: =C194 -> 9.6250000000000002E-2 | D195: =B195*SIN(2*PI()*A195*C195) -> 93.263902314309789 | E195: =E194 -> 1.6452810360417196 | F195: =D195+E195*H194-G194 -> 4024.3221763821548 | G195: =H194 -> -5878.3252678962053 | H195: =F195 -> 4024.3221763821548 | I195: =DEC2HEX(H195) -> FB8 | J195: =G195^2+H195^2-E195*G195*H195 -> 89671097.140354544 | K195: =DEC2HEX(J195) -> 55845B9 | L195: 000556B9D5 | M195: =HEX2DEC(L195) -> 89569749
A196: =A195+1 -> 190 | B196: =B195 -> 100 | C196: =C195 -> 9.6250000000000002E-2 | D196: =B196*SIN(2*PI()*A196*C196) -> 97.236992039767429 | E196: =E195 -> 1.6452810360417196 | F196: =D196+E196*H195-G195 -> 12596.703219659674 | G196: =H195 -> 4024.3221763821548 | H196: =F196 -> 12596.703219659674 | I196: =DEC2HEX(H196) -> 3134 | J196: =G196^2+H196^2-E196*G196*H196 -> 91467553.338333532 | K196: =DEC2HEX(J196) -> 573AF21 | L196: 0005717D99 | M196: =HEX2DEC(L196) -> 91323801
A197: =A196+1 -> 191 | B197: =B196 -> 100 | C197: =C196 -> 9.6250000000000002E-2 | D197: =B197*SIN(2*PI()*A197*C197) -> 66.718276690460414 | E197: =E196 -> 1.6452810360417196 | F197: =D197+E197*H196-G196 -> 16767.513024260035 | G197: =H196 -> 12596.703219659674 | H197: =F197 -> 16767.513024260035 | I197: =DEC2HEX(H197) -> 417F | J197: =G197^2+H197^2-E197*G197*H197 -> 92317757.071241498 | K197: =DEC2HEX(J197) -> 580A83D | L197: 00057D8C64 | M197: =HEX2DEC(L197) -> 92114020
A198: =A197+1 -> 192 | B198: =B197 -> 100 | C198: =C197 -> 9.6250000000000002E-2 | D198: =B198*SIN(2*PI()*A198*C198) -> 12.533323356431152 | E198: =E197 -> 1.6452810360417196 | F198: =D198+E198*H197-G197 -> 15003.101304094336 | G198: =H197 -> 16767.513024260035 | H198: =F198 -> 15003.101304094336 | I198: =DEC2HEX(H198) -> 3A9B | J198: =G198^2+H198^2-E198*G198*H198 -> 92347917.23655808 | K198: =DEC2HEX(J198) -> 5811E0D | L198: 00057DB7B1 | M198: =HEX2DEC(L198) -> 92125105
A199: =A198+1 -> 193 | B199: =B198 -> 100 | C199: =C198 -> 9.6250000000000002E-2 | D199: =B199*SIN(2*PI()*A199*C199) -> -46.097437453545474 | E199: =E198 -> 1.6452810360417196 | F199: =D199+E199*H198-G198 -> 7870.7075957256202 | G199: =H198 -> 15003.101304094336 | H199: =F199 -> 7870.7075957256202 | I199: =DEC2HEX(H199) -> 1EBE | J199: =G199^2+H199^2-E199*G199*H199 -> 92758037.168336302 | K199: =DEC2HEX(J199) -> 5876015 | L199: 000584E416 | M199: =HEX2DEC(L199) -> 92595222
A200: =A199+1 -> 194 | B200: =B199 -> 100 | C200: =C199 -> 9.6250000000000002E-2 | D200: =B200*SIN(2*PI()*A200*C200) -> -88.376563008868885 | E200: =E199 -> 1.6452810360417196 | F200: =D200+E200*H199-G199 -> -2141.9519196263245 | G200: =H199 -> 7870.7075957256202 | H200: =F200 -> -2141.9519196263245 | I200: =DEC2HEX(H200) -> FFFFFFF7A3 | J200: =G200^2+H200^2-E200*G200*H200 -> 94273258.044852883 | K200: =DEC2HEX(J200) -> 59E7EEA | L200: 00059CC55D | M200: =HEX2DEC(L200) -> 94160221
A201: =A200+1 -> 195 | B201: =B200 -> 100 | C201: =C200 -> 9.6250000000000002E-2 | D201: =B201*SIN(2*PI()*A201*C201) -> -99.306845695492768 | E201: =E200 -> 1.6452810360417196 | F201: =D201+E201*H200-G200 -> -11494.127314895462 | G201: =H200 -> -2141.9519196263245 | H201: =F201 -> -11494.127314895462 | I201: =DEC2HEX(H201) -> FFFFFFD31A | J201: =G201^2+H201^2-E201*G201*H201 -> 96196318.717240602 | K201: =DEC2HEX(J201) -> 5BBD6DE | L201: 0005B9D99D | M201: =HEX2DEC(L201) -> 96065949
A202: =A201+1 -> 196 | B202: =B201 -> 100 | C202: =C201 -> 9.6250000000000002E-2 | D202: =B202*SIN(2*PI()*A202*C202) -> -75.011106963046757 | E202: =E201 -> 1.6452810360417196 | F202: =D202+E202*H201-G201 -> -16844.128884383357 | G202: =H201 -> -11494.127314895462 | H202: =F202 -> -16844.128884383357 | I202: =DEC2HEX(H202) -> FFFFFFBE34 | J202: =G202^2+H202^2-E202*G202*H202 -> 97299145.286133707 | K202: =DEC2HEX(J202) -> 5CCAAC9 | L202: 0005C9B295 | M202: =HEX2DEC(L202) -> 97104533
A203: =A202+1 -> 197 | B203: =B202 -> 100 | C203: =C202 -> 9.6250000000000002E-2 | D203: =B203*SIN(2*PI()*A203*C203) -> -24.107506083305179 | E203: =E202 -> 1.6452810360417196 | F203: =D203+E203*H202-G202 -> -16243.30601330635 | G203: =H202 -> -16844.128884383357 | H203: =F203 -> -16243.30601330635 | I203: =DEC2HEX(H203) -> FFFFFFC08D | J203: =G203^2+H203^2-E203*G203*H203 -> 97413636.140496254 | K203: =DEC2HEX(J203) -> 5CE6A04 | L203: 0005CB04C3 | M203: =HEX2DEC(L203) -> 97191107
A204: =A203+1 -> 198 | B204: =B203 -> 100 | C204: =C203 -> 9.6250000000000002E-2 | D204: =B204*SIN(2*PI()*A204*C204) -> 35.347484377926996 | E204: =E203 -> 1.6452810360417196 | F204: =D204+E204*H203-G203 -> -9845.326977554083 | G204: =H203 -> -16243.30601330635 | H204: =F204 -> -9845.326977554083 | I204: =DEC2HEX(H204) -> FFFFFFD98B | J204: =G204^2+H204^2-E204*G204*H204 -> 97661026.181562155 | K204: =DEC2HEX(J204) -> 5D23062 | L204: 0005CF7260 | M204: =HEX2DEC(L204) -> 97481312
A205: =A204+1 -> 199 | B205: =B204 -> 100 | C205: =C204 -> 9.6250000000000002E-2 | D205: =B205*SIN(2*PI()*A205*C205) -> 82.264051802086698 | E205: =E204 -> 1.6452810360417196 | F205: =D205+E205*H204-G204 -> 127.24029530876396 | G205: =H204 -> -9845.326977554083 | H205: =F205 -> 127.24029530876396 | I205: =DEC2HEX(H205) -> 7F | J205: =G205^2+H205^2-E205*G205*H205 -> 99007733.651122525 | K205: =DEC2HEX(J205) -> 5E6BCF5 | L205: 0005E4BBFC | M205: =HEX2DEC(L205) -> 98876412
A206: =A205+1 -> 200 | B206: =B205 -> 100 | C206: =C205 -> 9.6250000000000002E-2 | D206: =B206*SIN(2*PI()*A206*C206) -> 100.00 | E206: =E205 -> 1.6452810360417196 | F206: =D206+E206*H205-G205 -> 10154.673022445941 | G206: =H205 -> 127.24029530876396 | H206: =F206 -> 10154.673022445941 | I206: =DEC2HEX(H206) -> 27AA | J206: =G206^2+H206^2-E206*G206*H206 -> 101007733.65112254 | K206: =DEC2HEX(J206) -> 6054175 | L206: 000603156D | M206: =HEX2DEC(L206) -> 100865389
A207: =A206+1 -> 201 | B207: =B206 -> 100 | C207: =C206 -> 9.6250000000000002E-2 | D207: =B207*SIN(2*PI()*A207*C207) -> 82.264051802086215 | E207: =E206 -> 1.6452810360417196 | F207: =D207+E207*H206-G206 -> 16662.314707528079 | G207: =H206 -> 10154.673022445941 | H207: =F207 -> 16662.314707528079 | I207: =DEC2HEX(H207) -> 4116 | J207: =G207^2+H207^2-E207*G207*H207 -> 102367975.86912072 | K207: =DEC2HEX(J207) -> 61A02E7 | L207: 000616A8CF | M207: =HEX2DEC(L207) -> 102148303
A208: =A207+1 -> 202 | B208: =B207 -> 100 | C208: =C207 -> 9.6250000000000002E-2 | D208: =B208*SIN(2*PI()*A208*C208) -> 35.347484377926214 | E208: =E207 -> 1.6452810360417196 | F208: =D208+E208*H207-G207 -> 17294.864866786964 | G208: =H207 -> 16662.314707528079 | H208: =F208 -> 17294.864866786964 | I208: =DEC2HEX(H208) -> 438E | J208: =G208^2+H208^2-E208*G208*H208 -> 102620363.6887939 | K208: =DEC2HEX(J208) -> 61DDCCB | L208: 000619E5E0 | M208: =HEX2DEC(L208) -> 102360544
A209: =A208+1 -> 203 | B209: =B208 -> 100 | C209: =C208 -> 9.6250000000000002E-2 | D209: =B209*SIN(2*PI()*A209*C209) -> -24.107506083303225 | E209: =E208 -> 1.6452810360417196 | F209: =D209+E209*H208-G208 -> 11768.490972617412 | G209: =H208 -> 17294.864866786964 | H209: =F209 -> 11768.490972617412 | I209: =DEC2HEX(H209) -> 2DF8 | J209: =G209^2+H209^2-E209*G209*H209 -> 102738341.57425386 | K209: =DEC2HEX(J209) -> 61FA9A5 | L209: 00061C4624 | M209: =HEX2DEC(L209) -> 102516260
A210: =A209+1 -> 204 | B210: =B209 -> 100 | C210: =C209 -> 9.6250000000000002E-2 | D210: =B210*SIN(2*PI()*A210*C210) -> -75.011106963045435 | E210: =E209 -> 1.6452810360417196 | F210: =D210+E210*H209-G209 -> 1992.5990463255912 | G210: =H209 -> 11768.490972617412 | H210: =F210 -> 1992.5990463255912 | I210: =DEC2HEX(H210) -> 7C8 | J210: =G210^2+H210^2-E210*G210*H210 -> 103886181.47248945 | K210: =DEC2HEX(J210) -> 6312D65 | L210: 00062ED167 | M210: =HEX2DEC(L210) -> 103731559