B1: x | C1: x(Hex) | D1: b | E1: b(Hex) | F1: x*b | G1: accumulated sum | H1: accumulated sum(hex)
B2: 1 | C2: =DEC2HEX(B2) -> 1 | D2: 6 | E2: =DEC2HEX(D2) -> 6 | F2: =B2*D2 -> 6 | G2: =F2 -> 6 | H2: =DEC2HEX(G2) -> 6
B3: =B2+1 -> 2 | C3: =DEC2HEX(B3) -> 2 | D3: =D2+1 -> 7 | E3: =DEC2HEX(D3) -> 7 | F3: =B3*D3 -> 14 | G3: =G2+F3 -> 20 | H3: =DEC2HEX(G3) -> 14
B4: =B3+1 -> 3 | C4: =DEC2HEX(B4) -> 3 | D4: =D3+1 -> 8 | E4: =DEC2HEX(D4) -> 8 | F4: =B4*D4 -> 24 | G4: =G3+F4 -> 44 | H4: =DEC2HEX(G4) -> 2C
B5: =B4+1 -> 4 | C5: =DEC2HEX(B5) -> 4 | D5: =D4+1 -> 9 | E5: =DEC2HEX(D5) -> 9 | F5: =B5*D5 -> 36 | G5: =G4+F5 -> 80 | H5: =DEC2HEX(G5) -> 50
B6: =B5+1 -> 5 | C6: =DEC2HEX(B6) -> 5 | D6: =D5+1 -> 10 | E6: =DEC2HEX(D6) -> A | F6: =B6*D6 -> 50 | G6: =G5+F6 -> 130 | H6: =DEC2HEX(G6) -> 82
B9: -1 | C9: =DEC2HEX(B9) -> FFFFFFFFFF | D9: 789 | E9: =DEC2HEX(D9) -> 315 | F9: =B9*D9 -> -789 | G9: =F9 -> -789 | H9: =DEC2HEX(G9) -> FFFFFFFCEB
B10: 23 | C10: =DEC2HEX(B10) -> 17 | D10: -79 | E10: =DEC2HEX(D10) -> FFFFFFFFB1 | F10: =B10*D10 -> -1817 | G10: =G9+F10 -> -2606 | H10: =DEC2HEX(G10) -> FFFFFFF5D2
B11: 56 | C11: =DEC2HEX(B11) -> 38 | D11: 45 | E11: =DEC2HEX(D11) -> 2D | F11: =B11*D11 -> 2520 | G11: =G10+F11 -> -86 | H11: =DEC2HEX(G11) -> FFFFFFFFAA
B12: 89 | C12: =DEC2HEX(B12) -> 59 | D12: 343 | E12: =DEC2HEX(D12) -> 157 | F12: =B12*D12 -> 30527 | G12: =G11+F12 -> 30441 | H12: =DEC2HEX(G12) -> 76E9
B13: -3 | C13: =DEC2HEX(B13) -> FFFFFFFFFD | D13: -578 | E13: =DEC2HEX(D13) -> FFFFFFFDBE | F13: =B13*D13 -> 1734 | G13: =G12+F13 -> 32175 | H13: =DEC2HEX(G13) -> 7DAF