B1: Input Frequency | C1: Tone Frequncy | D1: Sampling Rate | E1: k | F1: a1
B2: 770 | C2: 770.00 | D2: 8000.00 | E2: =C2/D2 -> 9.6250000000000002E-2 | F2: =2*COS(2*PI()*E2) -> 1.6452810360417196
A5: Sample # | B5: Input Amplitude | C5: InputFrequency/ SamplingRate | D5: Input Sample | E5: a1 | F5: D0 | G5: D2 | H5: D1 | I5: P
A6: 0 | B6: 100 | C6: =B2/D2 -> 9.6250000000000002E-2 | D6: =B6*SIN(2*PI()*A6*C6) -> 0.00 | E6: =F2 -> 1.6452810360417196 | F6: 0.00 | G6: 0.00 | H6: 0.00 | I6: =F6^2+G6^2-E6*F6*G6 -> 0
A7: =A6+1 -> 1 | B7: =B6 -> 100 | C7: =C6 -> 9.6250000000000002E-2 | D7: =B7*SIN(2*PI()*A7*C7) -> 56.856185073426388 | E7: =E6 -> 1.6452810360417196 | F7: =D7+E7*H6-G6 -> 56.856185073426388 | G7: =H6 -> 0.00 | H7: =F7 -> 56.856185073426388 | I7: =G7^2+H7^2-E7*G7*H7 -> 3232.6257811037135
A8: =A7+1 -> 2 | B8: =B7 -> 100 | C8: =C7 -> 9.6250000000000002E-2 | D8: =B8*SIN(2*PI()*A8*C8) -> 93.544403082986733 | E8: =E7 -> 1.6452810360417196 | F8: =D8+E8*H7-G7 -> 187.08880616597344 | G8: =H7 -> 56.856185073426388 | H8: =F8 -> 187.08880616597344 | I8: =G8^2+H8^2-E8*G8*H8 -> 20733.736477408303
A9: =A8+1 -> 3 | B9: =B8 -> 100 | C9: =C8 -> 9.6250000000000002E-2 | D9: =B9*SIN(2*PI()*A9*C9) -> 97.050647346854248 | E9: =E8 -> 1.6452810360417196 | F9: =D9+E9*H8-G8 -> 348.00812711398908 | G9: =H8 -> 187.08880616597344 | H9: =F9 -> 348.00812711398908 | I9: =G9^2+H9^2-E9*G9*H9 -> 48990.220928738709
A10: =A9+1 -> 4 | B10: =B9 -> 100 | C10: =C9 -> 9.6250000000000002E-2 | D10: =B10*SIN(2*PI()*A10*C10) -> 66.131186532365177 | E10: =E9 -> 1.6452810360417196 | F10: =D10+E10*H9-G9 -> 451.61355229543415 | G10: =H9 -> 348.00812711398908 | H10: =F10 -> 451.61355229543415 | I10: =G10^2+H10^2-E10*G10*H10 -> 66483.556257452641
A11: =A10+1 -> 5 | B11: =B10 -> 100 | C11: =C10 -> 9.6250000000000002E-2 | D11: =B11*SIN(2*PI()*A11*C11) -> 11.753739745783754 | E11: =E10 -> 1.6452810360417196 | F11: =D11+E11*H10-G10 -> 406.7768258429079 | G11: =H10 -> 451.61355229543415 | H11: =F11 -> 406.7768258429079 | I11: =G11^2+H11^2-E11*G11*H11 -> 67174.308247510693
A12: =A11+1 -> 6 | B12: =B11 -> 100 | C12: =C11 -> 9.6250000000000002E-2 | D12: =B12*SIN(2*PI()*A12*C12) -> -46.792981426057317 | E12: =E11 -> 1.6452810360417196 | F12: =D12+E12*H11-G11 -> 170.85566373909023 | G12: =H11 -> 406.7768258429079 | H12: =F12 -> 170.85566373909023 | I12: =G12^2+H12^2-E12*G12*H12 -> 80311.80691194674
A13: =A12+1 -> 7 | B13: =B12 -> 100 | C13: =C12 -> 9.6250000000000002E-2 | D13: =B13*SIN(2*PI()*A13*C13) -> -88.741344705928341 | E13: =E12 -> 1.6452810360417196 | F13: =D13+E13*H12-G12 -> -214.41258709859017 | G13: =H12 -> 170.85566373909023 | H13: =F13 -> -214.41258709859017 | I13: =G13^2+H13^2-E13*G13*H13 -> 135436.99073346148
A14: =A13+1 -> 8 | B14: =B13 -> 100 | C14: =C13 -> 9.6250000000000002E-2 | D14: =B14*SIN(2*PI()*A14*C14) -> -99.211470131447783 | E14: =E13 -> 1.6452810360417196 | F14: =D14+E14*H13-G13 -> -622.83609731249192 | G14: =H13 -> -214.41258709859017 | H14: =F14 -> -622.83609731249192 | I14: =G14^2+H14^2-E14*G14*H14 -> 214180.31717860673
A15: =A14+1 -> 9 | B15: =B14 -> 100 | C15: =C14 -> 9.6250000000000002E-2 | D15: =B15*SIN(2*PI()*A15*C15) -> -74.48940565916223 | E15: =E14 -> 1.6452810360417196 | F15: =D15+E15*H14-G14 -> -884.81723803105001 | G15: =H14 -> -622.83609731249192 | H15: =F15 -> -884.81723803105001 | I15: =G15^2+H15^2-E15*G15*H15 -> 264118.36117770371
A16: =A15+1 -> 10 | B16: =B15 -> 100 | C16: =C15 -> 9.6250000000000002E-2 | D16: =B16*SIN(2*PI()*A16*C16) -> -23.344536385590519 | E16: =E15 -> 1.6452810360417196 | F16: =D16+E16*H15-G15 -> -856.28146116839741 | G16: =H15 -> -884.81723803105001 | H16: =F16 -> -856.28146116839741 | I16: =G16^2+H16^2-E16*G16*H16 -> 269568.03496828536
A17: =A16+1 -> 11 | B17: =B16 -> 100 | C17: =C16 -> 9.6250000000000002E-2 | D17: =B17*SIN(2*PI()*A17*C17) -> 36.081082648764081 | E17: =E16 -> 1.6452810360417196 | F17: =D17+E17*H16-G16 -> -487.92532889464428 | G17: =H16 -> -856.28146116839741 | H17: =F17 -> -487.92532889464428 | I17: =G17^2+H17^2-E17*G17*H17 -> 283888.3247444618
A18: =A17+1 -> 12 | B18: =B17 -> 100 | C18: =C17 -> 9.6250000000000002E-2 | D18: =B18*SIN(2*PI()*A18*C18) -> 82.708057427456154 | E18: =E17 -> 1.6452810360417196 | F18: =D18+E18*H17-G17 -> 136.21522796107649 | G18: =H17 -> -487.92532889464428 | H18: =F18 -> 136.21522796107649 | I18: =G18^2+H18^2-E18*G18*H18 -> 365975.79790554242
A19: =A18+1 -> 13 | B19: =B18 -> 100 | C19: =C18 -> 9.6250000000000002E-2 | D19: =B19*SIN(2*PI()*A19*C19) -> 99.99691576447897 | E19: =E18 -> 1.6452810360417196 | F19: =D19+E19*H18-G18 -> 812.03457604358221 | G19: =H18 -> 136.21522796107649 | H19: =F19 -> 812.03457604358221 | I19: =G19^2+H19^2-E19*G19*H19 -> 495967.77901685052
A20: =A19+1 -> 14 | B20: =B19 -> 100 | C20: =C19 -> 9.6250000000000002E-2 | D20: =B20*SIN(2*PI()*A20*C20) -> 81.814971742502308 | E20: =E19 -> 1.6452810360417196 | F20: =D20+E20*H19-G19 -> 1281.6248323561094 | G20: =H19 -> 812.03457604358221 | H20: =F20 -> 1281.6248323561094 | I20: =G20^2+H20^2-E20*G20*H20 -> 589679.43343402119
A21: =A20+1 -> 15 | B21: =B20 -> 100 | C21: =C20 -> 9.6250000000000002E-2 | D21: =B21*SIN(2*PI()*A21*C21) -> 34.611705707749351 | E21: =E20 -> 1.6452810360417196 | F21: =D21+E21*H20-G20 -> 1331.2101616598225 | G21: =H20 -> 1281.6248323561094 | H21: =F21 -> 1331.2101616598225 | I21: =G21^2+H21^2-E21*G21*H21 -> 607648.98601401877
A22: =A21+1 -> 16 | B22: =B21 -> 100 | C22: =C21 -> 9.6250000000000002E-2 | D22: =B22*SIN(2*PI()*A22*C22) -> -24.868988716485475 | E22: =E21 -> 1.6452810360417196 | F22: =D22+E22*H21-G21 -> 883.72101289234297 | G22: =H21 -> 1331.2101616598225 | H22: =F22 -> 883.72101289234297 | I22: =G22^2+H22^2-E22*G22*H22 -> 617544.45161050954
A23: =A22+1 -> 17 | B23: =B22 -> 100 | C23: =C22 -> 9.6250000000000002E-2 | D23: =B23*SIN(2*PI()*A23*C23) -> -75.528181228518392 | E23: =E22 -> 1.6452810360417196 | F23: =D23+E23*H22-G22 -> 47.231080775010923 | G23: =H22 -> 883.72101289234297 | H23: =F23 -> 47.231080775010923 | I23: =G23^2+H23^2-E23*G23*H23 -> 714521.05632520432
A24: =A23+1 -> 18 | B24: =B23 -> 100 | C24: =C23 -> 9.6250000000000002E-2 | D24: =B24*SIN(2*PI()*A24*C24) -> -99.396095545517966 | E24: =E23 -> 1.6452810360417196 | F24: =D24+E24*H23-G23 -> -905.40870692698081 | G24: =H23 -> 47.231080775010923 | H24: =F24 -> -905.40870692698081 | I24: =G24^2+H24^2-E24*G24*H24 -> 892353.56489969161
A25: =A24+1 -> 19 | B25: =B24 -> 100 | C25: =C24 -> 9.6250000000000002E-2 | D25: =B25*SIN(2*PI()*A25*C25) -> -88.006329829113213 | E25: =E24 -> 1.6452810360417196 | F25: =D25+E25*H24-G24 -> -1624.8891859781406 | G25: =H24 -> -905.40870692698081 | H25: =F25 -> -1624.8891859781406 | I25: =G25^2+H25^2-E25*G25*H25 -> 1039510.7326095141
A26: =A25+1 -> 20 | B26: =B25 -> 100 | C26: =C25 -> 9.6250000000000002E-2 | D26: =B26*SIN(2*PI()*A26*C26) -> -45.399049973954639 | E26: =E25 -> 1.6452810360417196 | F26: =D26+E26*H25-G25 -> -1813.3897064060757 | G26: =H25 -> -1624.8891859781406 | H26: =F26 -> -1813.3897064060757 | I26: =G26^2+H26^2-E26*G26*H26 -> 1080732.2073802669
A27: =A26+1 -> 21 | B27: =B26 -> 100 | C27: =C26 -> 9.6250000000000002E-2 | D27: =B27*SIN(2*PI()*A27*C27) -> 13.312133852655331 | E27: =E26 -> 1.6452810360417196 | F27: =D27+E27*H26-G26 -> -1345.334375072382 | G27: =H26 -> -1813.3897064060757 | H27: =F27 -> -1345.334375072382 | I27: =G27^2+H27^2-E27*G27*H27 -> 1084453.6784421979
A28: =A27+1 -> 22 | B28: =B27 -> 100 | C28: =C27 -> 9.6250000000000002E-2 | D28: =B28*SIN(2*PI()*A28*C28) -> 67.301251350977182 | E28: =E27 -> 1.6452810360417196 | F28: =D28+E28*H27-G27 -> -332.76217668457548 | G28: =H27 -> -1345.334375072382 | H28: =F28 -> -332.76217668457548 | I28: =G28^2+H28^2-E28*G28*H28 -> 1184101.7639771609
A29: =A28+1 -> 23 | B29: =B28 -> 100 | C29: =C28 -> 9.6250000000000002E-2 | D29: =B29*SIN(2*PI()*A29*C29) -> 97.417338696984899 | E29: =E28 -> 1.6452810360417196 | F29: =D29+E29*H28-G28 -> 895.26441495827078 | G29: =H28 -> -332.76217668457548 | H29: =F29 -> 895.26441495827078 | I29: =G29^2+H29^2-E29*G29*H29 -> 1402374.9351896313
A30: =A29+1 -> 24 | B30: =B29 -> 100 | C30: =C29 -> 9.6250000000000002E-2 | D30: =B30*SIN(2*PI()*A30*C30) -> 92.977648588825176 | E30: =E29 -> 1.6452810360417196 | F30: =D30+E30*H29-G29 -> 1898.7013894472284 | G30: =H29 -> 895.26441495827078 | H30: =F30 -> 1898.7013894472284 | I30: =G30^2+H30^2-E30*G30*H30 -> 1609851.170480201
A31: =A30+1 -> 25 | B31: =B30 -> 100 | C31: =C30 -> 9.6250000000000002E-2 | D31: =B31*SIN(2*PI()*A31*C31) -> 55.55702330196025 | E31: =E30 -> 1.6452810360417196 | F31: =D31+E31*H30-G30 -> 2284.1899975072779 | G31: =H30 -> 1898.7013894472284 | H31: =F31 -> 2284.1899975072779 | I31: =G31^2+H31^2-E31*G31*H31 -> 1687015.7414345657
A32: =A31+1 -> 26 | B32: =B31 -> 100 | C32: =C31 -> 9.6250000000000002E-2 | D32: =B32*SIN(2*PI()*A32*C32) -> -1.5707317311822639 | E32: =E31 -> 1.6452810360417196 | F32: =D32+E32*H31-G31 -> 1857.8623644364966 | G32: =H31 -> 2284.1899975072779 | H32: =F32 -> 1857.8623644364966 | I32: =G32^2+H32^2-E32*G32*H32 -> 1687079.8885870203
A33: =A32+1 -> 27 | B33: =B32 -> 100 | C33: =C32 -> 9.6250000000000002E-2 | D33: =B33*SIN(2*PI()*A33*C33) -> -58.141318431982967 | E33: =E32 -> 1.6452810360417196 | F33: =D33+E33*H32-G32 -> 714.37439984373714 | G33: =H32 -> 1857.8623644364966 | H33: =F33 -> 714.37439984373714 | I33: =G33^2+H33^2-E33*G33*H33 -> 1778351.0371302692
A34: =A33+1 -> 28 | B34: =B33 -> 100 | C34: =C33 -> 9.6250000000000002E-2 | D34: =B34*SIN(2*PI()*A34*C34) -> -94.088076895422589 | E34: =E33 -> 1.6452810360417196 | F34: =D34+E34*H33-G33 -> -776.60378863533356 | G34: =H33 -> 714.37439984373714 | H34: =F34 -> -776.60378863533356 | I34: =G34^2+H34^2-E34*G34*H34 -> 2026222.8911188794
A35: =A34+1 -> 29 | B35: =B34 -> 100 | C35: =C34 -> 9.6250000000000002E-2 | D35: =B35*SIN(2*PI()*A35*C35) -> -96.660010201690724 | E35: =E34 -> 1.6452810360417196 | F35: =D35+E35*H34-G34 -> -2088.7658960052941 | G35: =H34 -> -776.60378863533356 | H35: =F35 -> -2088.7658960052941 | I35: =G35^2+H35^2-E35*G35*H35 -> 2297174.4607124161
A36: =A35+1 -> 30 | B36: =B35 -> 100 | C36: =C35 -> 9.6250000000000002E-2 | D36: =B36*SIN(2*PI()*A36*C36) -> -64.944804833018452 | E36: =E35 -> 1.6452810360417196 | F36: =D36+E36*H35-G35 -> -2724.9479336258864 | G36: =H35 -> -2088.7658960052941 | H36: =F36 -> -2724.9479336258864 | I36: =G36^2+H36^2-E36*G36*H36 -> 2423709.2909563836
A37: =A36+1 -> 31 | B37: =B36 -> 100 | C37: =C36 -> 9.6250000000000002E-2 | D37: =B37*SIN(2*PI()*A37*C37) -> -10.19244557950524 | E37: =E36 -> 1.6452810360417196 | F37: =D37+E37*H36-G36 -> -2404.7317089699527 | G37: =H36 -> -2724.9479336258864 | H37: =F37 -> -2404.7317089699527 | I37: =G37^2+H37^2-E37*G37*H37 -> 2426929.7553100083
A38: =A37+1 -> 32 | B38: =B37 -> 100 | C38: =C37 -> 9.6250000000000002E-2 | D38: =B38*SIN(2*PI()*A38*C38) -> 48.175367410171518 | E38: =E37 -> 1.6452810360417196 | F38: =D38+E38*H37-G37 -> -1183.3361765004006 | G38: =H37 -> -2404.7317089699527 | H38: =F38 -> -1183.3361765004006 | I38: =G38^2+H38^2-E38*G38*H38 -> 2501197.4681133712
A39: =A38+1 -> 33 | B39: =B38 -> 100 | C39: =C38 -> 9.6250000000000002E-2 | D39: =B39*SIN(2*PI()*A39*C39) -> 89.454463983802455 | E39: =E38 -> 1.6452810360417196 | F39: =D39+E39*H38-G38 -> 547.26560249552904 | G39: =H38 -> -1183.3361765004006 | H39: =F39 -> 547.26560249552904 | I39: =G39^2+H39^2-E39*G39*H39 -> 2765266.8052921416
A40: =A39+1 -> 34 | B40: =B39 -> 100 | C40: =C39 -> 9.6250000000000002E-2 | D40: =B40*SIN(2*PI()*A40*C40) -> 99.002365771655747 | E40: =E39 -> 1.6452810360417196 | F40: =D40+E40*H39-G39 -> 2182.7442597358963 | G40: =H39 -> 547.26560249552904 | H40: =F40 -> 2182.7442597358963 | I40: =G40^2+H40^2-E40*G40*H40 -> 3098516.731857222
A41: =A40+1 -> 35 | B41: =B40 -> 100 | C41: =C40 -> 9.6250000000000002E-2 | D41: =B41*SIN(2*PI()*A41*C41) -> 73.432250943568562 | E41: =E40 -> 1.6452810360417196 | F41: =D41+E41*H40-G40 -> 3117.3943855204316 | G41: =H40 -> 2182.7442597358963 | H41: =F41 -> 3117.3943855204316 | I41: =G41^2+H41^2-E41*G41*H41 -> 3287247.0736095961
A42: =A41+1 -> 36 | B42: =B41 -> 100 | C42: =C41 -> 9.6250000000000002E-2 | D42: =B42*SIN(2*PI()*A42*C42) -> 21.814324139654389 | E42: =E41 -> 1.6452810360417196 | F42: =D42+E42*H41-G41 -> 2968.0599287634536 | G42: =H41 -> 3117.3943855204316 | H42: =F42 -> 2968.0599287634536 | I42: =G42^2+H42^2-E42*G42*H42 -> 3304378.204165712
A43: =A42+1 -> 37 | B43: =B42 -> 100 | C43: =C42 -> 9.6250000000000002E-2 | D43: =B43*SIN(2*PI()*A43*C43) -> -37.541557122528395 | E43: =E42 -> 1.6452810360417196 | F43: =D43+E43*H42-G42 -> 1728.356771986887 | G43: =H42 -> 2968.0599287634536 | H43: =F43 -> 1728.356771986887 | I43: =G43^2+H43^2-E43*G43*H43 -> 3356524.8390795253
A44: =A43+1 -> 38 | B44: =B43 -> 100 | C44: =C43 -> 9.6250000000000002E-2 | D44: =B44*SIN(2*PI()*A44*C44) -> -83.580736136827014 | E44: =E43 -> 1.6452810360417196 | F44: =D44+E44*H43-G43 -> -208.00804443597326 | G44: =H43 -> 1728.356771986887 | H44: =F44 -> -208.00804443597326 | I44: =G44^2+H44^2-E44*G44*H44 -> 3621982.9383001323
A45: =A44+1 -> 39 | B45: =B44 -> 100 | C45: =C44 -> 9.6250000000000002E-2 | D45: =B45*SIN(2*PI()*A45*C45) -> -99.972243021800054 | E45: =E44 -> 1.6452810360417196 | F45: =D45+E45*H44-G44 -> -2170.5607058633173 | G45: =H44 -> -208.00804443597326 | H45: =F45 -> -2170.5607058633173 | I45: =G45^2+H45^2-E45*G45*H45 -> 4011766.4639177178
A46: =A45+1 -> 40 | B46: =B45 -> 100 | C46: =C45 -> 9.6250000000000002E-2 | D46: =B46*SIN(2*PI()*A46*C46) -> -80.901699437494685 | E46: =E45 -> 1.6452810360417196 | F46: =D46+E46*H45-G45 -> -3444.0760219357662 | G46: =H45 -> -2170.5607058633173 | H46: =F46 -> -3444.0760219357662 | I46: =G46^2+H46^2-E46*G46*H46 -> 4273569.8627927061
A47: =A46+1 -> 41 | B47: =B46 -> 100 | C47: =C46 -> 9.6250000000000002E-2 | D47: =B47*SIN(2*PI()*A47*C47) -> -33.133788846257474 | E47: =E46 -> 1.6452810360417196 | F47: =D47+E47*H46-G46 -> -3529.0460485598619 | G47: =H46 -> -3444.0760219357662 | H47: =F47 -> -3529.0460485598619 | I47: =G47^2+H47^2-E47*G47*H47 -> 4318581.6292883493
A48: =A47+1 -> 42 | B48: =B47 -> 100 | C48: =C47 -> 9.6250000000000002E-2 | D48: =B48*SIN(2*PI()*A48*C48) -> 26.387304996537473 | E48: =E47 -> 1.6452810360417196 | F48: =D48+E48*H47-G47 -> -2335.8092120812025 | G48: =H47 -> -3529.0460485598619 | H48: =F48 -> -2335.8092120812025 | I48: =G48^2+H48^2-E48*G48*H48 -> 4347825.8036175221
A49: =A48+1 -> 43 | B49: =B48 -> 100 | C49: =C48 -> 9.6250000000000002E-2 | D49: =B49*SIN(2*PI()*A49*C49) -> 76.548321349308637 | E49: =E48 -> 1.6452810360417196 | F49: =D49+E49*H48-G48 -> -237.46823053958315 | G49: =H48 -> -2335.8092120812025 | H49: =F49 -> -237.46823053958315 | I49: =G49^2+H49^2-E49*G49*H49 -> 4599790.5601775944
A50: =A49+1 -> 44 | B50: =B49 -> 100 | C50: =C49 -> 9.6250000000000002E-2 | D50: =B50*SIN(2*PI()*A50*C50) -> 99.556196460307973 | E50: =E49 -> 1.6452810360417196 | F50: =D50+E50*H49-G49 -> 2044.6634321723513 | G50: =H49 -> -237.46823053958315 | H50: =F50 -> 2044.6634321723513 | I50: =G50^2+H50^2-E50*G50*H50 -> 5035893.7553379061
A51: =A50+1 -> 45 | B51: =B50 -> 100 | C51: =C50 -> 9.6250000000000002E-2 | D51: =B51*SIN(2*PI()*A51*C51) -> 87.249600707279612 | E51: =E50 -> 1.6452810360417196 | F51: =D51+E51*H50-G50 -> 3688.763801288007 | G51: =H50 -> 2044.6634321723513 | H51: =F51 -> 3688.763801288007 | I51: =G51^2+H51^2-E51*G51*H51 -> 5378455.9323989954
A52: =A51+1 -> 46 | B52: =B51 -> 100 | C52: =C51 -> 9.6250000000000002E-2 | D52: =B52*SIN(2*PI()*A52*C52) -> 43.993916985591781 | E52: =E51 -> 1.6452810360417196 | F52: =D52+E52*H51-G51 -> 4068.3836135095644 | G52: =H51 -> 3688.763801288007 | H52: =F52 -> 4068.3836135095644 | I52: =G52^2+H52^2-E52*G52*H52 -> 5467487.3100588061
A53: =A52+1 -> 47 | B53: =B52 -> 100 | C53: =C52 -> 9.6250000000000002E-2 | D53: =B53*SIN(2*PI()*A53*C53) -> -14.86724338969259 | E53: =E52 -> 1.6452810360417196 | F53: =D53+E53*H52-G52 -> 2990.0033619724709 | G53: =H52 -> 4068.3836135095644 | H53: =F53 -> 2990.0033619724709 | I53: =G53^2+H53^2-E53*G53*H53 -> 5477875.9515812062
A54: =A53+1 -> 48 | B54: =B53 -> 100 | C54: =C53 -> 9.6250000000000002E-2 | D54: =B54*SIN(2*PI()*A54*C54) -> -68.454710592868722 | E54: =E53 -> 1.6452810360417196 | F54: =D54+E54*H53-G53 -> 782.55750505185824 | G54: =H53 -> 2990.0033619724709 | H54: =F54 -> 782.55750505185824 | I54: =G54^2+H54^2-E54*G54*H54 -> 5702806.2268941682
A55: =A54+1 -> 49 | B55: =B54 -> 100 | C55: =C54 -> 9.6250000000000002E-2 | D55: =B55*SIN(2*PI()*A55*C55) -> -97.759993776479007 | E55: =E54 -> 1.6452810360417196 | F55: =D55+E55*H54-G54 -> -1800.2363330750052 | G55: =H54 -> 782.55750505185824 | H55: =F55 -> -1800.2363330750052 | I55: =G55^2+H55^2-E55*G55*H55 -> 6171100.0296698511
A56: =A55+1 -> 50 | B56: =B55 -> 100 | C56: =C55 -> 9.6250000000000002E-2 | D56: =B56*SIN(2*PI()*A56*C56) -> -92.387953251128707 | E56: =E55 -> 1.6452810360417196 | F56: =D56+E56*H55-G55 -> -3836.8401575045777 | G56: =H55 -> -1800.2363330750052 | H56: =F56 -> -3836.8401575045777 | I56: =G56^2+H56^2-E56*G56*H56 -> 6597876.7249664888
A57: =A56+1 -> 51 | B57: =B56 -> 100 | C57: =C56 -> 9.6250000000000002E-2 | D57: =B57*SIN(2*PI()*A57*C57) -> -54.244153666312044 | E57: =E56 -> 1.6452810360417196 | F57: =D57+E57*H56-G56 -> -4566.6881700569129 | G57: =H56 -> -3836.8401575045777 | H57: =F57 -> -4566.6881700569129 | I57: =G57^2+H57^2-E57*G57*H57 -> 6747940.5635221936
A58: =A57+1 -> 52 | B58: =B57 -> 100 | C58: =C57 -> 9.6250000000000002E-2 | D58: =B58*SIN(2*PI()*A58*C58) -> 3.1410759078132218 | E58: =E57 -> 1.6452810360417196 | F58: =D58+E58*H57-G57 -> -3673.5042102983111 | G58: =H57 -> -4566.6881700569129 | H58: =F58 -> -3673.5042102983111 | I58: =G58^2+H58^2-E58*G58*H58 -> 6748453.614130836
A59: =A58+1 -> 53 | B59: =B58 -> 100 | C59: =C58 -> 9.6250000000000002E-2 | D59: =B59*SIN(2*PI()*A59*C59) -> 59.412106290203781 | E59: =E58 -> 1.6452810360417196 | F59: =D59+E59*H58-G58 -> -1417.8465366761075 | G59: =H58 -> -3673.5042102983111 | H59: =F59 -> -1417.8465366761075 | I59: =G59^2+H59^2-E59*G59*H59 -> 6935532.9279442746
A60: =A59+1 -> 54 | B60: =B59 -> 100 | C60: =C59 -> 9.6250000000000002E-2 | D60: =B60*SIN(2*PI()*A60*C60) -> 94.608535882754467 | E60: =E59 -> 1.6452810360417196 | F60: =D60+E60*H59-G59 -> 1435.3567273704357 | G60: =H59 -> -1417.8465366761075 | H60: =F60 -> 1435.3567273704357 | I60: =G60^2+H60^2-E60*G60*H60 -> 7418874.7812857125
A61: =A60+1 -> 55 | B61: =B60 -> 100 | C61: =C60 -> 9.6250000000000002E-2 | D61: =B61*SIN(2*PI()*A61*C61) -> 96.245523645364628 | E61: =E60 -> 1.6452810360417196 | F61: =D61+E61*H60-G60 -> 3875.6572638189546 | G61: =H60 -> 1435.3567273704357 | H61: =F61 -> 3875.6572638189546 | I61: =G61^2+H61^2-E61*G61*H61 -> 7928350.8264830895
A62: =A61+1 -> 56 | B62: =B61 -> 100 | C62: =C61 -> 9.6250000000000002E-2 | D62: =B62*SIN(2*PI()*A62*C62) -> 63.742398974868777 | E62: =E61 -> 1.6452810360417196 | F62: =D62+E62*H61-G61 -> 5004.9310699630987 | G62: =H61 -> 3875.6572638189546 | H62: =F62 -> 5004.9310699630987 | I62: =G62^2+H62^2-E62*G62*H62 -> 8155884.058399085
A63: =A62+1 -> 57 | B63: =B62 -> 100 | C63: =C62 -> 9.6250000000000002E-2 | D63: =B63*SIN(2*PI()*A63*C63) -> 8.6286365797929108 | E63: =E62 -> 1.6452810360417196 | F63: =D63+E63*H62-G62 -> 4367.4895488671182 | G63: =H62 -> 5004.9310699630987 | H63: =F63 -> 4367.4895488671182 | I63: =G63^2+H63^2-E63*G63*H63 -> 8160127.9004449695
A64: =A63+1 -> 58 | B64: =B63 -> 100 | C64: =C63 -> 9.6250000000000002E-2 | D64: =B64*SIN(2*PI()*A64*C64) -> -49.545866843240766 | E64: =E63 -> 1.6452810360417196 | F64: =D64+E64*H63-G63 -> 2131.2707930551351 | G64: =H63 -> 4367.4895488671182 | H64: =F64 -> 2131.2707930551351 | I64: =G64^2+H64^2-E64*G64*H64 -> 8302505.889877364
A65: =A64+1 -> 59 | B65: =B64 -> 100 | C65: =C64 -> 9.6250000000000002E-2 | D65: =B65*SIN(2*PI()*A65*C65) -> -90.145511711224529 | E65: =E64 -> 1.6452810360417196 | F65: =D65+E65*H64-G64 -> -951.09564209513292 | G65: =H64 -> 2131.2707930551351 | H65: =F65 -> -951.09564209513292 | I65: =G65^2+H65^2-E65*G65*H65 -> 8781952.4734963998
A66: =A65+1 -> 60 | B66: =B65 -> 100 | C66: =C65 -> 9.6250000000000002E-2 | D66: =B66*SIN(2*PI()*A66*C66) -> -98.768834059513807 | E66: =E65 -> 1.6452810360417196 | F66: =D66+E66*H65-G65 -> -3794.8592505156939 | G66: =H65 -> -951.09564209513292 | H66: =F66 -> -3794.8592505156939 | I66: =G66^2+H66^2-E66*G66*H66 -> 9367269.4283849485
A67: =A66+1 -> 61 | B67: =B66 -> 100 | C67: =C66 -> 9.6250000000000002E-2 | D67: =B67*SIN(2*PI()*A67*C67) -> -72.356977918844692 | E67: =E66 -> 1.6452810360417196 | F67: =D67+E67*H66-G66 -> -5364.871295144676 | G67: =H66 -> -3794.8592505156939 | H67: =F67 -> -5364.871295144676 | I67: =G67^2+H67^2-E67*G67*H67 -> 9686636.8958513886
A68: =A67+1 -> 62 | B68: =B67 -> 100 | C68: =C67 -> 9.6250000000000002E-2 | D68: =B68*SIN(2*PI()*A68*C68) -> -20.278729535651713 | E68: =E67 -> 1.6452810360417196 | F68: =D68+E68*H67-G67 -> -5052.1404817260718 | G68: =H67 -> -5364.871295144676 | H68: =F68 -> -5052.1404817260718 | I68: =G68^2+H68^2-E68*G68*H68 -> 9712132.9618893638
A69: =A68+1 -> 63 | B69: =B68 -> 100 | C69: =C68 -> 9.6250000000000002E-2 | D69: =B69*SIN(2*PI()*A69*C69) -> 38.992768778818935 | E69: =E68 -> 1.6452810360417196 | F69: =D69+E69*H68-G68 -> -2908.3268620790896 | G69: =H68 -> -5052.1404817260718 | H69: =F69 -> -2908.3268620790896 | I69: =G69^2+H69^2-E69*G69*H69 -> 9807920.4309627675
A70: =A69+1 -> 64 | B70: =B69 -> 100 | C70: =C69 -> 9.6250000000000002E-2 | D70: =B70*SIN(2*PI()*A70*C70) -> 84.432792550201512 | E70: =E69 -> 1.6452810360417196 | F70: =D70+E70*H69-G69 -> 351.55824148682495 | G70: =H69 -> -2908.3268620790896 | H70: =F70 -> 351.55824148682495 | I70: =G70^2+H70^2-E70*G70*H70 -> 10264169.804263592
A71: =A70+1 -> 65 | B71: =B70 -> 100 | C71: =C70 -> 9.6250000000000002E-2 | D71: =B71*SIN(2*PI()*A71*C71) -> 99.922903624072305 | E71: =E70 -> 1.6452810360417196 | F71: =D71+E71*H70-G70 -> 3586.6618734856102 | G71: =H70 -> 351.55824148682495 | H71: =F71 -> 3586.6618734856102 | I71: =G71^2+H71^2-E71*G71*H71 -> 10913167.937726859
A72: =A71+1 -> 66 | B72: =B71 -> 100 | C72: =C71 -> 9.6250000000000002E-2 | D72: =B72*SIN(2*PI()*A72*C72) -> 79.968465848709201 | E72: =E71 -> 1.6452810360417196 | F72: =D72+E72*H71-G71 -> 5629.4769875016245 | G72: =H71 -> 3586.6618734856102 | H72: =F72 -> 5629.4769875016245 | I72: =G72^2+H72^2-E72*G72*H72 -> 11335235.002719808
A73: =A72+1 -> 67 | B73: =B72 -> 100 | C73: =C72 -> 9.6250000000000002E-2 | D73: =B73*SIN(2*PI()*A73*C73) -> 31.647696718158969 | E73: =E72 -> 1.6452810360417196 | F73: =D73+E73*H72-G72 -> 5707.0575536022398 | G73: =H72 -> 5629.4769875016245 | H73: =F73 -> 5707.0575536022398 | I73: =G73^2+H73^2-E73*G73*H73 -> 11402340.642126635
A74: =A73+1 -> 68 | B74: =B73 -> 100 | C74: =C73 -> 9.6250000000000002E-2 | D74: =B74*SIN(2*PI()*A74*C74) -> -27.899110603923127 | E74: =E73 -> 1.6452810360417196 | F74: =D74+E74*H73-G73 -> 3732.3374664348667 | G74: =H73 -> 5707.0575536022398 | H74: =F74 -> 3732.3374664348667 | I74: =G74^2+H74^2-E74*G74*H74 -> 11455269.147455953
A75: =A74+1 -> 69 | B75: =B74 -> 100 | C75: =C74 -> 9.6250000000000002E-2 | D75: =B75*SIN(2*PI()*A75*C75) -> -77.549574317223502 | E75: =E74 -> 1.6452810360417196 | F75: =D75+E75*H74-G74 -> 356.13692571382126 | G75: =H74 -> 3732.3374664348667 | H75: =F75 -> 356.13692571382126 | I75: =G75^2+H75^2-E75*G75*H75 -> 11870230.764353946
A76: =A75+1 -> 70 | B76: =B75 -> 100 | C76: =C75 -> 9.6250000000000002E-2 | D76: =B76*SIN(2*PI()*A76*C76) -> -99.6917333733128 | E76: =E75 -> 1.6452810360417196 | F76: =D76+E76*H75-G75 -> -3246.0838696970304 | G76: =H75 -> 356.13692571382126 | H76: =F76 -> -3246.0838696970304 | I76: =G76^2+H76^2-E76*G76*H76 -> 12565921.683562241
A77: =A76+1 -> 71 | B77: =B76 -> 100 | C77: =C76 -> 9.6250000000000002E-2 | D77: =B77*SIN(2*PI()*A77*C77) -> -86.471344052015581 | E77: =E76 -> 1.6452810360417196 | F77: =D77+E77*H76-G76 -> -5783.3285019792811 | G77: =H76 -> -3246.0838696970304 | H77: =F77 -> -5783.3285019792811 | I77: =G77^2+H77^2-E77*G77*H77 -> 13096809.510855746
A78: =A77+1 -> 72 | B78: =B77 -> 100 | C78: =C77 -> 9.6250000000000002E-2 | D78: =B78*SIN(2*PI()*A78*C78) -> -42.577929156507516 | E78: =E77 -> 1.6452810360417196 | F78: =D78+E78*H77-G77 -> -6311.6947689655544 | G78: =H77 -> -5783.3285019792811 | H78: =F78 -> -6311.6947689655544 | I78: =G78^2+H78^2-E78*G78*H78 -> 13227336.874546215
A79: =A78+1 -> 73 | B79: =B78 -> 100 | C79: =C78 -> 9.6250000000000002E-2 | D79: =B79*SIN(2*PI()*A79*C79) -> 16.418684656885901 | E79: =E78 -> 1.6452810360417196 | F79: =D79+E79*H78-G78 -> -4584.7645220265813 | G79: =H78 -> -6311.6947689655544 | H79: =F79 -> -4584.7645220265813 | I79: =G79^2+H79^2-E79*G79*H79 -> 13247015.718574166
A80: =A79+1 -> 74 | B80: =B79 -> 100 | C80: =C79 -> 9.6250000000000002E-2 | D80: =B80*SIN(2*PI()*A80*C80) -> 69.59127965923156 | E80: =E79 -> 1.6452810360417196 | F80: =D80+E80*H79-G79 -> -1161.9400741824265 | G80: =H79 -> -4584.7645220265813 | H80: =F80 -> -1161.9400741824265 | I80: =G80^2+H80^2-E80*G80*H80 -> 13605393.737715261
A81: =A80+1 -> 75 | B81: =B80 -> 100 | C81: =C80 -> 9.6250000000000002E-2 | D81: =B81*SIN(2*PI()*A81*C81) -> 98.07852804032305 | E81: =E80 -> 1.6452810360417196 | F81: =D81+E81*H80-G80 -> 2771.1250809976491 | G81: =H80 -> -1161.9400741824265 | H81: =F81 -> 2771.1250809976491 | I81: =G81^2+H81^2-E81*G81*H81 -> 14326848.562406991
A82: =A81+1 -> 76 | B82: =B81 -> 100 | C82: =C81 -> 9.6250000000000002E-2 | D82: =B82*SIN(2*PI()*A82*C82) -> 91.77546256839814 | E82: =E81 -> 1.6452810360417196 | F82: =D82+E82*H81-G81 -> 5812.9950810158307 | G82: =H81 -> 2771.1250809976491 | H82: =F82 -> 5812.9950810158307 | I82: =G82^2+H82^2-E82*G82*H82 -> 14966976.462659895
A83: =A82+1 -> 77 | B83: =B82 -> 100 | C83: =C82 -> 9.6250000000000002E-2 | D83: =B83*SIN(2*PI()*A83*C83) -> 52.917900097419214 | E83: =E82 -> 1.6452810360417196 | F83: =D83+E83*H82-G82 -> 6845.8033884989172 | G83: =H82 -> 5812.9950810158307 | H83: =F83 -> 6845.8033884989172 | I83: =G83^2+H83^2-E83*G83*H83 -> 15182599.882265359
A84: =A83+1 -> 78 | B84: =B83 -> 100 | C84: =C83 -> 9.6250000000000002E-2 | D84: =B84*SIN(2*PI()*A84*C84) -> -4.7106450709639667 | E84: =E83 -> 1.6452810360417196 | F84: =D84+E84*H83-G83 -> 5445.5647654806189 | G84: =H83 -> 6845.8033884989172 | H84: =F84 -> 5445.5647654806189 | I84: =G84^2+H84^2-E84*G84*H84 -> 15184330.716070168
A85: =A84+1 -> 79 | B85: =B84 -> 100 | C85: =C84 -> 9.6250000000000002E-2 | D85: =B85*SIN(2*PI()*A85*C85) -> -60.668235100200199 | E85: =E84 -> 1.6452810360417196 | F85: =D85+E85*H84-G84 -> 2053.0128155831198 | G85: =H84 -> 5445.5647654806189 | H85: =F85 -> 2053.0128155831198 | I85: =G85^2+H85^2-E85*G85*H85 -> 15475100.86133384
A86: =A85+1 -> 80 | B86: =B85 -> 100 | C86: =C85 -> 9.6250000000000002E-2 | D86: =B86*SIN(2*PI()*A86*C86) -> -95.105651629515407 | E86: =E85 -> 1.6452810360417196 | F86: =D86+E86*H85-G85 -> -2162.8873648806111 | G86: =H85 -> 2053.0128155831198 | H86: =F86 -> -2162.8873648806111 | I86: =G86^2+H86^2-E86*G86*H86 -> 16198707.659083823
A87: =A86+1 -> 81 | B87: =B86 -> 100 | C87: =C86 -> 9.6250000000000002E-2 | D87: =B87*SIN(2*PI()*A87*C87) -> -95.807289946231904 | E87: =E86 -> 1.6452810360417196 | F87: =D87+E87*H86-G86 -> -5707.3776700616681 | G87: =H86 -> -2162.8873648806111 | H87: =F87 -> -5707.3776700616681 | I87: =G87^2+H87^2-E87*G87*H87 -> 16942209.640437976
A88: =A87+1 -> 82 | B88: =B87 -> 100 | C88: =C87 -> 9.6250000000000002E-2 | D88: =B88*SIN(2*PI()*A88*C88) -> -62.524265633571133 | E88: =E87 -> 1.6452810360417196 | F88: =D88+E88*H87-G87 -> -7289.8771468333962 | G88: =H87 -> -5707.3776700616681 | H88: =F88 -> -7289.8771468333962 | I88: =G88^2+H88^2-E88*G88*H88 -> 17262770.911465392
A89: =A88+1 -> 83 | B89: =B88 -> 100 | C89: =C88 -> 9.6250000000000002E-2 | D89: =B89*SIN(2*PI()*A89*C89) -> -7.0626985931161599 | E89: =E88 -> 1.6452810360417196 | F89: =D89+E89*H88-G88 -> -6293.5816532903527 | G89: =H88 -> -7289.8771468333962 | H89: =F89 -> -6293.5816532903527 | I89: =G89^2+H89^2-E89*G89*H89 -> 17266911.093513012
A90: =A89+1 -> 84 | B90: =B89 -> 100 | C90: =C89 -> 9.6250000000000002E-2 | D90: =B90*SIN(2*PI()*A90*C90) -> 50.904141575037464 | E90: =E89 -> 1.6452810360417196 | F90: =D90+E90*H89-G89 -> -3013.929254530276 | G90: =H89 -> -6293.5816532903527 | H90: =F90 -> -3013.929254530276 | I90: =G90^2+H90^2-E90*G90*H90 -> 17484574.550390292
A91: =A90+1 -> 85 | B91: =B90 -> 100 | C91: =C90 -> 9.6250000000000002E-2 | D91: =B91*SIN(2*PI()*A91*C91) -> 90.814317382508236 | E91: =E90 -> 1.6452810360417196 | F91: =D91+E91*H90-G90 -> 1425.6353242228406 | G91: =H90 -> -3013.929254530276 | H91: =F91 -> 1425.6353242228406 | I91: =G91^2+H91^2-E91*G91*H91 -> 18185589.970930625
A92: =A91+1 -> 86 | B92: =B91 -> 100 | C92: =C91 -> 9.6250000000000002E-2 | D92: =B92*SIN(2*PI()*A92*C92) -> 98.510932615477486 | E92: =E91 -> 1.6452810360417196 | F92: =D92+E92*H91-G91 -> 5458.0109504007814 | G92: =H91 -> 1425.6353242228406 | H92: =F92 -> 5458.0109504007814 | I92: =G92^2+H92^2-E92*G92*H92 -> 19020168.701580945
A93: =A92+1 -> 87 | B93: =B92 -> 100 | C93: =C92 -> 9.6250000000000002E-2 | D93: =B93*SIN(2*PI()*A93*C93) -> 71.263851892521018 | E93: =E92 -> 1.6452810360417196 | F93: =D93+E93*H92-G92 -> 7625.5904388721292 | G93: =H92 -> 5458.0109504007814 | H93: =F93 -> 7625.5904388721292 | I93: =G93^2+H93^2-E93*G93*H93 -> 19462001.384611577
A94: =A93+1 -> 88 | B94: =B93 -> 100 | C94: =C93 -> 9.6250000000000002E-2 | D94: =B94*SIN(2*PI()*A94*C94) -> 18.73813145857326 | E94: =E93 -> 1.6452810360417196 | F94: =D94+E94*H93-G93 -> 7106.96651875516 | G94: =H93 -> 7625.5904388721292 | H94: =F94 -> 7106.96651875516 | I94: =G94^2+H94^2-E94*G94*H94 -> 19492899.73082076
A95: =A94+1 -> 89 | B95: =B94 -> 100 | C95: =C94 -> 9.6250000000000002E-2 | D95: =B95*SIN(2*PI()*A95*C95) -> -40.434359552874945 | E95: =E94 -> 1.6452810360417196 | F95: =D95+E95*H94-G94 -> 4026.9324386662984 | G95: =H94 -> 7106.96651875516 | H95: =F95 -> 4026.9324386662984 | I95: =G95^2+H95^2-E95*G95*H95 -> 19638409.162308916
A96: =A95+1 -> 90 | B96: =B95 -> 100 | C96: =C95 -> 9.6250000000000002E-2 | D96: =B96*SIN(2*PI()*A96*C96) -> -85.264016435409417 | E96: =E95 -> 1.6452810360417196 | F96: =D96+E96*H95-G95 -> -566.79496043167364 | G96: =H95 -> 4026.9324386662984 | H96: =F96 -> -566.79496043167364 | I96: =G96^2+H96^2-E96*G96*H96 -> 20292704.887191713
A97: =A96+1 -> 91 | B97: =B96 -> 100 | C97: =C96 -> 9.6250000000000002E-2 | D97: =B97*SIN(2*PI()*A97*C97) -> -99.848909745053817 | E97: =E96 -> 1.6452810360417196 | F97: =D97+E97*H96-G96 -> -5059.3183481336018 | G97: =H96 -> -566.79496043167364 | H97: =F97 -> -5059.3183481336018 | I97: =G97^2+H97^2-E97*G97*H97 -> 21199957.121923827
A98: =A97+1 -> 92 | B98: =B97 -> 100 | C98: =C97 -> 9.6250000000000002E-2 | D98: =B98*SIN(2*PI()*A98*C98) -> -79.015501237569396 | E98: =E97 -> 1.6452810360417196 | F98: =D98+E98*H97-G97 -> -7836.2210742880297 | G98: =H97 -> -5059.3183481336018 | H98: =F98 -> -7836.2210742880297 | I98: =G98^2+H98^2-E98*G98*H98 -> 21774354.470019661
A99: =A98+1 -> 93 | B99: =B98 -> 100 | C99: =C98 -> 9.6250000000000002E-2 | D99: =B99*SIN(2*PI()*A99*C99) -> -30.153795994450249 | E99: =E98 -> 1.6452810360417196 | F99: =D99+E99*H98-G98 -> -7863.6213756174147 | G99: =H98 -> -7836.2210742880297 | H99: =F99 -> -7863.6213756174147 | I99: =G99^2+H99^2-E99*G99*H99 -> 21858914.851417035
A100: =A99+1 -> 94 | B100: =B99 -> 100 | C100: =C99 -> 9.6250000000000002E-2 | D100: =B100*SIN(2*PI()*A100*C100) -> 29.404032523230956 | E100: =E99 -> 1.6452810360417196 | F100: =D100+E100*H99-G99 -> -5072.2420171043714 | G100: =H99 -> -7863.6213756174147 | H100: =F100 -> -5072.2420171043714 | I100: =G100^2+H100^2-E100*G100*H100 -> 21940186.981507987
A101: =A100+1 -> 95 | B101: =B100 -> 100 | C101: =C100 -> 9.6250000000000002E-2 | D101: =B101*SIN(2*PI()*A101*C101) -> 78.531693088074789 | E101: =E100 -> 1.6452810360417196 | F101: =D101+E101*H100-G100 -> -403.11053225033174 | G101: =H100 -> -5072.2420171043714 | H101: =F101 -> -403.11053225033174 | I101: =G101^2+H101^2-E101*G101*H101 -> 22526073.529339548
A102: =A101+1 -> 96 | B102: =B101 -> 100 | C102: =C101 -> 9.6250000000000002E-2 | D102: =B102*SIN(2*PI()*A102*C102) -> 99.802672842827135 | E102: =E101 -> 1.6452810360417196 | F102: =D102+E102*H101-G101 -> 4508.8145758070441 | G102: =H101 -> -403.11053225033174 | H102: =F102 -> 4508.8145758070441 | I102: =G102^2+H102^2-E102*G102*H102 -> 23482288.585970499
A103: =A102+1 -> 97 | B103: =B102 -> 100 | C103: =C102 -> 9.6250000000000002E-2 | D103: =B103*SIN(2*PI()*A103*C103) -> 85.67175188650522 | E103: =E102 -> 1.6452810360417196 | F103: =D103+E103*H102-G102 -> 7907.0494007406569 | G103: =H102 -> 4508.8145758070441 | H103: =F103 -> 7907.0494007406569 | I103: =G103^2+H103^2-E103*G103*H103 -> 24194234.545886882
A104: =A103+1 -> 98 | B104: =B103 -> 100 | C104: =C103 -> 9.6250000000000002E-2 | D104: =B104*SIN(2*PI()*A104*C104) -> 41.151435860511434 | E104: =E103 -> 1.6452810360417196 | F104: =D104+E104*H103-G103 -> 8541.6552901371124 | G104: =H103 -> 7907.0494007406569 | H104: =F104 -> 8541.6552901371124 | I104: =G104^2+H104^2-E104*G104*H104 -> 24360191.73187831
A105: =A104+1 -> 99 | B105: =B104 -> 100 | C105: =C104 -> 9.6250000000000002E-2 | D105: =B105*SIN(2*PI()*A105*C105) -> -17.966074859319932 | E105: =E104 -> 1.6452810360417196 | F105: =D105+E105*H104-G104 -> 6128.407989668046 | G105: =H104 -> 8541.6552901371124 | H105: =F105 -> 6128.407989668046 | I105: =G105^2+H105^2-E105*G105*H105 -> 24392146.936617509
A106: =A105+1 -> 100 | B106: =B105 -> 100 | C106: =C105 -> 9.6250000000000002E-2 | D106: =B106*SIN(2*PI()*A106*C106) -> -70.710678118654641 | E106: =E105 -> 1.6452810360417196 | F106: =D106+E106*H105-G105 -> 1470.5874782716292 | G106: =H105 -> 6128.407989668046 | H106: =F106 -> 1470.5874782716292 | I106: =G106^2+H106^2-E106*G106*H106 -> 24892146.93661749
A107: =A106+1 -> 101 | B107: =B106 -> 100 | C107: =C106 -> 9.6250000000000002E-2 | D107: =B107*SIN(2*PI()*A107*C107) -> -98.372862894953542 | E107: =E106 -> 1.6452810360417196 | F107: =D107+E107*H106-G106 -> -3807.2511627222734 | G107: =H106 -> 1470.5874782716292 | H107: =F107 -> -3807.2511627222734 | I107: =G107^2+H107^2-E107*G107*H107 -> 25869546.172186576
A108: =A107+1 -> 102 | B108: =B107 -> 100 | C108: =C107 -> 9.6250000000000002E-2 | D108: =B108*SIN(2*PI()*A108*C108) -> -91.140327663544682 | E108: =E107 -> 1.6452810360417196 | F108: =D108+E108*H107-G107 -> -7825.7259434099178 | G108: =H107 -> -3807.2511627222734 | H108: =F108 -> -7825.7259434099178 | I108: =G108^2+H108^2-E108*G108*H108 -> 26716815.223501638
A109: =A108+1 -> 103 | B109: =B108 -> 100 | C109: =C108 -> 9.6250000000000002E-2 | D109: =B109*SIN(2*PI()*A109*C109) -> -51.578589828505187 | E109: =E108 -> 1.6452810360417196 | F109: =D109+E109*H108-G108 -> -9119.8459150582639 | G109: =H108 -> -7825.7259434099178 | H109: =F109 -> -9119.8459150582639 | I109: =G109^2+H109^2-E109*G109*H109 -> 26990831.369157463
A110: =A109+1 -> 104 | B110: =B109 -> 100 | C110: =C109 -> 9.6250000000000002E-2 | D110: =B110*SIN(2*PI()*A110*C110) -> 6.2790519529321216 | E110: =E109 -> 1.6452810360417196 | F110: =D110+E110*H109-G109 -> -7172.7045403050561 | G110: =H109 -> -9119.8459150582639 | H110: =F110 -> -7172.7045403050561 | I110: =G110^2+H110^2-E110*G110*H110 -> 26994931.724473909
A111: =A110+1 -> 105 | B111: =B110 -> 100 | C111: =C110 -> 9.6250000000000002E-2 | D111: =B111*SIN(2*PI()*A111*C111) -> 61.90939493098336 | E111: =E110 -> 1.6452810360417196 | F111: =D111+E111*H110-G110 -> -2619.3594473050016 | G111: =H110 -> -7172.7045403050561 | H111: =F111 -> -2619.3594473050016 | I111: =G111^2+H111^2-E111*G111*H111 -> 27397372.908449564
A112: =A111+1 -> 106 | B112: =B111 -> 100 | C112: =C111 -> 9.6250000000000002E-2 | D112: =B112*SIN(2*PI()*A112*C112) -> 95.579301479832964 | E112: =E111 -> 1.6452810360417196 | F112: =D112+E112*H111-G111 -> 2958.70141655725 | G112: =H111 -> -2619.3594473050016 | H112: =F112 -> 2958.70141655725 | I112: =G112^2+H112^2-E112*G112*H112 -> 28365725.612815082
A113: =A112+1 -> 107 | B113: =B112 -> 100 | C113: =C112 -> 9.6250000000000002E-2 | D113: =B113*SIN(2*PI()*A113*C113) -> 95.345417231900214 | E113: =E112 -> 1.6452810360417196 | F113: =D113+E113*H112-G112 -> 7582.6001965083169 | G113: =H112 -> 2958.70141655725 | H113: =F113 -> 7582.6001965083169 | I113: =G113^2+H113^2-E113*G113*H113 -> 29338435.71163746
A114: =A113+1 -> 108 | B114: =B113 -> 100 | C114: =C113 -> 9.6250000000000002E-2 | D114: =B114*SIN(2*PI()*A114*C114) -> 61.290705365297981 | E114: =E113 -> 1.6452810360417196 | F114: =D114+E114*H113-G113 -> 9578.0975960093965 | G114: =H113 -> 7582.6001965083169 | H114: =F114 -> 9578.0975960093965 | I114: =G114^2+H114^2-E114*G114*H114 -> 29744143.17256844
A115: =A114+1 -> 109 | B115: =B114 -> 100 | C115: =C114 -> 9.6250000000000002E-2 | D115: =B115*SIN(2*PI()*A115*C115) -> 5.4950179912451107 | E115: =E114 -> 1.6452810360417196 | F115: =D115+E115*H114-G114 -> 8181.5571575539716 | G115: =H114 -> 9578.0975960093965 | H115: =F115 -> 8181.5571575539716 | I115: =G115^2+H115^2-E115*G115*H115 -> 29747434.451845363
A116: =A115+1 -> 110 | B116: =B115 -> 100 | C116: =C115 -> 9.6250000000000002E-2 | D116: =B116*SIN(2*PI()*A116*C116) -> -52.249856471595535 | E116: =E115 -> 1.6452810360417196 | F116: =D116+E116*H115-G115 -> 3830.6133841339524 | G116: =H115 -> 8181.5571575539716 | H116: =F116 -> 3830.6133841339524 | I116: =G116^2+H116^2-E116*G116*H116 -> 30047739.676988624
A117: =A116+1 -> 111 | B117: =B116 -> 100 | C117: =C116 -> 9.6250000000000002E-2 | D117: =B117*SIN(2*PI()*A117*C117) -> -91.460715979861618 | E117: =E116 -> 1.6452810360417196 | F117: =D117+E117*H116-G116 -> -1970.5823162106462 | G117: =H116 -> 3830.6133841339524 | H117: =F117 -> -1970.5823162106462 | I117: =G117^2+H117^2-E117*G117*H117 -> 30976261.621986549
A118: =A117+1 -> 112 | B118: =B117 -> 100 | C118: =C117 -> 9.6250000000000002E-2 | D118: =B118*SIN(2*PI()*A118*C118) -> -98.22872507286877 | E118: =E117 -> 1.6452810360417196 | F118: =D118+E118*H117-G117 -> -7171.0038240273643 | G118: =H117 -> -1970.5823162106462 | H118: =F118 -> -7171.0038240273643 | I118: =G118^2+H118^2-E118*G118*H118 -> 32056936.454083957
A119: =A118+1 -> 113 | B119: =B118 -> 100 | C119: =C118 -> 9.6250000000000002E-2 | D119: =B119*SIN(2*PI()*A119*C119) -> -70.153142577085291 | E119: =E118 -> 1.6452810360417196 | F119: =D119+E119*H118-G118 -> -9897.887427421314 | G119: =H118 -> -7171.0038240273643 | H119: =F119 -> -9897.887427421314 | I119: =G119^2+H119^2-E119*G119*H119 -> 32613061.819802761
A120: =A119+1 -> 114 | B120: =B119 -> 100 | C120: =C119 -> 9.6250000000000002E-2 | D120: =B120*SIN(2*PI()*A120*C120) -> -17.192910027942084 | E120: =E119 -> 1.6452810360417196 | F120: =D120+E120*H119-G119 -> -9130.9955672126271 | G120: =H119 -> -9897.887427421314 | H120: =F120 -> -9130.9955672126271 | I120: =G120^2+H120^2-E120*G120*H120 -> 32646759.781498879
A121: =A120+1 -> 115 | B121: =B120 -> 100 | C121: =C120 -> 9.6250000000000002E-2 | D121: =B121*SIN(2*PI()*A121*C121) -> 41.865973753742949 | E121: =E120 -> 1.6452810360417196 | F121: =D121+E121*H120-G120 -> -5083.3004457408824 | G121: =H120 -> -9130.9955672126271 | H121: =F121 -> -5083.3004457408824 | I121: =G121^2+H121^2-E121*G121*H121 -> 32848327.153709009
A122: =A121+1 -> 116 | B122: =B121 -> 100 | C122: =C121 -> 9.6250000000000002E-2 | D122: =B122*SIN(2*PI()*A122*C122) -> 86.07420270039438 | E122: =E121 -> 1.6452810360417196 | F122: =D122+E122*H121-G121 -> 853.61194603312651 | G122: =H121 -> -5083.3004457408824 | H122: =F122 -> 853.61194603312651 | I122: =G122^2+H122^2-E122*G122*H122 -> 33707744.284688011
A123: =A122+1 -> 117 | B123: =B122 -> 100 | C123: =C122 -> 9.6250000000000002E-2 | D123: =B123*SIN(2*PI()*A123*C123) -> 99.750279641627017 | E123: =E122 -> 1.6452810360417196 | F123: =D123+E123*H122-G122 -> 6587.4822723294801 | G123: =H122 -> 853.61194603312651 | H123: =F123 -> 6587.4822723294801 | I123: =G123^2+H123^2-E123*G123*H123 -> 34871908.124452189
A124: =A123+1 -> 118 | B124: =B123 -> 100 | C124: =C123 -> 9.6250000000000002E-2 | D124: =B124*SIN(2*PI()*A124*C124) -> 78.043040733833109 | E124: =E123 -> 1.6452810360417196 | F124: =D124+E124*H123-G123 -> 10062.690752625414 | G124: =H123 -> 6587.4822723294801 | H124: =F124 -> 10062.690752625414 | I124: =G124^2+H124^2-E124*G124*H124 -> 35590612.636876151
A125: =A124+1 -> 119 | B125: =B124 -> 100 | C125: =C124 -> 9.6250000000000002E-2 | D125: =B125*SIN(2*PI()*A125*C125) -> 28.652455272780152 | E125: =E124 -> 1.6452810360417196 | F125: =D125+E125*H124-G124 -> 9997.1244497902717 | G125: =H124 -> 10062.690752625414 | H125: =F125 -> 9997.1244497902717 | I125: =G125^2+H125^2-E125*G125*H125 -> 35688307.256862015
A126: =A125+1 -> 120 | B126: =B125 -> 100 | C126: =C125 -> 9.6250000000000002E-2 | D126: =B126*SIN(2*PI()*A126*C126) -> -30.901699437494308 | E126: =E125 -> 1.6452810360417196 | F126: =D126+E126*H125-G125 -> 6354.486820126036 | G126: =H125 -> 9997.1244497902717 | H126: =F126 -> 6354.486820126036 | I126: =G126^2+H126^2-E126*G126*H126 -> 35802897.060237035
A127: =A126+1 -> 121 | B127: =B126 -> 100 | C127: =C126 -> 9.6250000000000002E-2 | D127: =B127*SIN(2*PI()*A127*C127) -> -79.494435338751515 | E127: =E126 -> 1.6452810360417196 | F127: =D127+E127*H126-G126 -> 378.29777380139421 | G127: =H126 -> 6354.486820126036 | H127: =F127 -> 378.29777380139421 | I127: =G127^2+H127^2-E127*G127*H127 -> 36567540.255466111
A128: =A127+1 -> 122 | B128: =B127 -> 100 | C128: =C127 -> 9.6250000000000002E-2 | D128: =B128*SIN(2*PI()*A128*C128) -> -99.888987496197032 | E128: =E127 -> 1.6452810360417196 | F128: =D128+E128*H127-G127 -> -5831.9696544099988 | G128: =H127 -> 378.29777380139421 | H128: =F128 -> -5831.9696544099988 | I128: =G128^2+H128^2-E128*G128*H128 -> 37784833.053873979
A129: =A128+1 -> 123 | B129: =B128 -> 100 | C129: =C128 -> 9.6250000000000002E-2 | D129: =B129*SIN(2*PI()*A129*C129) -> -84.8510214981508 | E129: =E128 -> 1.6452810360417196 | F129: =D129+E129*H128-G128 -> -10058.377870471097 | G129: =H128 -> -5831.9696544099988 | H129: =F129 -> -10058.377870471097 | I129: =G129^2+H129^2-E129*G129*H129 -> 38670395.643335357
A130: =A129+1 -> 124 | B130: =B129 -> 100 | C130: =C129 -> 9.6250000000000002E-2 | D130: =B130*SIN(2*PI()*A130*C130) -> -39.714789063478932 | E130: =E129 -> 1.6452810360417196 | F130: =D130+E130*H129-G129 -> -10756.603498281273 | G130: =H129 -> -10058.377870471097 | H130: =F130 -> -10756.603498281273 | I130: =G130^2+H130^2-E130*G130*H130 -> 38865976.437659591
A131: =A130+1 -> 125 | B131: =B130 -> 100 | C131: =C130 -> 9.6250000000000002E-2 | D131: =B131*SIN(2*PI()*A131*C131) -> 19.509032201611774 | E131: =E130 -> 1.6452810360417196 | F131: =D131+E131*H130-G130 -> -7619.7488452694888 | G131: =H130 -> -10756.603498281273 | H131: =F131 -> -7619.7488452694888 | I131: =G131^2+H131^2-E131*G131*H131 -> 38913551.72984001
A132: =A131+1 -> 126 | B132: =B131 -> 100 | C132: =C131 -> 9.6250000000000002E-2 | D132: =B132*SIN(2*PI()*A132*C132) -> 71.812629776319042 | E132: =E131 -> 1.6452810360417196 | F132: =D132+E132*H131-G131 -> -1708.21214646509 | G132: =H131 -> -7619.7488452694888 | H132: =F132 -> -1708.21214646509 | I132: =G132^2+H132^2-E132*G132*H132 -> 39563340.508059248
A133: =A132+1 -> 127 | B133: =B132 -> 100 | C133: =C132 -> 9.6250000000000002E-2 | D133: =B133*SIN(2*PI()*A133*C133) -> 98.642925717649561 | E133: =E132 -> 1.6452810360417196 | F133: =D133+E133*H132-G132 -> 4907.9027208720054 | G133: =H132 -> -1708.21214646509 | H133: =F133 -> 4907.9027208720054 | I133: =G133^2+H133^2-E133*G133*H133 -> 40799104.710914746
A134: =A133+1 -> 128 | B134: =B133 -> 100 | C134: =C133 -> 9.6250000000000002E-2 | D134: =B134*SIN(2*PI()*A134*C134) -> 90.482705246601952 | E134: =E133 -> 1.6452810360417196 | F134: =D134+E134*H133-G133 -> 9873.5741250999599 | G134: =H133 -> 4907.9027208720054 | H134: =F134 -> 9873.5741250999599 | I134: =G134^2+H134^2-E134*G134*H134 -> 41847056.064353913
A135: =A134+1 -> 129 | B135: =B134 -> 100 | C135: =C134 -> 9.6250000000000002E-2 | D135: =B135*SIN(2*PI()*A135*C135) -> 50.226553314337373 | E135: =E134 -> 1.6452810360417196 | F135: =D135+E135*H134-G134 -> 11387.12809842151 | G135: =H134 -> 9873.5741250999599 | H135: =F135 -> 11387.12809842151 | I135: =G135^2+H135^2-E135*G135*H135 -> 42172485.223215014
A136: =A135+1 -> 130 | B136: =B135 -> 100 | C136: =C135 -> 9.6250000000000002E-2 | D136: =B136*SIN(2*PI()*A136*C136) -> -7.8459095727842332 | E136: =E135 -> 1.6452810360417196 | F136: =D136+E136*H135-G135 -> 8853.6058806379733 | G136: =H135 -> 11387.12809842151 | H136: =F136 -> 8853.6058806379733 | I136: =G136^2+H136^2-E136*G136*H136 -> 42180487.801828176
A137: =A136+1 -> 131 | B137: =B136 -> 100 | C137: =C136 -> 9.6250000000000002E-2 | D137: =B137*SIN(2*PI()*A137*C137) -> -63.13527954493857 | E137: =E136 -> 1.6452810360417196 | F137: =D137+E137*H136-G136 -> 3116.406478034658 | G137: =H136 -> 8853.6058806379733 | H137: =F137 -> 3116.406478034658 | I137: =G137^2+H137^2-E137*G137*H137 -> 42702662.123369671
A138: =A137+1 -> 132 | B138: =B137 -> 100 | C138: =C137 -> 9.6250000000000002E-2 | D138: =B138*SIN(2*PI()*A138*C138) -> -96.029368567694164 | E138: =E137 -> 1.6452810360417196 | F138: =D138+E138*H137-G137 -> -3822.2707702976786 | G138: =H137 -> 3116.406478034658 | H138: =F138 -> -3822.2707702976786 | I138: =G138^2+H138^2-E138*G138*H138 -> 43919918.554200985
A139: =A138+1 -> 133 | B139: =B138 -> 100 | C139: =C138 -> 9.6250000000000002E-2 | D139: =B139*SIN(2*PI()*A139*C139) -> -94.860019462550653 | E139: =E138 -> 1.6452810360417196 | F139: =D139+E139*H138-G138 -> -9499.9761104845547 | G139: =H138 -> -3822.2707702976786 | H139: =F139 -> -9499.9761104845547 | I139: =G139^2+H139^2-E139*G139*H139 -> 45116708.852094911
A140: =A139+1 -> 134 | B140: =B139 -> 100 | C140: =C139 -> 9.6250000000000002E-2 | D140: =B140*SIN(2*PI()*A140*C140) -> -60.042022532589002 | E140: =E139 -> 1.6452810360417196 | F140: =D140+E140*H139-G139 -> -11867.901789664524 | G140: =H139 -> -9499.9761104845547 | H140: =F140 -> -11867.901789664524 | I140: =G140^2+H140^2-E140*G140*H140 -> 45599784.811048627
A141: =A140+1 -> 135 | B141: =B140 -> 100 | C141: =C140 -> 9.6250000000000002E-2 | D141: =B141*SIN(2*PI()*A141*C141) -> -3.9259815759077341 | E141: =E140 -> 1.6452810360417196 | F141: =D141+E141*H140-G140 -> -10029.983623231978 | G141: =H140 -> -11867.901789664524 | H141: =F141 -> -10029.983623231978 | I141: =G141^2+H141^2-E141*G141*H141 -> 45601865.610778749
A142: =A141+1 -> 136 | B142: =B141 -> 100 | C142: =C141 -> 9.6250000000000002E-2 | D142: =B142*SIN(2*PI()*A142*C142) -> 53.582679497900024 | E142: =E141 -> 1.6452810360417196 | F142: =D142+E142*H141-G141 -> -4580.6573779501632 | G142: =H141 -> -10029.983623231978 | H142: =F142 -> -4580.6573779501632 | I142: =G142^2+H142^2-E142*G142*H142 -> 45992335.692514524
A143: =A142+1 -> 137 | B143: =B142 -> 100 | C143: =C142 -> 9.6250000000000002E-2 | D143: =B143*SIN(2*PI()*A143*C143) -> 92.084548014102737 | E143: =E142 -> 1.6452810360417196 | F143: =D143+E143*H142-G142 -> 2585.5994547000892 | G143: =H142 -> -4580.6573779501632 | H143: =F143 -> 2585.5994547000892 | I143: =G143^2+H143^2-E143*G143*H143 -> 47154035.958180256
A144: =A143+1 -> 138 | B144: =B143 -> 100 | C144: =C143 -> 9.6250000000000002E-2 | D144: =B144*SIN(2*PI()*A144*C144) -> 97.922281062176538 | E144: =E143 -> 1.6452810360417196 | F144: =D144+E144*H143-G143 -> 8932.617408630209 | G144: =H143 -> 2585.5994547000892 | H144: =F144 -> 8932.617408630209 | I144: =G144^2+H144^2-E144*G144*H144 -> 48477286.649902225
A145: =A144+1 -> 139 | B145: =B144 -> 100 | C145: =C144 -> 9.6250000000000002E-2 | D145: =B145*SIN(2*PI()*A145*C145) -> 69.025124023443681 | E145: =E144 -> 1.6452810360417196 | F145: =D145+E145*H144-G144 -> 12180.091693958766 | G145: =H144 -> 8932.617408630209 | H145: =F145 -> 12180.091693958766 | I145: =G145^2+H145^2-E145*G145*H145 -> 49139547.666659027
A146: =A145+1 -> 140 | B146: =B145 -> 100 | C146: =C145 -> 9.6250000000000002E-2 | D146: =B146*SIN(2*PI()*A146*C146) -> 15.643446504023151 | E146: =E145 -> 1.6452810360417196 | F146: =D146+E146*H145-G145 -> 11122.699919193434 | G146: =H145 -> 12180.091693958766 | H146: =F146 -> 11122.699919193434 | I146: =G146^2+H146^2-E146*G146*H146 -> 49173808.105252445
A147: =A146+1 -> 141 | B147: =B146 -> 100 | C147: =C146 -> 9.6250000000000002E-2 | D147: =B147*SIN(2*PI()*A147*C147) -> -43.287258152041225 | E147: =E146 -> 1.6452810360417196 | F147: =D147+E147*H146-G146 -> 6076.588294520916 | G147: =H146 -> 11122.699919193434 | H147: =F147 -> 6076.588294520916 | I147: =G147^2+H147^2-E147*G147*H147 -> 49438012.032535732
A148: =A147+1 -> 142 | B148: =B147 -> 100 | C148: =C147 -> 9.6250000000000002E-2 | D148: =B148*SIN(2*PI()*A148*C148) -> -86.863151443818978 | E148: =E147 -> 1.6452810360417196 | F148: =D148+E148*H147-G147 -> -1211.8675858288934 | G148: =H147 -> 6076.588294520916 | H148: =F148 -> -1211.8675858288934 | I148: =G148^2+H148^2-E148*G148*H148 -> 50509431.437718496
A149: =A148+1 -> 143 | B149: =B148 -> 100 | C149: =C148 -> 9.6250000000000002E-2 | D149: =B149*SIN(2*PI()*A149*C149) -> -99.627037649294166 | E149: =E148 -> 1.6452810360417196 | F149: =D149+E149*H148-G148 -> -8170.0780893281499 | G149: =H148 -> -1211.8675858288934 | H149: =F149 -> -8170.0780893281499 | I149: =G149^2+H149^2-E149*G149*H149 -> 51928784.605919167
A150: =A149+1 -> 144 | B150: =B149 -> 100 | C150: =C149 -> 9.6250000000000002E-2 | D150: =B150*SIN(2*PI()*A150*C150) -> -77.051324277579283 | E150: =E149 -> 1.6452810360417196 | F150: =D150+E150*H149-G149 -> -12307.258281800257 | G150: =H149 -> -8170.0780893281499 | H150: =F150 -> -12307.258281800257 | I150: =G150^2+H150^2-E150*G150*H150 -> 52783699.152420878
A151: =A150+1 -> 145 | B151: =B150 -> 100 | C151: =C150 -> 9.6250000000000002E-2 | D151: =B151*SIN(2*PI()*A151*C151) -> -27.144044986508074 | E151: =E150 -> 1.6452810360417196 | F151: =D151+E151*H150-G150 -> -12105.964612371719 | G151: =H150 -> -12307.258281800257 | H151: =F151 -> -12105.964612371719 | I151: =G151^2+H151^2-E151*G151*H151 -> 52890535.03326416
A152: =A151+1 -> 146 | B152: =B151 -> 100 | C152: =C151 -> 9.6250000000000002E-2 | D152: =B152*SIN(2*PI()*A152*C152) -> 32.391741819814186 | E152: =E151 -> 1.6452810360417196 | F152: =D152+E152*H151-G151 -> -7578.0639761072653 | G152: =H151 -> -12105.964612371719 | H152: =F152 -> -7578.0639761072653 | I152: =G152^2+H152^2-E152*G152*H152 -> 53043721.874229908
A153: =A152+1 -> 147 | B153: =B152 -> 100 | C153: =C152 -> 9.6250000000000002E-2 | D153: =B153*SIN(2*PI()*A153*C153) -> 80.437563527008749 | E153: =E152 -> 1.6452810360417196 | F153: =D153+E153*H152-G152 -> -281.64277390146708 | G153: =H152 -> -7578.0639761072653 | H153: =F153 -> -281.64277390146708 | I153: =G153^2+H153^2-E153*G153*H153 -> 53994841.513275668
A154: =A153+1 -> 148 | B154: =B153 -> 100 | C154: =C153 -> 9.6250000000000002E-2 | D154: =B154*SIN(2*PI()*A154*C154) -> 99.950656036573164 | E154: =E153 -> 1.6452810360417196 | F154: =D154+E154*H153-G153 -> 7214.6331173055687 | G154: =H153 -> -281.64277390146708 | H154: =F154 -> 7214.6331173055687 | I154: =G154^2+H154^2-E154*G154*H154 -> 55473381.292312577
A155: =A154+1 -> 149 | B155: =B154 -> 100 | C155: =C154 -> 9.6250000000000002E-2 | D155: =B155*SIN(2*PI()*A155*C155) -> 84.00935538989404 | E155: =E154 -> 1.6452810360417196 | F155: =D155+E155*H154-G154 -> 12235.751179192768 | G155: =H154 -> 7214.6331173055687 | H155: =F155 -> 12235.751179192768 | I155: =G155^2+H155^2-E155*G155*H155 -> 56524959.489473373
A156: =A155+1 -> 150 | B156: =B155 -> 100 | C156: =C155 -> 9.6250000000000002E-2 | D156: =B156*SIN(2*PI()*A156*C156) -> 38.268343236508848 | E156: =E155 -> 1.6452810360417196 | F156: =D156+E156*H155-G155 -> 12954.884602781909 | G156: =H155 -> 12235.751179192768 | H156: =F156 -> 12954.884602781909 | I156: =G156^2+H156^2-E156*G156*H156 -> 56744629.403583437
A157: =A156+1 -> 151 | B157: =B156 -> 100 | C157: =C156 -> 9.6250000000000002E-2 | D157: =B157*SIN(2*PI()*A157*C157) -> -21.047175982130579 | E157: =E156 -> 1.6452810360417196 | F157: =D157+E157*H156-G156 -> 9057.6276058910407 | G157: =H156 -> 12954.884602781909 | H157: =F157 -> 9057.6276058910407 | I157: =G157^2+H157^2-E157*G157*H157 -> 56811519.92972371
A158: =A157+1 -> 152 | B158: =B157 -> 100 | C158: =C157 -> 9.6250000000000002E-2 | D158: =B158*SIN(2*PI()*A158*C158) -> -72.896862742141082 | E158: =E157 -> 1.6452810360417196 | F158: =D158+E158*H157-G157 -> 1874.5614659764415 | G158: =H157 -> 9057.6276058910407 | H158: =F158 -> 1874.5614659764415 | I158: =G158^2+H158^2-E158*G158*H158 -> 57619240.724565983
A159: =A158+1 -> 153 | B159: =B158 -> 100 | C159: =C158 -> 9.6250000000000002E-2 | D159: =B159*SIN(2*PI()*A159*C159) -> -98.888649874450422 | E159: =E158 -> 1.6452810360417196 | F159: =D159+E159*H158-G158 -> -6072.3358248998866 | G159: =H158 -> 1874.5614659764415 | H159: =F159 -> -6072.3358248998866 | I159: =G159^2+H159^2-E159*G159*H159 -> 59115422.380886704
A160: =A159+1 -> 154 | B160: =B159 -> 100 | C160: =C159 -> 9.6250000000000002E-2 | D160: =B160*SIN(2*PI()*A160*C160) -> -89.802757576061722 | E160: =E159 -> 1.6452810360417196 | F160: =D160+E160*H159-G159 -> -11955.063200737039 | G160: =H159 -> -6072.3358248998866 | H160: =F160 -> -11955.063200737039 | I160: =G160^2+H160^2-E160*G160*H160 -> 60357360.812199503
A161: =A160+1 -> 155 | B161: =B160 -> 100 | C161: =C160 -> 9.6250000000000002E-2 | D161: =B161*SIN(2*PI()*A161*C161) -> -48.862124149695916 | E161: =E160 -> 1.6452810360417196 | F161: =D161+E161*H160-G160 -> -13645.965068102681 | G161: =H160 -> -11955.063200737039 | H161: =F161 -> -13645.965068102681 | I161: =G161^2+H161^2-E161*G161*H161 -> 60727424.424544632
A162: =A161+1 -> 156 | B162: =B161 -> 100 | C162: =C161 -> 9.6250000000000002E-2 | D162: =B162*SIN(2*PI()*A162*C162) -> 9.4108313318508365 | E162: =E161 -> 1.6452810360417196 | F162: =D162+E162*H161-G161 -> -10486.973512968207 | G162: =H161 -> -13645.965068102681 | H162: =F162 -> -10486.973512968207 | I162: =G162^2+H162^2-E162*G162*H162 -> 60741240.368976295
A163: =A162+1 -> 157 | B163: =B162 -> 100 | C163: =C162 -> 9.6250000000000002E-2 | D163: =B163*SIN(2*PI()*A163*C163) -> 64.345586473377352 | E163: =E162 -> 1.6452810360417196 | F163: =D163+E163*H162-G162 -> -3543.7079917823448 | G163: =H162 -> -10486.973512968207 | H163: =F163 -> -3543.7079917823448 | I163: =G163^2+H163^2-E163*G163*H163 -> 61391276.025256917
A164: =A163+1 -> 158 | B164: =B163 -> 100 | C164: =C163 -> 9.6250000000000002E-2 | D164: =B164*SIN(2*PI()*A164*C164) -> 96.455741845779968 | E164: =E163 -> 1.6452810360417196 | F164: =D164+E164*H163-G163 -> 4753.0336986650091 | G164: =H163 -> -3543.7079917823448 | H164: =F164 -> 4753.0336986650091 | I164: =G164^2+H164^2-E164*G164*H164 -> 62861262.226590037
A165: =A164+1 -> 159 | B165: =B164 -> 100 | C165: =C164 -> 9.6250000000000002E-2 | D165: =B165*SIN(2*PI()*A165*C165) -> 94.351216402819205 | E165: =E164 -> 1.6452810360417196 | F165: =D165+E165*H164-G164 -> 11458.135416265937 | G165: =H164 -> 4753.0336986650091 | H165: =F165 -> 11458.135416265937 | I165: =G165^2+H165^2-E165*G165*H165 -> 64276704.400424004
A166: =A165+1 -> 160 | B166: =B165 -> 100 | C166: =C165 -> 9.6250000000000002E-2 | D166: =B166*SIN(2*PI()*A166*C166) -> 58.778525229247045 | E166: =E165 -> 1.6452810360417196 | F166: =D166+E166*H165-G165 -> 14157.59773534458 | G166: =H165 -> 11458.135416265937 | H166: =F166 -> 14157.59773534458 | I166: =G166^2+H166^2-E166*G166*H166 -> 64829490.80492413
A167: =A166+1 -> 161 | B167: =B166 -> 100 | C167: =C166 -> 9.6250000000000002E-2 | D167: =B167*SIN(2*PI()*A167*C167) -> 2.3559764833608043 | E167: =E166 -> 1.6452810360417196 | F167: =D167+E167*H166-G166 -> 11837.447630087059 | G167: =H166 -> 14157.59773534458 | H167: =F167 -> 11837.447630087059 | I167: =G167^2+H167^2-E167*G167*H167 -> 64830384.455579698
A168: =A167+1 -> 162 | B168: =B167 -> 100 | C168: =C167 -> 9.6250000000000002E-2 | D168: =B168*SIN(2*PI()*A168*C168) -> -54.902281799813245 | E168: =E167 -> 1.6452810360417196 | F168: =D168+E168*H167-G167 -> 5263.4280837748429 | G168: =H167 -> 11837.447630087059 | H168: =F168 -> 5263.4280837748429 | I168: =G168^2+H168^2-E168*G168*H168 -> 65318694.664165527
A169: =A168+1 -> 163 | B169: =B168 -> 100 | C169: =C168 -> 9.6250000000000002E-2 | D169: =B169*SIN(2*PI()*A169*C169) -> -92.68565956401153 | E169: =E168 -> 1.6452810360417196 | F169: =D169+E169*H168-G168 -> -3270.3148788469134 | G169: =H168 -> 5263.4280837748429 | H169: =F169 -> -3270.3148788469134 | I169: =G169^2+H169^2-E169*G169*H169 -> 66718967.596842483
A170: =A169+1 -> 164 | B170: =B169 -> 100 | C170: =C169 -> 9.6250000000000002E-2 | D170: =B170*SIN(2*PI()*A170*C170) -> -97.591676193875088 | E170: =E169 -> 1.6452810360417196 | F170: =D170+E170*H169-G169 -> -10741.606812020618 | G170: =H169 -> -3270.3148788469134 | H170: =F170 -> -10741.606812020618 | I170: =G170^2+H170^2-E170*G170*H170 -> 68280925.779864609
A171: =A170+1 -> 165 | B171: =B170 -> 100 | C171: =C170 -> 9.6250000000000002E-2 | D171: =B171*SIN(2*PI()*A171*C171) -> -67.880074553295415 | E171: =E170 -> 1.6452810360417196 | F171: =D171+E171*H170-G170 -> -14470.527180140458 | G171: =H170 -> -10741.606812020618 | H171: =F171 -> -14470.527180140458 | I171: =G171^2+H171^2-E171*G171*H171 -> 69041197.025889158
A172: =A171+1 -> 166 | B172: =B171 -> 100 | C172: =C171 -> 9.6250000000000002E-2 | D172: =B172*SIN(2*PI()*A172*C172) -> -14.090123193757256 | E172: =E171 -> 1.6452810360417196 | F172: =D172+E172*H171-G171 -> -13080.567262184493 | G172: =H171 -> -14470.527180140458 | H172: =F172 -> -13080.567262184493 | I172: =G172^2+H172^2-E172*G172*H172 -> 69074153.266777277
A173: =A172+1 -> 167 | B173: =B172 -> 100 | C173: =C172 -> 9.6250000000000002E-2 | D173: =B173*SIN(2*PI()*A173*C173) -> 44.697862067112915 | E173: =E172 -> 1.6452810360417196 | F173: =D173+E173*H172-G172 -> -7005.9842149327324 | G173: =H172 -> -13080.567262184493 | H173: =F173 -> -7005.9842149327324 | I173: =G173^2+H173^2-E173*G173*H173 -> 69407802.378630191
A174: =A173+1 -> 168 | B174: =B173 -> 100 | C174: =C173 -> 9.6250000000000002E-2 | D174: =B174*SIN(2*PI()*A174*C174) -> 87.630668004386735 | E174: =E173 -> 1.6452810360417196 | F174: =D174+E174*H173-G173 -> 1641.3849625524217 | G174: =H173 -> -7005.9842149327324 | H174: =F174 -> 1641.3849625524217 | I174: =G174^2+H174^2-E174*G174*H174 -> 70697896.886412576
A175: =A174+1 -> 169 | B175: =B174 -> 100 | C175: =C174 -> 9.6250000000000002E-2 | D175: =B175*SIN(2*PI()*A175*C175) -> 99.479214176172576 | E175: =E174 -> 1.6452810360417196 | F175: =D175+E175*H174-G174 -> 9806.0029808404524 | G175: =H174 -> 1641.3849625524217 | H175: =F175 -> 9806.0029808404524 | I175: =G175^2+H175^2-E175*G175*H175 -> 72370340.16138795
A176: =A175+1 -> 170 | B176: =B175 -> 100 | C176: =C175 -> 9.6250000000000002E-2 | D176: =B176*SIN(2*PI()*A176*C176) -> 76.040596560002754 | E176: =E175 -> 1.6452810360417196 | F176: =D176+E176*H175-G175 -> 14568.286377752951 | G176: =H175 -> 9806.0029808404524 | H176: =F176 -> 14568.286377752951 | I176: =G176^2+H176^2-E176*G176*H176 -> 73353309.456672132
A177: =A176+1 -> 171 | B177: =B176 -> 100 | C177: =C176 -> 9.6250000000000002E-2 | D177: =B177*SIN(2*PI()*A177*C177) -> 25.628937313299264 | E177: =E176 -> 1.6452810360417196 | F177: =D177+E177*H176-G176 -> 14188.551261414692 | G177: =H176 -> 14568.286377752951 | H177: =F177 -> 14188.551261414692 | I177: =G177^2+H177^2-E177*G177*H177 -> 73465629.511827528
A178: =A177+1 -> 172 | B178: =B177 -> 100 | C178: =C177 -> 9.6250000000000002E-2 | D178: =B178*SIN(2*PI()*A178*C178) -> -33.873792024528072 | E178: =E177 -> 1.6452810360417196 | F178: =D178+E178*H177-G177 -> 8741.9941495339317 | G178: =H177 -> 14188.551261414692 | H178: =F178 -> 8741.9941495339317 | I178: =G178^2+H178^2-E178*G178*H178 -> 73662988.123040289
A179: =A178+1 -> 173 | B179: =B178 -> 100 | C179: =C178 -> 9.6250000000000002E-2 | D179: =B179*SIN(2*PI()*A179*C179) -> -81.360844950077976 | E179: =E178 -> 1.6452810360417196 | F179: =D179+E179*H178-G178 -> 113.12508505106962 | G179: =H178 -> 8741.9941495339317 | H179: =F179 -> 113.12508505106962 | I179: =G179^2+H179^2-E179*G179*H179 -> 74808176.689781681
A180: =A179+1 -> 174 | B180: =B179 -> 100 | C180: =C179 -> 9.6250000000000002E-2 | D180: =B180*SIN(2*PI()*A180*C180) -> -99.987663248166029 | E180: =E179 -> 1.6452810360417196 | F180: =D180+E180*H179-G179 -> -8655.8592556469666 | G180: =H179 -> 113.12508505106962 | H180: =F180 -> -8655.8592556469666 | I180: =G180^2+H180^2-E180*G180*H180 -> 76547747.397299886
A181: =A180+1 -> 175 | B181: =B180 -> 100 | C181: =C180 -> 9.6250000000000002E-2 | D181: =B181*SIN(2*PI()*A181*C181) -> -83.146961230255357 | E181: =E180 -> 1.6452810360417196 | F181: =D181+E181*H180-G180 -> -14437.593130243475 | G181: =H180 -> -8655.8592556469666 | H181: =F181 -> -14437.593130243475 | I181: =G181^2+H181^2-E181*G181*H181 -> 77757595.400619328
A182: =A181+1 -> 176 | B182: =B181 -> 100 | C182: =C181 -> 9.6250000000000002E-2 | D182: =B182*SIN(2*PI()*A182*C182) -> -36.812455268469307 | E182: =E181 -> 1.6452810360417196 | F182: =D182+E182*H181-G181 -> -15134.851382897297 | G182: =H181 -> -14437.593130243475 | H182: =F182 -> -15134.851382897297 | I182: =G182^2+H182^2-E182*G182*H182 -> 77996103.008488536
A183: =A182+1 -> 177 | B183: =B182 -> 100 | C183: =C182 -> 9.6250000000000002E-2 | D183: =B183*SIN(2*PI()*A183*C183) -> 22.580126686911438 | E183: =E182 -> 1.6452810360417196 | F183: =D183+E183*H182-G182 -> -10440.91070666033 | G183: =H182 -> -15134.851382897297 | H183: =F183 -> -10440.91070666033 | I183: =G183^2+H183^2-E183*G183*H183 -> 78086348.603940368
A184: =A183+1 -> 178 | B184: =B183 -> 100 | C184: =C183 -> 9.6250000000000002E-2 | D184: =B184*SIN(2*PI()*A184*C184) -> 73.963109497861623 | E184: =E183 -> 1.6452810360417196 | F184: =D184+E184*H183-G183 -> -1969.4178922780338 | G184: =H183 -> -10440.91070666033 | H184: =F184 -> -1969.4178922780338 | I184: =G184^2+H184^2-E184*G184*H184 -> 79060105.002793819
A185: =A184+1 -> 179 | B185: =B184 -> 100 | C185: =C184 -> 9.6250000000000002E-2 | D185: =B185*SIN(2*PI()*A185*C185) -> 99.109974736597593 | E185: =E184 -> 1.6452810360417196 | F185: =D185+E185*H184-G184 -> 7299.774771190625 | G185: =H184 -> -1969.4178922780338 | H185: =F185 -> 7299.774771190625 | I185: =G185^2+H185^2-E185*G185*H185 -> 80818383.89231357
A186: =A185+1 -> 180 | B186: =B185 -> 100 | C186: =C185 -> 9.6250000000000002E-2 | D186: =B186*SIN(2*PI()*A186*C186) -> 89.100652418836461 | E186: =E185 -> 1.6452810360417196 | F186: =D186+E186*H185-G185 -> 14068.699543112589 | G186: =H185 -> 7299.774771190625 | H186: =F186 -> 14068.699543112589 | I186: =G186^2+H186^2-E186*G186*H186 -> 82247390.619376779
A187: =A186+1 -> 181 | B187: =B186 -> 100 | C187: =C186 -> 9.6250000000000002E-2 | D187: =B187*SIN(2*PI()*A187*C187) -> 47.485638987060177 | E187: =E186 -> 1.6452810360417196 | F187: =D187+E187*H186-G186 -> 15894.675427848384 | G187: =H186 -> 14068.699543112589 | H187: =F187 -> 15894.675427848384 | I187: =G187^2+H187^2-E187*G187*H187 -> 82655524.969088554
A188: =A187+1 -> 182 | B188: =B187 -> 100 | C188: =C187 -> 9.6250000000000002E-2 | D188: =B188*SIN(2*PI()*A188*C188) -> -10.973431109103597 | E188: =E187 -> 1.6452810360417196 | F188: =D188+E188*H187-G187 -> 12071.535081255557 | G188: =H187 -> 15894.675427848384 | H188: =F188 -> 12071.535081255557 | I188: =G188^2+H188^2-E188*G188*H188 -> 82677440.715724289
A189: =A188+1 -> 183 | B189: =B188 -> 100 | C189: =C188 -> 9.6250000000000002E-2 | D189: =B189*SIN(2*PI()*A189*C189) -> -65.540017091178598 | E189: =E188 -> 1.6452810360417196 | F189: =D189+E189*H188-G188 -> 3900.8523001625454 | G189: =H188 -> 12071.535081255557 | H189: =F189 -> 3900.8523001625454 | I189: =G189^2+H189^2-E189*G189*H189 -> 83463516.088501334
A190: =A189+1 -> 184 | B190: =B189 -> 100 | C190: =C189 -> 9.6250000000000002E-2 | D190: =B190*SIN(2*PI()*A190*C190) -> -96.858316112862823 | E190: =E189 -> 1.6452810360417196 | F190: =D190+E190*H189-G189 -> -5750.3950835112619 | G190: =H189 -> 3900.8523001625454 | H190: =F190 -> -5750.3950835112619 | I190: =G190^2+H190^2-E190*G190*H190 -> 85189718.234141678
A191: =A190+1 -> 185 | B191: =B190 -> 100 | C191: =C190 -> 9.6250000000000002E-2 | D191: =B191*SIN(2*PI()*A191*C191) -> -93.819133592248861 | E191: =E190 -> 1.6452810360417196 | F191: =D191+E191*H190-G190 -> -13455.687414403414 | G191: =H190 -> -5750.3950835112619 | H191: =F191 -> -13455.687414403414 | I191: =G191^2+H191^2-E191*G191*H191 -> 86818093.752321705
A192: =A191+1 -> 186 | B192: =B191 -> 100 | C192: =C191 -> 9.6250000000000002E-2 | D192: =B192*SIN(2*PI()*A192*C192) -> -57.500525204329023 | E192: =E191 -> 1.6452810360417196 | F192: =D192+E192*H191-G191 -> -16445.492771516245 | G192: =H191 -> -13455.687414403414 | H192: =F192 -> -16445.492771516245 | I192: =G192^2+H192^2-E192*G192*H192 -> 87433067.486493587
A193: =A192+1 -> 187 | B193: =B192 -> 100 | C193: =C192 -> 9.6250000000000002E-2 | D193: =B193*SIN(2*PI()*A193*C193) -> -0.78539008886983808 | E193: =E192 -> 1.6452810360417196 | F193: =D193+E193*H192-G192 -> -13602.555361022312 | G193: =H192 -> -16445.492771516245 | H193: =F193 -> -13602.555361022312 | I193: =G193^2+H193^2-E193*G193*H193 -> 87433182.835123301
A194: =A193+1 -> 188 | B194: =B193 -> 100 | C194: =C193 -> 9.6250000000000002E-2 | D194: =B194*SIN(2*PI()*A194*C194) -> 56.208337785214034 | E194: =E193 -> 1.6452810360417196 | F194: =D194+E194*H193-G193 -> -5878.3252678961799 | G194: =H193 -> -13602.555361022312 | H194: =F194 -> -5878.3252678961799 | I194: =G194^2+H194^2-E194*G194*H194 -> 88027145.755599663
A195: =A194+1 -> 189 | B195: =B194 -> 100 | C195: =C194 -> 9.6250000000000002E-2 | D195: =B195*SIN(2*PI()*A195*C195) -> 93.263902314309789 | E195: =E194 -> 1.6452810360417196 | F195: =D195+E195*H194-G194 -> 4024.3221763821766 | G195: =H194 -> -5878.3252678961799 | H195: =F195 -> 4024.3221763821766 | I195: =G195^2+H195^2-E195*G195*H195 -> 89671097.140354455
A196: =A195+1 -> 190 | B196: =B195 -> 100 | C196: =C195 -> 9.6250000000000002E-2 | D196: =B196*SIN(2*PI()*A196*C196) -> 97.236992039767443 | E196: =E195 -> 1.6452810360417196 | F196: =D196+E196*H195-G195 -> 12596.703219659683 | G196: =H195 -> 4024.3221763821766 | H196: =F196 -> 12596.703219659683 | I196: =G196^2+H196^2-E196*G196*H196 -> 91467553.338333443
A197: =A196+1 -> 191 | B197: =B196 -> 100 | C197: =C196 -> 9.6250000000000002E-2 | D197: =B197*SIN(2*PI()*A197*C197) -> 66.718276690460414 | E197: =E196 -> 1.6452810360417196 | F197: =D197+E197*H196-G196 -> 16767.513024260028 | G197: =H196 -> 12596.703219659683 | H197: =F197 -> 16767.513024260028 | I197: =G197^2+H197^2-E197*G197*H197 -> 92317757.071241438
A198: =A197+1 -> 192 | B198: =B197 -> 100 | C198: =C197 -> 9.6250000000000002E-2 | D198: =B198*SIN(2*PI()*A198*C198) -> 12.533323356431156 | E198: =E197 -> 1.6452810360417196 | F198: =D198+E198*H197-G197 -> 15003.101304094313 | G198: =H197 -> 16767.513024260028 | H198: =F198 -> 15003.101304094313 | I198: =G198^2+H198^2-E198*G198*H198 -> 92347917.23655802
A199: =A198+1 -> 193 | B199: =B198 -> 100 | C199: =C198 -> 9.6250000000000002E-2 | D199: =B199*SIN(2*PI()*A199*C199) -> -46.097437453545467 | E199: =E198 -> 1.6452810360417196 | F199: =D199+E199*H198-G198 -> 7870.7075957255911 | G199: =H198 -> 15003.101304094313 | H199: =F199 -> 7870.7075957255911 | I199: =G199^2+H199^2-E199*G199*H199 -> 92758037.168336183
A200: =A199+1 -> 194 | B200: =B199 -> 100 | C200: =C199 -> 9.6250000000000002E-2 | D200: =B200*SIN(2*PI()*A200*C200) -> -88.376563008868885 | E200: =E199 -> 1.6452810360417196 | F200: =D200+E200*H199-G199 -> -2141.95191962635 | G200: =H199 -> 7870.7075957255911 | H200: =F200 -> -2141.95191962635 | I200: =G200^2+H200^2-E200*G200*H200 -> 94273258.044852749
A201: =A200+1 -> 195 | B201: =B200 -> 100 | C201: =C200 -> 9.6250000000000002E-2 | D201: =B201*SIN(2*PI()*A201*C201) -> -99.306845695492768 | E201: =E200 -> 1.6452810360417196 | F201: =D201+E201*H200-G200 -> -11494.127314895475 | G201: =H200 -> -2141.95191962635 | H201: =F201 -> -11494.127314895475 | I201: =G201^2+H201^2-E201*G201*H201 -> 96196318.717240483
A202: =A201+1 -> 196 | B202: =B201 -> 100 | C202: =C201 -> 9.6250000000000002E-2 | D202: =B202*SIN(2*PI()*A202*C202) -> -75.011106963046771 | E202: =E201 -> 1.6452810360417196 | F202: =D202+E202*H201-G201 -> -16844.128884383354 | G202: =H201 -> -11494.127314895475 | H202: =F202 -> -16844.128884383354 | I202: =G202^2+H202^2-E202*G202*H202 -> 97299145.286133528
A203: =A202+1 -> 197 | B203: =B202 -> 100 | C203: =C202 -> 9.6250000000000002E-2 | D203: =B203*SIN(2*PI()*A203*C203) -> -24.107506083305175 | E203: =E202 -> 1.6452810360417196 | F203: =D203+E203*H202-G202 -> -16243.30601330633 | G203: =H202 -> -16844.128884383354 | H203: =F203 -> -16243.30601330633 | I203: =G203^2+H203^2-E203*G203*H203 -> 97413636.140496194
A204: =A203+1 -> 198 | B204: =B203 -> 100 | C204: =C203 -> 9.6250000000000002E-2 | D204: =B204*SIN(2*PI()*A204*C204) -> 35.347484377926996 | E204: =E203 -> 1.6452810360417196 | F204: =D204+E204*H203-G203 -> -9845.3269775540539 | G204: =H203 -> -16243.30601330633 | H204: =F204 -> -9845.3269775540539 | I204: =G204^2+H204^2-E204*G204*H204 -> 97661026.181562066
A205: =A204+1 -> 199 | B205: =B204 -> 100 | C205: =C204 -> 9.6250000000000002E-2 | D205: =B205*SIN(2*PI()*A205*C205) -> 82.264051802086698 | E205: =E204 -> 1.6452810360417196 | F205: =D205+E205*H204-G204 -> 127.24029530879125 | G205: =H204 -> -9845.3269775540539 | H205: =F205 -> 127.24029530879125 | I205: =G205^2+H205^2-E205*G205*H205 -> 99007733.651122406
A206: =A205+1 -> 200 | B206: =B205 -> 100 | C206: =C205 -> 9.6250000000000002E-2 | D206: =B206*SIN(2*PI()*A206*C206) -> 100.00 | E206: =E205 -> 1.6452810360417196 | F206: =D206+E206*H205-G205 -> 10154.673022445957 | G206: =H205 -> 127.24029530879125 | H206: =F206 -> 10154.673022445957 | I206: =G206^2+H206^2-E206*G206*H206 -> 101007733.65112242
A207: =A206+1 -> 201 | B207: =B206 -> 100 | C207: =C206 -> 9.6250000000000002E-2 | D207: =B207*SIN(2*PI()*A207*C207) -> 82.264051802086215 | E207: =E206 -> 1.6452810360417196 | F207: =D207+E207*H206-G206 -> 16662.314707528079 | G207: =H206 -> 10154.673022445957 | H207: =F207 -> 16662.314707528079 | I207: =G207^2+H207^2-E207*G207*H207 -> 102367975.86912054
A208: =A207+1 -> 202 | B208: =B207 -> 100 | C208: =C207 -> 9.6250000000000002E-2 | D208: =B208*SIN(2*PI()*A208*C208) -> 35.347484377926214 | E208: =E207 -> 1.6452810360417196 | F208: =D208+E208*H207-G207 -> 17294.864866786949 | G208: =H207 -> 16662.314707528079 | H208: =F208 -> 17294.864866786949 | I208: =G208^2+H208^2-E208*G208*H208 -> 102620363.68879384
A209: =A208+1 -> 203 | B209: =B208 -> 100 | C209: =C208 -> 9.6250000000000002E-2 | D209: =B209*SIN(2*PI()*A209*C209) -> -24.107506083303225 | E209: =E208 -> 1.6452810360417196 | F209: =D209+E209*H208-G208 -> 11768.490972617386 | G209: =H208 -> 17294.864866786949 | H209: =F209 -> 11768.490972617386 | I209: =G209^2+H209^2-E209*G209*H209 -> 102738341.5742538
A210: =A209+1 -> 204 | B210: =B209 -> 100 | C210: =C209 -> 9.6250000000000002E-2 | D210: =B210*SIN(2*PI()*A210*C210) -> -75.011106963045435 | E210: =E209 -> 1.6452810360417196 | F210: =D210+E210*H209-G209 -> 1992.5990463255657 | G210: =H209 -> 11768.490972617386 | H210: =F210 -> 1992.5990463255657 | I210: =G210^2+H210^2-E210*G210*H210 -> 103886181.47248933
A211: =A210+1 -> 205 | B211: =B210 -> 100 | C211: =C210 -> 9.6250000000000002E-2 | D211: =B211*SIN(2*PI()*A211*C211) -> -99.306845695492513 | E211: =E210 -> 1.6452810360417196 | F211: =D211+E211*H210-G210 -> -8589.4123949586101 | G211: =H210 -> 1992.5990463255657 | H211: =F211 -> -8589.4123949586101 | I211: =G211^2+H211^2-E211*G211*H211 -> 105907860.64089695
A212: =A211+1 -> 206 | B212: =B211 -> 100 | C212: =C211 -> 9.6250000000000002E-2 | D212: =B212*SIN(2*PI()*A212*C212) -> -88.376563008869823 | E212: =E211 -> 1.6452810360417196 | F212: =D212+E212*H211-G211 -> -16212.972933501525 | G212: =H211 -> -8589.4123949586101 | H212: =F212 -> -16212.972933501525 | I212: =G212^2+H212^2-E212*G212*H212 -> 107516806.52008465
A213: =A212+1 -> 207 | B213: =B212 -> 100 | C213: =C212 -> 9.6250000000000002E-2 | D213: =B213*SIN(2*PI()*A213*C213) -> -46.097437453547258 | E213: =E212 -> 1.6452810360417196 | F213: =D213+E213*H212-G212 -> -18131.581947842686 | G213: =H212 -> -16212.972933501525 | H213: =F213 -> -18131.581947842686 | I213: =G213^2+H213^2-E213*G213*H213 -> 107956676.08421975