B1: ToneFrequncy | C1: SamplingRate | D1: k | E1: Amplitude | F1: Initial impulse
B2: 770.00 | C2: 8000.00 | D2: =2*COS(2*PI()*B2/C2) -> 1.6452810360417196 | E2: 1.00 | F2: =-E2*SIN(2*PI()*B2/C2) -> -0.56856185073426391
A4: Sample # | B4: k | C4: X1 | D4: X2 | E4: X0
A5: 1 | B5: =D2 -> 1.6452810360417196 | C5: 0.00 | D5: =F2 -> -0.56856185073426391 | E5: =B5*C5-D5 -> 0.56856185073426391
A6: 2 | B6: =B5 -> 1.6452810360417196 | C6: =E5 -> 0.56856185073426391 | D6: =C5 -> 0.00 | E6: =B6*C6-D6 -> 0.93544403082986727
A7: 3 | B7: =B6 -> 1.6452810360417196 | C7: =E6 -> 0.93544403082986727 | D7: =C6 -> 0.56856185073426391 | E7: =B7*C7-D7 -> 0.97050647346854235
A8: 4 | B8: =B7 -> 1.6452810360417196 | C8: =E7 -> 0.97050647346854235 | D8: =C7 -> 0.93544403082986727 | E8: =B8*C8-D8 -> 0.66131186532365183
A9: 5 | B9: =B8 -> 1.6452810360417196 | C9: =E8 -> 0.66131186532365183 | D9: =C8 -> 0.97050647346854235 | E9: =B9*C9-D9 -> 0.11753739745783764
A10: 6 | B10: =B9 -> 1.6452810360417196 | C10: =E9 -> 0.11753739745783764 | D10: =C9 -> 0.66131186532365183 | E10: =B10*C10-D10 -> -0.46792981426057334
A11: 7 | B11: =B10 -> 1.6452810360417196 | C11: =E10 -> -0.46792981426057334 | D11: =C10 -> 0.11753739745783764 | E11: =B11*C11-D11 -> -0.88741344705928316
A12: 8 | B12: =B11 -> 1.6452810360417196 | C12: =E11 -> -0.88741344705928316 | D12: =C11 -> -0.46792981426057334 | E12: =B12*C12-D12 -> -0.99211470131447765
A13: 9 | B13: =B12 -> 1.6452810360417196 | C13: =E12 -> -0.99211470131447765 | D13: =C12 -> -0.88741344705928316 | E13: =B13*C13-D13 -> -0.74489405659162178
A14: 10 | B14: =B13 -> 1.6452810360417196 | C14: =E13 -> -0.74489405659162178 | D14: =C13 -> -0.99211470131447765 | E14: =B14*C14-D14 -> -0.2334453638559052
A15: 11 | B15: =B14 -> 1.6452810360417196 | C15: =E14 -> -0.2334453638559052 | D15: =C14 -> -0.74489405659162178 | E15: =B15*C15-D15 -> 0.3608108264876419
A16: 12 | B16: =B15 -> 1.6452810360417196 | C16: =E15 -> 0.3608108264876419 | D16: =C15 -> -0.2334453638559052 | E16: =B16*C16-D16 -> 0.82708057427456183
A17: 13 | B17: =B16 -> 1.6452810360417196 | C17: =E16 -> 0.82708057427456183 | D17: =C16 -> 0.3608108264876419 | E17: =B17*C17-D17 -> 0.99996915764478955
A18: 14 | B18: =B17 -> 1.6452810360417196 | C18: =E17 -> 0.99996915764478955 | D18: =C17 -> 0.82708057427456183 | E18: =B18*C18-D18 -> 0.81814971742502307
A19: 15 | B19: =B18 -> 1.6452810360417196 | C19: =E18 -> 0.81814971742502307 | D19: =C18 -> 0.99996915764478955 | E19: =B19*C19-D19 -> 0.34611705707749252
A20: 16 | B20: =B19 -> 1.6452810360417196 | C20: =E19 -> 0.34611705707749252 | D20: =C19 -> 0.81814971742502307 | E20: =B20*C20-D20 -> -0.24868988716485518
A21: 17 | B21: =B20 -> 1.6452810360417196 | C21: =E20 -> -0.24868988716485518 | D21: =C20 -> 0.34611705707749252 | E21: =B21*C21-D21 -> -0.75528181228518387
A22: 18 | B22: =B21 -> 1.6452810360417196 | C22: =E21 -> -0.75528181228518387 | D22: =C21 -> -0.24868988716485518 | E22: =B22*C22-D22 -> -0.99396095545517971
A23: 19 | B23: =B22 -> 1.6452810360417196 | C23: =E22 -> -0.99396095545517971 | D23: =C22 -> -0.75528181228518387 | E23: =B23*C23-D23 -> -0.88006329829113161
A24: 20 | B24: =B23 -> 1.6452810360417196 | C24: =E23 -> -0.88006329829113161 | D24: =C23 -> -0.99396095545517971 | E24: =B24*C24-D24 -> -0.45399049973954619
A25: 21 | B25: =B24 -> 1.6452810360417196 | C25: =E24 -> -0.45399049973954619 | D25: =C24 -> -0.88006329829113161 | E25: =B25*C25-D25 -> 0.13312133852655306
A26: 22 | B26: =B25 -> 1.6452810360417196 | C26: =E25 -> 0.13312133852655306 | D26: =C25 -> -0.45399049973954619 | E26: =B26*C26-D26 -> 0.67301251350977387
A27: 23 | B27: =B26 -> 1.6452810360417196 | C27: =E26 -> 0.67301251350977387 | D27: =C26 -> 0.13312133852655306 | E27: =B27*C27-D27 -> 0.97417338696984945
A28: 24 | B28: =B27 -> 1.6452810360417196 | C28: =E27 -> 0.97417338696984945 | D28: =C27 -> 0.67301251350977387 | E28: =B28*C28-D28 -> 0.92977648588825101
A29: 25 | B29: =B28 -> 1.6452810360417196 | C29: =E28 -> 0.92977648588825101 | D29: =C28 -> 0.97417338696984945 | E29: =B29*C29-D29 -> 0.55557023301960151
A30: 26 | B30: =B29 -> 1.6452810360417196 | C30: =E29 -> 0.55557023301960151 | D30: =C29 -> 0.92977648588825101 | E30: =B30*C30-D30 -> -1.5707317311821511E-2
A31: 27 | B31: =B30 -> 1.6452810360417196 | C31: =E30 -> -1.5707317311821511E-2 | D31: =C30 -> 0.55557023301960151 | E31: =B31*C31-D31 -> -0.58141318431983124
A32: 28 | B32: =B31 -> 1.6452810360417196 | C32: =E31 -> -0.58141318431983124 | D32: =C31 -> -1.5707317311821511E-2 | E32: =B32*C32-D32 -> -0.94088076895422568
A33: 29 | B33: =B32 -> 1.6452810360417196 | C33: =E32 -> -0.94088076895422568 | D33: =C32 -> -0.58141318431983124 | E33: =B33*C33-D33 -> -0.96660010201690694
A34: 30 | B34: =B33 -> 1.6452810360417196 | C34: =E33 -> -0.96660010201690694 | D34: =C33 -> -0.94088076895422568 | E34: =B34*C34-D34 -> -0.64944804833018288
A35: 31 | B35: =B34 -> 1.6452810360417196 | C35: =E34 -> -0.64944804833018288 | D35: =C34 -> -0.96660010201690694 | E35: =B35*C35-D35 -> -0.10192445579504905
A36: 32 | B36: =B35 -> 1.6452810360417196 | C36: =E35 -> -0.10192445579504905 | D36: =C35 -> -0.64944804833018288 | E36: =B36*C36-D36 -> 0.4817536741017161
A37: 33 | B37: =B36 -> 1.6452810360417196 | C37: =E36 -> 0.4817536741017161 | D37: =C36 -> -0.10192445579504905 | E37: =B37*C37-D37 -> 0.89454463983802546
A38: 34 | B38: =B37 -> 1.6452810360417196 | C38: =E37 -> 0.89454463983802546 | D38: =C37 -> 0.4817536741017161 | E38: =B38*C38-D38 -> 0.99002365771655731
A39: 35 | B39: =B38 -> 1.6452810360417196 | C39: =E38 -> 0.99002365771655731 | D39: =C38 -> 0.89454463983802546 | E39: =B39*C39-D39 -> 0.73432250943568467
A40: 36 | B40: =B39 -> 1.6452810360417196 | C40: =E39 -> 0.73432250943568467 | D40: =C39 -> 0.99002365771655731 | E40: =B40*C40-D40 -> 0.2181432413965414
A41: 37 | B41: =B40 -> 1.6452810360417196 | C41: =E40 -> 0.2181432413965414 | D41: =C40 -> 0.73432250943568467 | E41: =B41*C41-D41 -> -0.37541557122528407
A42: 38 | B42: =B41 -> 1.6452810360417196 | C42: =E41 -> -0.37541557122528407 | D42: =C41 -> 0.2181432413965414 | E42: =B42*C42-D42 -> -0.83580736136827072
A43: 39 | B43: =B42 -> 1.6452810360417196 | C43: =E42 -> -0.83580736136827072 | D43: =C42 -> -0.37541557122528407 | E43: =B43*C43-D43 -> -0.99972243021800034
A44: 40 | B44: =B43 -> 1.6452810360417196 | C44: =E43 -> -0.99972243021800034 | D44: =C43 -> -0.83580736136827072 | E44: =B44*C44-D44 -> -0.80901699437494667
A45: 41 | B45: =B44 -> 1.6452810360417196 | C45: =E44 -> -0.80901699437494667 | D45: =C44 -> -0.99972243021800034 | E45: =B45*C45-D45 -> -0.33133788846256995