B1: ToneFrequncy | C1: SamplingRate | E1: k | F1: Amplitude | G1: Initial impulse
A2: Decimal Representation | B2: 770.00 | C2: 8000.00 | E2: =2*COS(2*PI()*B2/C2) -> 1.6452810360417196 | F2: 256.00 | G2: =ROUND(-F2*SIN(2*PI()*B2/C2),0) -> -146.00
A3: Hex Representation | E3: =DEC2HEX(E2*2^8) -> 1A5 | G3: =DEC2HEX(G2) -> FFFFFFFF6E
A5: Sample # | B5: k | C5: X1 | E5: X2 | F5: X0 | G5: Hex | H5: MAXQ Result (Hex) | I5: MAXQ Result (Dec)
A6: 1 | B6: =E2 -> 1.6452810360417196 | C6: 0.00 | D6: =DEC2HEX(B6*C6) -> 0 | E6: =G2 -> -146.00 | F6: =B6*C6-E6 -> 146.00 | G6: =DEC2HEX(F6) -> 92 | H6: 0000000092 | I6: =HEX2DEC(H6) -> 146
A7: 2 | B7: =B6 -> 1.6452810360417196 | C7: =F6 -> 146.00 | D7: =DEC2HEX(B7*C7) -> F0 | E7: =C6 -> 0.00 | F7: =B7*C7-E7 -> 240.21103126209107 | G7: =DEC2HEX(F7) -> F0 | H7: 00000000F0 | I7: =HEX2DEC(H7) -> 240
A8: 3 | B8: =B7 -> 1.6452810360417196 | C8: =F7 -> 240.21103126209107 | D8: =DEC2HEX(B8*C8) -> 18B | E8: =C7 -> 146.00 | F8: =B8*C8-E8 -> 249.21465438354306 | G8: =DEC2HEX(F8) -> F9 | H8: 00000000F8 | I8: =HEX2DEC(H8) -> 248
A9: 4 | B9: =B8 -> 1.6452810360417196 | C9: =F8 -> 249.21465438354306 | D9: =DEC2HEX(B9*C9) -> 19A | E9: =C8 -> 240.21103126209107 | F9: =B9*C9-E9 -> 169.81711349884375 | G9: =DEC2HEX(F9) -> A9 | H9: 00000000A7 | I9: =HEX2DEC(H9) -> 167
A10: 5 | B10: =B9 -> 1.6452810360417196 | C10: =F9 -> 169.81711349884375 | D10: =DEC2HEX(B10*C10) -> 117 | E10: =C9 -> 249.21465438354306 | F10: =B10*C10-E10 -> 30.182222051448889 | G10: =DEC2HEX(F10) -> 1E | H10: 000000001A | I10: =HEX2DEC(H10) -> 26
A11: 6 | B11: =B10 -> 1.6452810360417196 | C11: =F10 -> 30.182222051448889 | D11: =DEC2HEX(B11*C11) -> 31 | E11: =C10 -> 169.81711349884375 | F11: =B11*C11-E11 -> -120.15887593199469 | G11: =DEC2HEX(F11) -> FFFFFFFF88 | H11: FFFFFFFF83 | I11: =HEX2DEC(H11) -> -125
A12: 7 | B12: =B11 -> 1.6452810360417196 | C12: =F11 -> -120.15887593199469 | D12: =DEC2HEX(B12*C12) -> FFFFFFFF3B | E12: =C11 -> 30.182222051448889 | F12: =B12*C12-E12 -> -227.87734193444956 | G12: =DEC2HEX(F12) -> FFFFFFFF1D | H12: FFFFFFFF18 | I12: =HEX2DEC(H12) -> -232
A13: 8 | B13: =B12 -> 1.6452810360417196 | C13: =F12 -> -227.87734193444956 | D13: =DEC2HEX(B13*C13) -> FFFFFFFE8A | E13: =C12 -> -120.15887593199469 | F13: =B13*C13-E13 -> -254.76339329634968 | G13: =DEC2HEX(F13) -> FFFFFFFF02 | H13: FFFFFFFEFF | I13: =HEX2DEC(H13) -> -257
A14: 9 | B14: =B13 -> 1.6452810360417196 | C14: =F13 -> -254.76339329634968 | D14: =DEC2HEX(B14*C14) -> FFFFFFFE5D | E14: =C13 -> -227.87734193444956 | F14: =B14*C14-E14 -> -191.28003773367274 | G14: =DEC2HEX(F14) -> FFFFFFFF41 | H14: FFFFFFFF41 | I14: =HEX2DEC(H14) -> -191
A15: 10 | B15: =B14 -> 1.6452810360417196 | C15: =F14 -> -191.28003773367274 | D15: =DEC2HEX(B15*C15) -> FFFFFFFEC6 | E15: =C14 -> -254.76339329634968 | F15: =B15*C15-E15 -> -59.946025360206619 | G15: =DEC2HEX(F15) -> FFFFFFFFC5 | H15: FFFFFFFFC6 | I15: =HEX2DEC(H15) -> -58
A16: 11 | B16: =B15 -> 1.6452810360417196 | C16: =F15 -> -59.946025360206619 | D16: =DEC2HEX(B16*C16) -> FFFFFFFF9E | E16: =C15 -> -191.28003773367274 | F16: =B16*C16-E16 -> 92.651979022448799 | G16: =DEC2HEX(F16) -> 5C | H16: 000000005F | I16: =HEX2DEC(H16) -> 95
A17: 12 | B17: =B16 -> 1.6452810360417196 | C17: =F16 -> 92.651979022448799 | D17: =DEC2HEX(B17*C17) -> 98 | E17: =C16 -> -59.946025360206619 | F17: =B17*C17-E17 -> 212.38456939757685 | G17: =DEC2HEX(F17) -> D4 | H17: 00000000D6 | I17: =HEX2DEC(H17) -> 214
A18: 13 | B18: =B17 -> 1.6452810360417196 | C18: =F17 -> 212.38456939757685 | D18: =DEC2HEX(B18*C18) -> 15D | E18: =C17 -> 92.651979022448799 | F18: =B18*C18-E18 -> 256.78032535527092 | G18: =DEC2HEX(F18) -> 100 | H18: 0000000100 | I18: =HEX2DEC(H18) -> 256
A19: 14 | B19: =B18 -> 1.6452810360417196 | C19: =F18 -> 256.78032535527092 | D19: =DEC2HEX(B19*C19) -> 1A6 | E19: =C18 -> 212.38456939757685 | F19: =B19*C19-E19 -> 210.0912303380731 | G19: =DEC2HEX(F19) -> D2 | H19: 00000000CF | I19: =HEX2DEC(H19) -> 207
A20: 15 | B20: =B19 -> 1.6452810360417196 | C20: =F19 -> 210.0912303380731 | D20: =DEC2HEX(B20*C20) -> 159 | E20: =C19 -> 256.78032535527092 | F20: =B20*C20-E20 -> 88.878791758633554 | G20: =DEC2HEX(F20) -> 58 | H20: 0000000054 | I20: =HEX2DEC(H20) -> 84
A21: 16 | B21: =B20 -> 1.6452810360417196 | C21: =F20 -> 88.878791758633554 | D21: =DEC2HEX(B21*C21) -> 92 | E21: =C20 -> 210.0912303380731 | F21: =B21*C21-E21 -> -63.86063975129224 | G21: =DEC2HEX(F21) -> FFFFFFFFC1 | H21: FFFFFFFFBB | I21: =HEX2DEC(H21) -> -69
A22: 17 | B22: =B21 -> 1.6452810360417196 | C22: =F21 -> -63.86063975129224 | D22: =DEC2HEX(B22*C22) -> FFFFFFFF97 | E22: =C21 -> 88.878791758633554 | F22: =B22*C22-E22 -> -193.94749129092668 | G22: =DEC2HEX(F22) -> FFFFFFFF3F | H22: FFFFFFFF3A | I22: =HEX2DEC(H22) -> -198
A23: 18 | B23: =B22 -> 1.6452810360417196 | C23: =F22 -> -193.94749129092668 | D23: =DEC2HEX(B23*C23) -> FFFFFFFEC1 | E23: =C22 -> -63.86063975129224 | F23: =B23*C23-E23 -> -255.237489657536 | G23: =DEC2HEX(F23) -> FFFFFFFF01 | H23: FFFFFFFEFF | I23: =HEX2DEC(H23) -> -257
A24: 19 | B24: =B23 -> 1.6452810360417196 | C24: =F23 -> -255.237489657536 | D24: =DEC2HEX(B24*C24) -> FFFFFFFE5D | E24: =C23 -> -193.94749129092668 | F24: =B24*C24-E24 -> -225.98991012951183 | G24: =DEC2HEX(F24) -> FFFFFFFF1F | H24: FFFFFFFF1F | I24: =HEX2DEC(H24) -> -225
A25: 20 | B25: =B24 -> 1.6452810360417196 | C25: =F24 -> -225.98991012951183 | D25: =DEC2HEX(B25*C25) -> FFFFFFFE8D | E25: =C24 -> -255.237489657536 | F25: =B25*C25-E25 -> -116.57942381532234 | G25: =DEC2HEX(F25) -> FFFFFFFF8C | H25: FFFFFFFF8E | I25: =HEX2DEC(H25) -> -114
A26: 21 | B26: =B25 -> 1.6452810360417196 | C26: =F25 -> -116.57942381532234 | D26: =DEC2HEX(B26*C26) -> FFFFFFFF41 | E26: =C25 -> -225.98991012951183 | F26: =B26*C26-E26 -> 34.183994933491562 | G26: =DEC2HEX(F26) -> 22 | H26: 0000000025 | I26: =HEX2DEC(H26) -> 37
A27: 22 | B27: =B26 -> 1.6452810360417196 | C27: =F26 -> 34.183994933491562 | D27: =DEC2HEX(B27*C27) -> 38 | E27: =C26 -> -116.57942381532234 | F27: =B27*C27-E27 -> 172.82170241554223 | G27: =DEC2HEX(F27) -> AC | H27: 00000000AE | I27: =HEX2DEC(H27) -> 174
A28: 23 | B28: =B27 -> 1.6452810360417196 | C28: =F27 -> 172.82170241554223 | D28: =DEC2HEX(B28*C28) -> 11C | E28: =C27 -> 34.183994933491562 | F28: =B28*C28-E28 -> 250.15627466724553 | G28: =DEC2HEX(F28) -> FA | H28: 00000000F9 | I28: =HEX2DEC(H28) -> 249
A29: 24 | B29: =B28 -> 1.6452810360417196 | C29: =F28 -> 250.15627466724553 | D29: =DEC2HEX(B29*C29) -> 19B | E29: =C28 -> 172.82170241554223 | F29: =B29*C29-E29 -> 238.75567234132046 | G29: =DEC2HEX(F29) -> EE | H29: 00000000EB | I29: =HEX2DEC(H29) -> 235
A30: 25 | B30: =B29 -> 1.6452810360417196 | C30: =F29 -> 238.75567234132046 | D30: =DEC2HEX(B30*C30) -> 188 | E30: =C29 -> 250.15627466724553 | F30: =B30*C30-E30 -> 142.66390528331956 | G30: =DEC2HEX(F30) -> 8E | H30: 0000000089 | I30: =HEX2DEC(H30) -> 137
A31: 26 | B31: =B30 -> 1.6452810360417196 | C31: =F30 -> 142.66390528331956 | D31: =DEC2HEX(B31*C31) -> EA | E31: =C30 -> 238.75567234132046 | F31: =B31*C31-E31 -> -4.033454451022692 | G31: =DEC2HEX(F31) -> FFFFFFFFFC | H31: FFFFFFFFF6 | I31: =HEX2DEC(H31) -> -10
A32: 27 | B32: =B31 -> 1.6452810360417196 | C32: =F31 -> -4.033454451022692 | D32: =DEC2HEX(B32*C32) -> FFFFFFFFFA | E32: =C31 -> 142.66390528331956 | F32: =B32*C32-E32 -> -149.30007140132525 | G32: =DEC2HEX(F32) -> FFFFFFFF6B | H32: FFFFFFFF66 | I32: =HEX2DEC(H32) -> -154
A33: 28 | B33: =B32 -> 1.6452810360417196 | C33: =F32 -> -149.30007140132525 | D33: =DEC2HEX(B33*C33) -> FFFFFFFF0B | E33: =C32 -> -4.033454451022692 | F33: =B33*C33-E33 -> -241.60712170525244 | G33: =DEC2HEX(F33) -> FFFFFFFF0F | H33: FFFFFFFF0C | I33: =HEX2DEC(H33) -> -244
A34: 29 | B34: =B33 -> 1.6452810360417196 | C34: =F33 -> -241.60712170525244 | D34: =DEC2HEX(B34*C34) -> FFFFFFFE73 | E34: =C33 -> -149.30007140132525 | F34: =B34*C34-E34 -> -248.21154411295029 | G34: =DEC2HEX(F34) -> FFFFFFFF08 | H34: FFFFFFFF08 | I34: =HEX2DEC(H34) -> -248
A35: 30 | B35: =B34 -> 1.6452810360417196 | C35: =F34 -> -248.21154411295029 | D35: =DEC2HEX(B35*C35) -> FFFFFFFE68 | E35: =C34 -> -241.60712170525244 | F35: =B35*C35-E35 -> -166.77062475041743 | G35: =DEC2HEX(F35) -> FFFFFFFF5A | H35: FFFFFFFF5C | I35: =HEX2DEC(H35) -> -164
A36: 31 | B36: =B35 -> 1.6452810360417196 | C36: =F35 -> -166.77062475041743 | D36: =DEC2HEX(B36*C36) -> FFFFFFFEEE | E36: =C35 -> -248.21154411295029 | F36: =B36*C36-E36 -> -26.173002157741308 | G36: =DEC2HEX(F36) -> FFFFFFFFE6 | H36: FFFFFFFFEA | I36: =HEX2DEC(H36) -> -22
A37: 32 | B37: =B36 -> 1.6452810360417196 | C37: =F36 -> -26.173002157741308 | D37: =DEC2HEX(B37*C37) -> FFFFFFFFD5 | E37: =C36 -> -166.77062475041743 | F37: =B37*C37-E37 -> 123.70868064400665 | G37: =DEC2HEX(F37) -> 7B | H37: 000000007F | I37: =HEX2DEC(H37) -> 127
A38: 33 | B38: =B37 -> 1.6452810360417196 | C38: =F37 -> 123.70868064400665 | D38: =DEC2HEX(B38*C38) -> CB | E38: =C37 -> -26.173002157741308 | F38: =B38*C38-E38 -> 229.70854841506679 | G38: =DEC2HEX(F38) -> E5 | H38: 00000000E6 | I38: =HEX2DEC(H38) -> 230
A39: 34 | B39: =B38 -> 1.6452810360417196 | C39: =F38 -> 229.70854841506679 | D39: =DEC2HEX(B39*C39) -> 179 | E39: =C38 -> 123.70868064400665 | F39: =B39*C39-E39 -> 254.22643787997393 | G39: =DEC2HEX(F39) -> FE | H39: 00000000FB | I39: =HEX2DEC(H39) -> 251
A40: 35 | B40: =B39 -> 1.6452810360417196 | C40: =F39 -> 254.22643787997393 | D40: =DEC2HEX(B40*C40) -> 1A2 | E40: =C39 -> 229.70854841506679 | F40: =B40*C40-E40 -> 188.5653886892926 | G40: =DEC2HEX(F40) -> BC | H40: 00000000B6 | I40: =HEX2DEC(H40) -> 182
A41: 36 | B41: =B40 -> 1.6452810360417196 | C41: =F40 -> 188.5653886892926 | D41: =DEC2HEX(B41*C41) -> 136 | E41: =C40 -> 254.22643787997393 | F41: =B41*C41-E41 -> 56.016620184354935 | G41: =DEC2HEX(F41) -> 38 | H41: 0000000030 | I41: =HEX2DEC(H41) -> 48
A42: 37 | B42: =B41 -> 1.6452810360417196 | C42: =F41 -> 56.016620184354935 | D42: =DEC2HEX(B42*C42) -> 5C | E42: =C41 -> 188.5653886892926 | F42: =B42*C42-E42 -> -96.402305796821622 | G42: =DEC2HEX(F42) -> FFFFFFFFA0 | H42: FFFFFFFF98 | I42: =HEX2DEC(H42) -> -104
A43: 38 | B43: =B42 -> 1.6452810360417196 | C43: =F42 -> -96.402305796821622 | D43: =DEC2HEX(B43*C43) -> FFFFFFFF62 | E43: =C42 -> 56.016620184354935 | F43: =B43*C43-E43 -> -214.62550574256028 | G43: =DEC2HEX(F43) -> FFFFFFFF2A | H43: FFFFFFFF24 | I43: =HEX2DEC(H43) -> -220
A44: 39 | B44: =B43 -> 1.6452810360417196 | C44: =F43 -> -214.62550574256028 | D44: =DEC2HEX(B44*C44) -> FFFFFFFE9F | E44: =C43 -> -96.402305796821622 | F44: =B44*C44-E44 -> -256.71696865227597 | G44: =DEC2HEX(F44) -> FFFFFFFF00 | H44: FFFFFFFEFE | I44: =HEX2DEC(H44) -> -258
A45: 40 | B45: =B44 -> 1.6452810360417196 | C45: =F44 -> -256.71696865227597 | D45: =DEC2HEX(B45*C45) -> FFFFFFFE5A | E45: =C44 -> -214.62550574256028 | F45: =B45*C45-E45 -> -207.74605441114596 | G45: =DEC2HEX(F45) -> FFFFFFFF31 | H45: FFFFFFFF33 | I45: =HEX2DEC(H45) -> -205
A46: 41 | B46: =B45 -> 1.6452810360417196 | C46: =F45 -> -207.74605441114596 | D46: =DEC2HEX(B46*C46) -> FFFFFFFEAB | E46: =C45 -> -256.71696865227597 | F46: =B46*C46-E46 -> -85.083674982873731 | G46: =DEC2HEX(F46) -> FFFFFFFFAB | H46: FFFFFFFFB0 | I46: =HEX2DEC(H46) -> -80